id,bid,user_id,用户昵称,微博正文,话题,立场倾向
5090804110721410,OC6ef31FE,2822805792,顾文豪,孕妇也好还是其他人也罢，如果公共卫生间不方便时，应当予以必要的帮助，这不仅仅体现了服务行业倡导的来着都是客的服务宗旨，同时也让他人感受到服务行业带来的社会温暖与人性化关怀！,"孕妇2次到店借用厕所和店员起争执,职场人vlog,亿点曝光计划",支持
5090802721624668,OC6c06OEk,2587647225,清涵怡韵,这个事就好比给老年人让座，不是无条件无底线的，不是你是弱者所有人就得贡着你,孕妇2次到店借用厕所和店员起争执,中立
5090801787605107,OC6auvUr1,1845864154,看看新闻KNEWS,10月16日，云南昆明。一咖啡店店家发视频称：一位孕妇一早来借用厕所，当时刚开张让其使用了卫生间。中午，她第二次来借用厕所，但并没有询问店员，店员提醒卫生间不对外开放，并告知外面有公厕，对方称自己是孕妇憋不住了，要怎么样？两人发生争执。随后被孕妇和其同行男子辱骂，并拍视频发布网络，对店进行差评。对方则称：公共厕所被锁起来了才来的咖啡店，是商家态度恶劣在先。怎么看孕妇2次借用店家厕所和店员起争执？,怎么看孕妇2次借用店家厕所和店员起争执,中立
5090799997946494,OC67Bxlfg,6065540024,优选恋爱,你会时来运转，迎接好运,孕妇2次到店借用厕所和店员起争执,中立
5090799438791550,OC66HAT5c,7824409187,一头倔强的狐狸,xxn果然版本t0，大肚子全世界围绕你转，太阳也围绕你转？店家告诉你外面有厕所，还要怎么样？给你惯的,孕妇2次到店借用厕所和店员起争执,"
强烈反对"
5090792656078595,OC5VLpvjR,7461028071,晚吟多看是山回_,首先厕所不对外开放，其次人家店员在第一次借用厕所的时候同意了，第二次来不借就这个态度？咋滴，想着我都是孕妇了你必须让着我是吧,孕妇2次到店借用厕所和店员起争执,"
强烈反对"
5090791778943175,OC5UlBwwL,5325610756,搞笑优选,刷到不要无视本周你会收到一笔超级大的💰然后会暴富,"孕妇2次到店借用厕所和店员起争执,转发接龙开新年",中立
5090791125682549,OC5TinQi1,7693976224,发财树来福猫一起环绕,第一次好心借用当成随便了以为当个孕妇谁都要伺候你呀外面公厕为啥不去你孩子咖啡店的啊,孕妇2次到店借用厕所和店员起争执,反对
5090789784819585,OC5R8kdNf,7636214130,kiku_祎个糯米团,这个问题的源头可以追溯到夏朝。因为不管夏朝的秦始皇的切面是否具有放射性，但是汉武帝的双截棍确实可以弹出星星一颗两颗三颗连成线，而且用微积分加工的量子榔头也能对小泉狼开窍具有一定的深沟效应。我们后来通过对恒河水的解析中发现了能使放射性物质在第三方接触中区分,孕妇2次到店借用厕所和店员起争执,中立
5090789695424067,OC5QZmL2X,3564399231,是橘子冰沙,你是孕妇又怎么样借上个厕所就不能跟人家说一声吗而且人家店里的厕所不对外开放,孕妇2次到店借用厕所和店员起争执,反对
5090789287265068,OC5QkutYw,7497369600,法师LawyerZ,身为🤰🏻我还是挺感同身受的真的自从怀孕这个膀胱完全就是一个随时要炸掉的状态啊根本储存不了什么尿喝一点点水不到二十分钟必定要尿尿而且🤰🏻不能憋尿说对肚子里的👶🏻不好啥的和唐律去外面玩，不是在找🚾就是在找🚾的路上所以一般我都是在商场🏬附近玩我脸皮薄真的不好意思去别人店里蹭🚾一般要买东西或者去店里吃东西才好意思去上热搜这个🤰🏻多少是有点过分了人家都让你上了一次了虽然你是很急但是第二次别人拒绝你也是可以的啊还拍视频准备“网暴”别人店没想到最后被“网暴”的是自己律师超话,"孕妇2次到店借用厕所和店员起争执,湖南曾律师,lawyer z的法言闲语","
反对"
5090778810417739,OC5zr1KFJ,6198576796,玩游戏的呆酱,em我觉得你至少买一杯咖啡呢？？？店家不对外开放，让你用一次已经很照顾了，第二次问都不问直接用，就是素质问题了吧……还要反过来倒打一耙，又不是你家的，为什么要惯着你呢？？。。。,孕妇2次到店借用厕所和店员起争执,"
强烈反对"
5090778059113958,OC5ydCeXk,1514696174,温柔的夜11,这个孕妇一看就是活得不咋滴，一个是怀孕了还要出来为生活奔波，条件肯定不好👎另外呢，就是平时连个固定的上厕所的地方都没有，这得有多惨。,孕妇2次到店借用厕所和店员起争执,中立
5090777652789834,OC5xzbHLk,5604967940,非纾,搁这儿玩一回生二回熟呢，连问不问了,孕妇2次到店借用厕所和店员起争执,中立
5090764943788624,OC5d4fTAQ,6068366308,毅毅的依依,第二次买杯咖啡，虽然孕妇最好不喝咖啡，但是不是还有一位同行的人吗，请他喝就行了！再礼貌的询问店家，可不可以再借用一下厕所！这样会不会就没啥可闹的了！,孕妇2次到店借用厕所和店员起争执,中立
5090764920983336,OC5d247Og,3195264674,人间烟火气天上神仙颜,万一摔倒怎么办，而且去人家店上厕所，还不客气点，还和店员吵架，一个孕妇给你厉害的,孕妇2次到店借用厕所和店员起争执,"
反对"
5090764823202522,OC5cSdr7A,6510119885,天津老张,孕妇、孕妇、孕妇！重要的点说三遍，她可是孕妇，这是重点！,孕妇2次到店借用厕所和店员起争执,中立
5090764669321661,OC5cCD6Zn,6169916866,恭主在桃,孕妇：我是孕妇我最大，我去你家咖啡店上厕所是看得起你，你就该恭恭敬敬的欢迎我，不然就是不尊重孕妇，没有爱心，我就要批斗你，给你店打差评，还要号召网友避雷你，让你知道自己的错误。好颠,孕妇2次到店借用厕所和店员起争执,强烈反对
5090764637339854,OC5czuNqK,7673951412,年糕的铲屎官阿米,人家都说了不对外开放，难道怀孕了世界就得围着你转吗？,孕妇2次到店借用厕所和店员起争执,"
反对"
5090764314642895,OC5c3jtPp,7896101236,玩在野Kaka-,咖啡店卫生间本来不对外开放，让这个孕妇用了就已经承担风险了，但凡在店里摔倒了，赖着人家要赔偿咋办，虽然不是所有孕妇都这样，但也不是没可能，有点基本礼貌都知道买杯咖啡就行，还想着发视频引导网友,孕妇2次到店借用厕所和店员起争执,"
反对"
5090750058201808,OC4P3ypFe,6116597616,冰美式不加冰1019,看到网友都支持店家就放心了，说明网友还是明事理的,孕妇2次到店借用厕所和店员起争执,中立
5090749869984162,OC4OKFTkS,3073828105,橙妮妮style,拍一个视频就能制造舆论，孕妇自己情商低啊，借厕所都那么理所当然？外面有公厕不上？人家自己的店凭什么要给你上，不让你上你就拍视频网暴人家？傻波一。,孕妇2次到店借用厕所和店员起争执,强烈反对
5090749344911064,OC4NUkBAI,7807409604,Rainbow_兰兰,她怀孕不知道能不能买咖啡喝,孕妇2次到店借用厕所和店员起争执,中立
5090749202303607,OC4NG9FgX,7807409604,Rainbow_兰兰,孩子不是大家的，照顾包容孕妇是人的善，但不是你可以用来道德绑架的绳子,孕妇2次到店借用厕所和店员起争执,中立
5090735026078683,OC4qOpvlh,7841037199,退休返聘人员dwww,怀的是徐志摩还是林徽因,孕妇2次到店借用厕所和店员起争执,中立
5090734982039439,OC4qK8yyb,6017039240,梁新评,这和店家的经营理念以及经营状况有关，经营理念开放本着来的都是客、这次不是下次也是，每一个顾客都是有价值的，都是潜在消费者，以及经营状况比较好的情况下，一般都无所谓。如果经营理念不开放，觉得当下不消费那就不是客，就没有价值，不是潜在消费者，那就比较在意，比如用水成本打扫卫生等等。再加上如果生意不好，那就更在意了，每次不消费那都是成本增加，都是钱在减少，都是损害利益。当然这个无可厚非，这是人家自己的经营场所，人家具有管理权。你如果对商家这点介意的话，你想一下，你去有些写着为人民服务的那些地方，你说要上厕所，你看保安让不让你进，更何况一般商家。怎么说呢？第1次让使用了，第2次着急的话其实都不用争执，买一杯咖啡，然后上个厕所也不是问题。应该感谢人家让用了一次，倒也不必因为第二次没让使用曝光人家。这事很简单，就看人家有没有这个义务，没有义务，那你就没有指责别人的权力。就跟坐在普通座位上一样，让坐是情分，不让呢也是本分。,孕妇2次到店借用厕所和店员起争执,中立
5090734301252313,OC4pE5fMB,5883188038,墨迹_小布点儿,这样的人咋还生孩子？能教育出什么样的娃哦,孕妇2次到店借用厕所和店员起争执,"
强烈反对"
5090734145537762,OC4poneCK,2711065913,宋小楠super_楠,唉，有些人呀总仗着自己身份特殊，好像全世界都得给你让道一样！你是孕妇也好，你带着孩子也罢，出门在外最基本的礼貌要有的！不要轻易给别人添麻烦每个成年人最基本的素质！,孕妇2次到店借用厕所和店员起争执,"
强烈反对"
5090733868189571,OC4oWymtR,3936528530,穗穗穗要开心,随心小站超话孕妇嘛有时候身体确实不舒服，理解下吧,孕妇2次到店借用厕所和店员起争执,中立
5090720019645531,OC42BEtf5,6198533474,采用最重要,基本的素质都要问一下店员吧不能不讲理吧,孕妇2次到店借用厕所和店员起争执,中立
5090719646352126,OC420qEtE,1734461797,taomantao,这里面被锁起来的公厕呢？什么地方的？是不是开放时间？孕妇怎么不骂公厕？,孕妇2次到店借用厕所和店员起争执,中立
5090719513446113,OC41Nesut,2547894491,短腿老姨,到底是什么奇葩没素质的人在生孩子啊。。说好的优生优育呢，以后遍地熊孩子,孕妇2次到店借用厕所和店员起争执,"
强烈反对"
5090719201493871,OC41i6gCH,6032516480,好笑又可爱的女孩子,咋了孕妇怀的是店员或者咖啡店老板的孩子吗,孕妇2次到店借用厕所和店员起争执,中立
5090718853629143,OC40Jfe6z,7567062613,kiku-初见她姓韩,不要打着你是孕妇的名义道德绑架好嘛现在公厕那么多你就一定要去找人家咖啡馆的事情吗,孕妇2次到店借用厕所和店员起争执,"
强烈反对"
5090696090878077,OC3q13Gqx,2770930607,财勤勤,好好说话嘴甜好办事。这么倔？以为世界都要围绕你转吗？还撒谎说公厕关闭了？人家一会找出证据甩你脸上。。去咖啡店的厕所肯定是因为干净，人家开门做生意的肯定要照顾以下生意再用。两口子都挺倔。。。。,孕妇2次到店借用厕所和店员起争执,"
强烈反对"
5090695843152033,OC3pCddZf,7917261839,嘉颖-因为他是Leo,很难想像这样的人教育出来的孩子是什么样的，是孕妇谁都可以让，毕竟是需要关照的群体，但也得看孕妇本人的素质吧，哪怕说一句谢谢的话语，或者买一杯饮品，也可以的嘛,孕妇2次到店借用厕所和店员起争执,"
反对"
5090694832062836,OC3nZ8EDy,1371163915,枣庄在线,女子两次去咖啡店上厕所，被店家抱怨后在网上多平台给差评！,"孕妇2次到店借用厕所和店员起争执,热门视频",中立
5090691127968232,OC3i0xqTS,1046327942,闲着也是闲着9999,去一次是急茬，第二次就是找茬了。,孕妇2次到店借用厕所和店员起争执,"
反对"
5090661724586254,OC2wAjf5Q,7866279870,pikaqiu-_,公厕锁门？处理二人纠纷的时候，记得查查公厕问题。,孕妇2次到店借用厕所和店员起争执,中立
5090661720129734,OC2wA0xKu,3987488108,蒸小爽殿下,有没有觉得这种的也挺可怕的，万一出个啥事肯定还得找你赔偿吧,孕妇2次到店借用厕所和店员起争执,中立
5090649686933719,OC2dat5Mb,6393590115,恰饭点虾滑a,孕妇的态度就很有问题哇,孕妇2次到店借用厕所和店员起争执,中立
5090649017156866,OC2c5u1Pk,1954264317,HEMERACookie,她家小孩儿以后一定是高铁熊孩子,孕妇2次到店借用厕所和店员起争执,中立
5090648468226237,OC2bcyw1f,7400011630,用户7400011630,大早上刚营业，第一单还没成交就迎来一泡尿，真的晦气死了，你哪怕先买个咖啡给人开个张，然后再去上厕所也行。对于有些做生意的人来说早上第一单真的很重要，代表了一天的财运,孕妇2次到店借用厕所和店员起争执,中立
5090641686824397,OC20gsDkV,1221707263,刘继兴,买上一杯咖啡，就不会争执了。简单的事，就别弄复杂了。,孕妇2次到店借用厕所和店员起争执,中立
5090641191895757,OC1Zt7XaJ,5607840348,翻白眼儿的老精灵,未成年、孕妇、老人……不是所有老弱病残孕都值得去帮助和尊重！勿喷，只针对这三类人群中的那部分极品！,孕妇2次到店借用厕所和店员起争执,中立
5090640259449011,OC1XXDE7p,1117603003,现在蔚蓝,不要把别人的帮助当成理所应当,孕妇2次到店借用厕所和店员起争执,中立
5090639524135863,OC1WMhlVt,6417124191,祈愿琴酱,孕妇咋了孕妇出门在外就可以有免死金牌了啊开什么玩笑,孕妇2次到店借用厕所和店员起争执,反对
5090629506302354,OC1GCqrwS,7441005155,失眠叙禹,虽说是孕妇🤰在社会上应该对你有所关照，但是开店是为了营业的，店员也解释了不对外开放，外面有公厕。结果随行的就直接开口大骂，怎么你是孕妇就得全世界都围着你转吗,孕妇2次到店借用厕所和店员起争执,反对
5090629430542386,OC1Gv2h6a,7441005155,失眠叙禹,不要以为发到网上就是你对了，网友都会变辩是非的，店家的做法没有问题，别来道德绑架，真没有素质！,孕妇2次到店借用厕所和店员起争执,"
强烈支持"
5090629326211191,OC1Gkq3Ov,7521411859,E-橘彦橘语,就算是是特殊人群也得讲道理的，不是说因为孕妇就有理，礼貌和尊重都要懂吧,孕妇2次到店借用厕所和店员起争执,中立
5090629180983971,OC1G647Yv,3283612415,超能冲击波,你好歹借用人家厕所态度好点啊，而且人家是做生意的你同行的人买点啥东西能不让你用？什么人啊真的是，别人店家又不欠你啥,孕妇2次到店借用厕所和店员起争执,反对
5091876317692618,OCy7Bwhcu,5744238002,海曙检察,10月16日，云南昆明。一咖啡店店家发视频称：一位孕妇一早来借用厕所，当时刚开张让其使用了卫生间。中午，她第二次来借用厕所，但并没有询问店员，店员提醒卫生间不对外开放，并告知外面有公厕，对方称自己是孕妇憋不住了，要怎么样？两人发生争执。随后被孕妇和其同行男子辱骂，并拍视频发布网络，对店进行差评。对方则称：公共厕所被锁起来了才来的咖啡店，是商家态度恶劣在先。星视频的微博视频的微博视频,孕妇2次到店借用厕所和店员起争执,中立
5090798597309003,OC65luFp9,6734915688,wo居居,有些孕妇真觉得社会每个人得给你的崽让路。不是，你谁啊，你崽又不是我们的，凭什么让你,孕妇2次到店借用厕所和店员起争执,反对
5090798284310653,OC64Qi5oF,1600323734,俗家方丈,第一次让用了，第二次就不对了。,孕妇2次到店借用厕所和店员起争执,中立
5090798246825100,OC64MsDwg,5893283902,每天自拍照,不管什么心愿点赞都会显灵！🙏,孕妇2次到店借用厕所和店员起争执,中立
5090797271910650,OC63d812W,5446697143,霁琶雾水,第一次去了，第二次还是同一个店？咋滴，就一直待在咖啡店门口不走等着上厕所？,孕妇2次到店借用厕所和店员起争执,"
反对"
5090788786834811,OC5PwsG2T,7779743265,亚亚祉亚-,还好有监控不然就说不清了,孕妇2次到店借用厕所和店员起争执,中立
5090788681975254,OC5Pm8hQW,7568031489,Geakygoug_,按理说人家咖啡店只提供饮品和饮品一系列服务第一次给你上厕所是人家好心又不是人家义务再说一般餐饮店铺的厕所也不对外开放还辱骂拍人家视频发网上又罪加一等。。,孕妇2次到店借用厕所和店员起争执,"
反对"
5090788298721462,OC5OJAAQK,6424254735,吃货的世界Yaya,还好有监控，不然还说不清了，不是谁弱谁有理,孕妇2次到店借用厕所和店员起争执,中立
5090787115139570,OC5MPlz2i,6509274343,顺意姝秦好运暴富,正常人还是多的，看到大家都站店员我就放心了。一次借是情分，二次借且没有打招呼，这是真的没礼貌了而且在二楼，真出事了，还得是这家店负责吧说这家店生意不好怎么不见去找生意好的店借用厕所呢,孕妇2次到店借用厕所和店员起争执,中立
5090786338671061,OC5LzAnJP,6028824537,咖啡只喝桃心尖DY,帮助他人是道义，不帮是常理，别道德绑架别人。,孕妇2次到店借用厕所和店员起争执,中立
5090777407688303,OC5xawg4T,7509309571,一叶叶扁舟舟,借不借都另说，万一上厕所在咖啡店摔倒了算谁的？,孕妇2次到店借用厕所和店员起争执,中立
5090777393531118,OC5x9eOBw,3650837761,黑土轩,求人帮忙姿态放低这不是常识么，你孕妇孩子为别人生的？,孕妇2次到店借用厕所和店员起争执,"
强烈反对"
5090777237032555,OC5wTtvuj,6613101571,土豆-沒有土豆泥,不是，其实上班的厕所最好是不给别人用，有什么事承担不起，特别老人，孕妇🤰所以我很害怕人家来借用厕所又不好意思拒绝别人特别有的不知道感谢的,孕妇2次到店借用厕所和店员起争执,中立
5090764006625126,OC5byrNuS,6895576861,萌兔经济,不让我用厕所是你的规矩我遵守。实在憋不住，我来个现场直播也是我的自由。吐店里，相信顾客都会被恶心到走光，你别赖我就行。这样，彼此尊重，各自承担结果是最好的。你觉得呢？,孕妇2次到店借用厕所和店员起争执,中立
5090763669245932,OC5b0CNhW,5830025158,不二傻瓜H2O,这种人能不能别生孩子给社会添麻烦,孕妇2次到店借用厕所和店员起争执,"
强烈反对"
5090749116842296,OC4NxsHZC,5886024092,电子巫师Sam,这种人就不懂感恩、第二次去买杯咖啡就能解决问题，反过来还要辱骂店家或者你礼貌性的问一下人家，不好吗？,孕妇2次到店借用厕所和店员起争执,"
反对"
5090748798340583,OC4N1yZLx,6516370770,星星掉兜里了喵-,哎哟喂真把好人逼疯了🫰🏻🫰🏻🫰🏻,孕妇2次到店借用厕所和店员起争执,中立
5090748745648548,OC4MWnHrC,6410104522,小奈春涉,又不是公厕凭啥要一次次借用啊好歹消费一下呢？孕妇也分有素质和没素质的,孕妇2次到店借用厕所和店员起争执,反对
5090748355318252,OC4Mjmjwg,6684143334,战星球的小王子,我们也遇过这种，第一次来借厕所，让去了，以为会消费，结果出来直接走了，谢谢也没一句，第二次来问都不问就进了，也是直接完事就走，之后再来几次我都拦住了，告诉厕所堵了，在维修。真的很无语这种不消费的，又不是公厕,孕妇2次到店借用厕所和店员起争执,中立
5090748282437933,OC4Mcaedv,5936638095,D努力不懈的白羊玲C,即使是孕妇，询问人家一下是应有的礼貌，再不济买点东西也可以呀，这样一声不响的确实不礼貌。而且还去了两次，人家生气没毛病。,孕妇2次到店借用厕所和店员起争执,"
反对"
5090733797148249,OC4oPtZAl,7934056763,提拉鱼苏_,孕妇怎么了第一次别人已经方便你了第二次随便买点什么东西就好解决的事为什么觉得怀孕了全世界就得让着你啊而且外面又不是没有公厕你要是在人家店里摔着了怎么办谁负得起这个责任,孕妇2次到店借用厕所和店员起争执,反对
5090733645628374,OC4oAnCce,5875151550,捕捉到一只嬷嬷,第一次不是二话不说就让你去了吗？第二次是你没打招呼在先啊没礼貌在先还要挂别人自己网暴自己倒也少见而且就算不借也可以理解万一你在店里滑倒了要店铺赔钱呢？帮是情分不帮是本分,孕妇2次到店借用厕所和店员起争执,中立
5090733621512601,OC4oy6luN,7247841473,你算哪棵大瓣蒜,肚子里的孩子店员也有份？,孕妇2次到店借用厕所和店员起争执,中立
5090733562529284,OC4osaBYU,6612161751,圈内橙子,不能因为自己是孕妇就这样,孕妇2次到店借用厕所和店员起争执,中立
5090733504333241,OC4omibgZ,2867469152,沐梓熙Y,绘食小筑超话元气早餐超话Morning✧⁺⸜⸝⁺✧～热爱不会过期，志趣相投的人总会相遇。失眠了，大概凌晨二三点睡着，五点半醒了，简单的早餐，来杯咖啡提提神。今日早餐：鹰嘴豆烤肠硬欧/鸡蛋➕蜜橘/奇异莓/菇娘果/小番茄/阳光玫瑰➕咖啡@独一无二_茜妞,孕妇2次到店借用厕所和店员起争执,中立
5090733426214011,OC4oeq4xZ,2155709235,__秋天别来,不能因为自己是孕妇全世界的人都得让着你，出门在外多一份尊重都能解决，赖你自己太没礼貌。,孕妇2次到店借用厕所和店员起争执,"
反对"
5090733061047914,OC4nE4oBQ,2686103261,Goldenlim,就不应该打马赛克，露脸让大伙看看…还发到网上想让人网暴店家嘛,孕妇2次到店借用厕所和店员起争执,中立
5090718653876790,OC40pggwS,5893123995,藏在面具后,所以即便是一个孕妇，也不是一盏省油的灯。人家这不是对公厕所，如果自己确实是迫不得已的情况下，这几乎是在求别人帮忙帮助，那更应该小心谨慎，礼貌周到。而不是理直气壮，恶语相加。显然，这名孕妇连最基本的社交礼仪都没有做到。,孕妇2次到店借用厕所和店员起争执,"
强烈反对"
5090718095771123,OC3ZvodkD,7560092512,无眠__小羊,商家没有义务给你提供🚾啊,孕妇2次到店借用厕所和店员起争执,中立
5090718066673191,OC3Zss007,6344095230,花花小狗凌汐,人生最大善果，不是超越某一人或某一事，而是超越这多苦多难的世道。无计较之心，心常愉悦；尽心之余，随缘起止，随遇而安，心常满足。你随和，愉悦的是自己的心；别人计较，苦闷的是他自己。一天的心情靠随和，一生的幸福靠随缘。,孕妇2次到店借用厕所和店员起争执,中立
5090717729030575,OC3YUBTgr,3916262117,雾里挑灯看落花,对生意人来说，开张了你可以去用，没开张来借东西要多晦气有多晦气。,孕妇2次到店借用厕所和店员起争执,中立
5090717195831060,OC3Y3osVm,7608462518,高冷魔芋爽,为啥要辱骂店员啊人家有的店厕所又是不供应的啊而且也跟你说有公共厕所了,孕妇2次到店借用厕所和店员起争执,反对
5090716852422164,OC3Xvaa7a,7557616786,湫日狂想曲,我的妈呀这就有点过分了,孕妇2次到店借用厕所和店员起争执,中立
5090716355133792,OC3WHlxx6,6178091811,浪店过客,咖啡店完全可以告他们敲诈勒索，赔偿差评带来的经济损失。有些人不能惯着他们，用视频，发差评，辱骂别人，这就已经扰乱商家正常的经营秩序，完全可以报案。,孕妇2次到店借用厕所和店员起争执,"
强烈反对"
5090647289103569,OC29iCcfL,7856171051,颂椿肆园_,俩人都有错吧店员不让可能是规定又不是他能决定的但其实也可以根孕妇好好沟通但孕妇开口骂人就有点那啥了总不能因为是孕妇全世界都得让着你吧,孕妇2次到店借用厕所和店员起争执,中立
5090639500280398,OC1WK1aWy,5893057439,一口娱乐,怀孕，如果进去摔了啥的，肯定又要说是店家的责任了，最怕这种了,孕妇2次到店借用厕所和店员起争执,中立
5090639404336940,OC1WAiceE,7896232493,弋熙云歌,孕妇在咖啡店用厕所被拒，和店员吵起来，这事让大家讨论孕期需求和商家权益怎么平衡。,孕妇2次到店借用厕所和店员起争执,中立
5090638538475382,OC1VbzyPI,7161500423,Eric方塊,人家的店，願意借就客氣點用，不願意就老實去外面公廁,孕妇2次到店借用厕所和店员起争执,中立
5090637292768028,OC1TbbC5C,7417229424,第六道彩虹,这么不讲理的东西干脆开始就不要借给她免得在店里磕了碰了讹人怀个孕以为成了地球之母了,孕妇2次到店借用厕所和店员起争执,强烈反对
5090637236667917,OC1T5rYD3,5513059574,_步步清风_,不要把别人的帮助当做理所当然，就是说你呢，孕妇不是你道德绑架的别人的借口,孕妇2次到店借用厕所和店员起争执,中立
5090636325717840,OC1RCnZte,1767434985,栗子熊软糖,就挺不理解的，虽然是孕妇但都说了不对外开放而且有公厕，为什么还要闹…,孕妇2次到店借用厕所和店员起争执,"
反对"
5090628469260650,OC1EWCR7k,5911907308,寰宇WHITE,我们这边青城驿站，很多，不会让人想上厕所而找不到地方憋的。,孕妇2次到店借用厕所和店员起争执,中立
