id,bid,user_id,用户昵称,微博正文,话题,立场倾向
5090709248672466,OC3LeAo6u,5252848511,藏蓝观察,藏蓝视角超话礼貌和怀孕应该不冲突吧？10月16日，云南昆明。一咖啡店店家发视频称：一位孕妇一早来借用厕所，当时刚开张让其使用了卫生间。中午，她第二次来借用厕所，但并没有询问店员，店员提醒卫生间不对外开放，并告知外面有公厕，对方称自己是孕妇憋不住了，要怎么样？两人发生争执。随后被孕妇和其同行男子辱骂，并拍视频发布网络，对店进行差评。对方则称：公共厕所被锁起来了才来的咖啡店，是商家态度恶劣在先。的微博视频,孕妇2次到店借用厕所和店员起争执,中立
5090708876690494,OC3KDs4vc,1657817542,波若悟心经,昨天就看到她在XHS发了，当时评论区的都在说她，人家给你借了一次了，你第二次还去，就算要去，态度好点，或者买杯咖啡的事儿，她就一直解释说她第二次有询问过店员，是店员同意她才去的，当时她的视频内容是店员凶神恶煞的让给钱，就没有店家的视频，我翻完评论很难评就闪了，这哈看人家店家发出的视频，额……怀着身孕为啥要自己网爆自己，其实很简单的事啊，真的就如网友们说的，你第二次去的时候买杯咖啡或者其他饮品，在人家店里坐坐，说我在借用个厕所，人家也不会为难你的，开门做生意，没人会因为这种事赶客，但是，人家允许了一次，你第二次招呼都没打去了，人家说你了，你态度好点，不要反咬人家，至于么。,孕妇2次到店借用厕所和店员起争执,"
反对"
5090708199048023,OC3JxBXNR,7292585059,一直牵着许凯的手so,恶人先告状怎么还好意思录视频啊,孕妇2次到店借用厕所和店员起争执,中立
5090708065878875,OC3JkoFmz,2796293177,认真长大的孩子最有魅力,恶人先告状，怎么还好意思录视频，如果这个孕妇用人家厕所摔了，绝对会讹人店铺吧,孕妇2次到店借用厕所和店员起争执,"
强烈反对"
5090633113142406,OC1MrdbtY,7868299921,心緒電波,商家有啥义务一定要给你提供🚾，求人口气还这么差而且一天去俩次人家店里，怕不是简简单单的公厕被🔒吧,孕妇2次到店借用厕所和店员起争执,"
强烈反对"
5090632995701790,OC1MfnVim,6019933840,忘惜饼饼-love,我就说生小孩的都是蠢货,孕妇2次到店借用厕所和店员起争执,强烈反对
5090632391721314,OC1Lh7dN8,7507025756,桃酥甜豆,孕妇也不是免死牌，有时候也得合情合理吧,孕妇2次到店借用厕所和店员起争执,中立
5090632042809644,OC1KIbMUQ,5689237211,愿做薰衣草LJ,小红书就刷到了，首先不是店员让她怀的，其次不是店员让她怀的，最后不是店员让她怀的，私人洗手间，第一次来让她去了，人家开店的，第二次不说消费了，直接问都不问就跑去人家私人的地方要上厕所，告知后还和其老公一起辱骂店员，说她是孕妇忍不住，就该给她免费用，谁让她是个孕妇，她为什么憋不住?因为她怀孕了，谁让她怀上的?她老公让她怀的，她有事不去找她老公麻烦，跑去辱骂人家店员，一毛没花还给个差评说人家服务不好，嗯……,孕妇2次到店借用厕所和店员起争执,强烈反对
5090618088625130,OC1ocAbN0,6370448206,心随你动DW,杨绛先生说：砸了别人的锅，自己也不一定能吃饱，吹灭了别人的灯，也未必能照亮你自己，堵死别人的路，你也不一定能跑多远。所以这人呀，做损人不利己的事，不仅诋毁了别人，也损害了自己的名声。有一句老话说得好，互相搭台，好戏连台；互相拆台，大家垮台。在人生这个大舞台上，不会搭台的人，注定无法走很远。抓起泥巴扔别人的时候，最先脏的一定是自己的手；拿起鲜花赠给别人的时候，首先闻到花香的也是自己。人活着，拼得就是格局。,"每日一善超话,孕妇2次到店借用厕所和店员起争执",中立
5090615824745230,OC1kyjUrY,3344598572,退役魔法少女ice,极好720，⑪年老🐭，可蹭，🚫快转🧱👍🏻🍎互动十五字以上更容易涨哦‼️0善良是一束美丽的玫瑰，当你赠送他人时，也为你自己留下下了满室的芬芳；善良是冬天里的的太阳，在照耀了他人人的同时，也温暖了你自己。,"熊猫守护者,孕妇2次到店借用厕所和店员起争执",中立
5090773157285823,OC5qjuznh,2049257122,一念询心,这是人家的店铺，借不借都是人家说了算，借是情分，不借是本分更何况之前已经借过一次了，第二次不打招呼就去用，真把那里当自己家了这是人的道德问题，但凡买点东西，再好好问问，也不会闹出这样的事情,孕妇2次到店借用厕所和店员起争执,反对
5090772947045340,OC5pYtyOw,2416327412,仅此一颗甜柠檬,店内的厕所不是公共厕所，如果孕妇实在没有办法了，可以跟对方友好协商一下，或者说你在人家店里买一杯咖啡是不是更好一点？孕妇是弱势群体没错，合理和适当的帮助基本上大家都没有意见，若是觉得别人要理所当然帮助你可能就要遭拒了。,孕妇2次到店借用厕所和店员起争执,中立
5090772734968389,OC5pDkQvj,6585115961,两个傍晚的月亮017,礼貌问一声说一下理由一般店家一般都会让你用，但是她就不懂感恩、第二次去买杯咖啡就能解决问题，结果反过来还要辱骂店家而且店内的厕所本来就是满足本店消费者为先。,孕妇2次到店借用厕所和店员起争执,反对
5090759491192998,OC54h50lU,7889859811,下雪许圆,其实多一点礼貌就能解决的事情！当成理所当然，就过分了,孕妇2次到店借用厕所和店员起争执,中立
5090759285932472,OC53WoTj2,6459915517,幽人052888888,现在很多孕妇出门都牛气哄哄的。有一次不知道那个女的怀孕，在人挤人的地铁，被她一把推开差点跌倒，然后她很生气的说，没看到是孕妇吗？离我远点,孕妇2次到店借用厕所和店员起争执,"
强烈反对"
5090759223806699,OC53QfYin,6180142758,-你舅宠她吧,………有次下大雨，小卖店让我进去躲雨，我都不好意思，硬是买了两包辣条,孕妇2次到店借用厕所和店员起争执,中立
5090759216728763,OC53Psesr,1222984641,作家-赵凝,多替别人着想，都温和善良点比较好。,孕妇2次到店借用厕所和店员起争执,中立
5090759130745223,OC53H37RJ,3123586944,末路半夏,一般不会去借人家做生意的卫生间，何况周围有公共卫生间,孕妇2次到店借用厕所和店员起争执,"
反对"
5090758801754247,OC53a7mmj,6587558218,吃一颗小草莓耶,咋滴？以为店里是公共厕所么？随心所欲的用还不用打招呼，基本的礼貌都没有？你弱你有理？道德绑架还没完了,孕妇2次到店借用厕所和店员起争执,强烈反对
5090745140906805,OC4H83NTT,5448011309,傅诗淇家小甜心,又开始道德绑架啦。😭😭😭,孕妇2次到店借用厕所和店员起争执,中立
5090744874041952,OC4GHgXuM,2674552303,ice绿茶-lou,上午还没开张就让你借用卫生间就已经很不错了，接二连三去用还真以为自己家了,孕妇2次到店借用厕所和店员起争执,反对
5090744831840517,OC4GD7INL,1654390461,橘子洲头cccu,又抠又没素质，说的就是这个孕妇,孕妇2次到店借用厕所和店员起争执,强烈反对
5090744417653697,OC4FXw74J,7850873352,采薇比个心,不要道德绑架给你用是情分不给你用是本分,孕妇2次到店借用厕所和店员起争执,中立
5090744324850399,OC4FOklOf,6645601060,一级若无其事大师,不管是不是着急，提前跟店家说一声是最基本的礼貌，这是店家的厕所，不是公共厕所。不提前跟店家说一声就擅自用厕所如果店里丢东西了责任算谁？,孕妇2次到店借用厕所和店员起争执,"
反对"
5090744318561124,OC4FNzV8E,5155213447,徐笑笑笑笑笑起来,这么没素质啊，那就祝福这位孕妇两年三胎，五年六胎,孕妇2次到店借用厕所和店员起争执,强烈反对
5090744260105400,OC4FI0rq0,5848736282,吐槽情报局,这位孕妇，我就问你一句：已经怀孕九个月，如果你进去上厕所不小心摔倒了，怎么办？会不会要求店家赔偿？,孕妇2次到店借用厕所和店员起争执,中立
5090729005154631,OC4h6lCXd,1825981347,ligushmfssahkbz,我也遇到过，小时候遇到了一女的，来我家厂里上厕所，我家院子大，告诉她在后面，而且家里有只小狗狗，但是栓住了不用怕，她上完厕所，不但不谢我，因为小狗叫她，还骂我家狗熊死狗滚，气的我说她为什么要骂狗狗，她给我闹起来了，还把他老公喊来和我闹架，夫妻俩说我没出过门，出门不找厕所，骂我全家出门被诅咒，我说，厕所给你上了，给你闹架是因为你骂小狗，而且狗遇见陌生人都会叫，还栓住了，然后那个男的还想打我，然后他俩闹的太大了，我家工人们出来看，他看见工人没敢动手，现在每次想起来都后怕又来气，如果不让她进来上厕所，估计也没事，当时我还是个小孩，估计他俩也没把我这个小孩放眼里,孕妇2次到店借用厕所和店员起争执,中立
5090728407466230,OC4g8vkj4,7502312178,-娇绿,点进来第一反应是店员的错还好看了一下这孕妇。。。看在你怀孕的份上难听的话我就先不说了,孕妇2次到店借用厕所和店员起争执,中立
5090728311259503,OC4fZ5hEz,7711524344,-挽昑巷的祎-,感觉是双方沟通的问题，都退一步就好了。应该通过合理沟通来解决问题，而不是选择辱骂或网络攻击等不理智行为。搞不懂为什么要辱骂店员，人家都告诉孕妇了外面有公厕，还要来使用店里面的，万一出了什么事是孕妇的责任还是店里面的责任呢？,孕妇2次到店借用厕所和店员起争执,中立
5090728302349270,OC4fY9R9s,1849742040,今日推荐官,生出来的也是一条化骨龙,孕妇2次到店借用厕所和店员起争执,中立
5090706198103016,OC3GjxZXO,1168641102,长春西门大官人,10月16日，云南昆明一名孕妇到一家咖啡店借用厕所，虽然还未开张，但店员也好心让她用了。谁料她中午再次过来，不打招呼便直接进去了，把这当成公共厕所了啊？遭到店员质问后，她与同行男子开始辱骂店员，并拍视频对店进行差评，这不是恶人先告状吗？正常做法应当及时解释道歉才是，而不该联合同行男子对店员发泄情绪，不应该就这样给店家差评，纯纯的道德绑架。还试图引导舆论网曝咖啡店，你拿网友是傻子吗？还说人家没有善心，你有感恩之心吗？,孕妇2次到店借用厕所和店员起争执,强烈反对
5090631981203748,OC1KC539i,7599100457,我吃的才不多呢123321,离谱，第一次人家借给你了，第二次就理所当然的直接进去？你但凡买杯咖啡或者礼貌问下呢再次见证了生物的多样性,孕妇2次到店借用厕所和店员起争执,反对
5090631539755976,OC1JTEVYs,5124862609,甜蘸酱菜,公共厕所你嫌弃，硬要上人家的，用了还要说有本事就自己盘一个想怎么上就怎么上！人家让你用一次就不错了，是孕妇就应该让你啊！,孕妇2次到店借用厕所和店员起争执,"
强烈反对"
5090631498596909,OC1JPA4rP,6592070939,特别宅妹,不是你是孕肚就有理了..你一次就算了人家也没说什么你第二次又是这样你要是在里面出点啥事店要遭淹了无语,孕妇2次到店借用厕所和店员起争执,"
强烈反对"
5090772416206342,OC5p7q2yi,7551916078,机圈小红帽,礼貌问一声说一下理由一般店家都会让你用吧。。事后拿这种东西当挡箭牌还不知感恩。。,孕妇2次到店借用厕所和店员起争执,中立
5090772328120443,OC5oYy4uT,2251629492,苏默燃,就是说如果这孕妇自己不小心在厕所摔了，这个店是不是也得担责任。这种事情完全有可能发生，而且店家可能还得挨赔偿。所以从一开始就拒绝才是商家最优选择。,孕妇2次到店借用厕所和店员起争执,中立
5090772078298273,OC5ozyOL7,3852154444,兔卿家,别人不给你用你就别搞人行不行，万一你在里面摔倒了流产，你还要告别人把不开放的厕所给你用导致你流产了。,孕妇2次到店借用厕所和店员起争执,"
反对"
5090771942245787,OC5om9qen,1347116294,奶油蛋糕别太甜maggie,客客气气讲话不会吗？这么巧两次都要去咖啡厅的卫生间吗，或者这女的是附近商户？把人家的卫生间当自己的了吗？孕妇真是了不起的身份，好话都不会讲，怀了太子啊,孕妇2次到店借用厕所和店员起争执,"
强烈反对"
5090771891914993,OC5oh82aZ,6225990601,华哥评论,看到那个孕妇在咖啡店上厕所那事儿，真是让人无语凝噎啊！第一次嘛，店还没开门，店员好心让她用了，挺理解的。可第二次呢，她二话不说就直接闯进去，这也太不懂礼貌了吧！按理说，她应该赶紧道个歉，结果呢，她还和一起来的那个男的对店员发脾气，这也太不文明了，真是的！,孕妇2次到店借用厕所和店员起争执,强烈反对
5090771049121834,OC5mUCh0m,7867815058,吙吙300,一般不消费，店里都不给用，合适就买个东西嘛！不然多尴尬。,孕妇2次到店借用厕所和店员起争执,中立
5090758628215067,OC52Syt75,1776121155,浮游胖达喵,那位孕妇好好看看大家的评论好好反思下吧。最好逐字逐句读出来也算是网友帮你胎教了,孕妇2次到店借用厕所和店员起争执,"
强烈反对"
5090758218483028,OC52dzAP2,7491476856,蘿小蔔·詩尼,借地方也要和店员说好啊～早上都借了～好好商量总会解决的吧～,孕妇2次到店借用厕所和店员起争执,中立
5090758038129927,OC51Vy6XR,2290929141,__西岚__,别生了生了以后也会是网上那种胡搅蛮缠的宝妈,孕妇2次到店借用厕所和店员起争执,"
强烈反对"
5090758033935595,OC51VgvPl,5746166656,b晴天y,这种人给她上厕所还拍视频想网暴人家，要是在人家厕所摔了不得讹死人家啊,孕妇2次到店借用厕所和店员起争执,强烈反对
5090743569878306,OC4EAFrNw,6543555678,一叶一舟子,为何总是有人喜欢，把别人的善意当成理所当然呢，帮人是情分不是本分，中华民族的传统美德的确是尊老爱幼，帮助老弱病残孕，但也不能披着这些外衣实行道德绑架呀，这孕妇但凡对店员客气点儿，或是在店随便消费点儿，这事儿基本上都不会发生~,孕妇2次到店借用厕所和店员起争执,中立
5090743360424951,OC4Eg1My3,7394391628,我就这芒样,虽然是孕妇但是不能为所欲为啊,孕妇2次到店借用厕所和店员起争执,中立
5090742942828604,OC4DAbRQE,5738158633,爱慕xiao荨盖,现在有的人就会得寸进尺，但凡每次都礼貌问一下人家会不给上？,孕妇2次到店借用厕所和店员起争执,"
反对"
5090728065895646,OC4fAoJJ4,1248543877,道源命理,把人家的善良帮助当做理所应当了！,孕妇2次到店借用厕所和店员起争执,"
反对"
5090727943998862,OC4fogMhM,6991251405,易学修行赏赏,很久以前我遇到的给自己怀孕妻子求药的私信。说实话，吓我一跳，谁敢给陌生孕妇药品吃啊，摆明就是下套！！！用特殊群体欺骗人！！！人性险恶，冷漠才是对自己最好的保护。,孕妇2次到店借用厕所和店员起争执,"
强烈反对"
5090727833373286,OC4fde9xQ,1235039890,寧缺毋濫5134,礼貌问一声和说一下理由，挻着个大肚子一般店家都会让你用的。应该是早上第一次用卫生间时没有留下好印象，不懂感恩才导致第二次受阻,孕妇2次到店借用厕所和店员起争执,中立
5090727468205604,OC4eCyqEs,7188247797,寰球镜头,不到人家店里消费，还去人家店里上厕所，这凭啥啊？更何况人家一开始也让上了一次。第二次直接去，和人家店主话都不说一句，当人家那里是公厕吗？别人的帮助是情分，不能当做理所当然。像这样没有感恩之心的，就不能惯着。,孕妇2次到店借用厕所和店员起争执,"
强烈反对"
5090727147340814,OC4e6uNGe,6325995552,送63朵玫瑰给迪,emm，这挺难评，大家认真看完再说吧，我差点看错,孕妇2次到店借用厕所和店员起争执,中立
5090727059263514,OC4dXCRRw,2015720451,超级无敌幸运召唤师,鲁迅先生说：“在狗面前，不要以为你善良，它就不咬你；在小人面前，别以为你是个好人，他就不坑你。良心是天生的。”,孕妇2次到店借用厕所和店员起争执,中立
5090631334232406,OC1JzhL2C,5377834845,幼稚鬼HYJ,本来想大家吐槽店家，结果引起对自己网爆，活该，没有什么是理所当然的，摔倒了谁负责？,孕妇2次到店借用厕所和店员起争执,中立
5090631204472850,OC1JmiLAK,6493591028,战总红顶天下,路上突然很急想上厕所，走来走去没找到，问一个买菜的小铺子哪里有厕所，大妈说她店里有，让我进去用。我出来硬是不好意思，买了一堆菜，拿着一路,孕妇2次到店借用厕所和店员起争执,中立
5090631106167317,OC1JcpSoR,1421163697,小美妞Clean,也不能你是孕妇就都要惯着你的……你礼貌点有素质点才会被关照……,孕妇2次到店借用厕所和店员起争执,"
反对"
5090770710954365,OC5mn40gZ,3547921977,三月廿四今日无雨,这孕妇不会做人，即使不是孕妇，在外面也难相处，用人家内部厕所两次，第二次就没想到先去人家店里买点东西，感谢一下人家的帮助，跟天王老子样，想用就用，,孕妇2次到店借用厕所和店员起争执,"
强烈反对"
5090770602428344,OC5mcabIQ,6477301381,纯情妹宝__,在去第二次的话我是真的会不好意思😬肯定会买一杯再说,孕妇2次到店借用厕所和店员起争执,中立
5090769734472136,OC5kNiLpe,6456703639,救援先锋玄德公,只要不是对外开放的卫生间，那就是店铺自己的，并且有公共卫生间开放的，就算维护也不可能全维护吧。两侧肯定还有的。她这是为了选择一个人少干净的走到这里，能选择还觉得急吗，这么急旁边上了还有机会吵吗。,孕妇2次到店借用厕所和店员起争执,"
反对"
5090769702489546,OC5kKarDY,5106319199,Ruirui喝茶不加糖,终于理解为啥英国的麦当劳上厕所要用点单小票上的密码了,孕妇2次到店借用厕所和店员起争执,中立
5090769264444378,OC5k2iEbw,7004584285,heegyuwonchae_,大公主以为全世界都得围着她转，怀了孕更甚，水灵灵的拍视频想让网友替她声讨，可惜网友们明辨是非~没有感恩之心也没有素质情商也低的人真的能当妈妈？别生出个怪胎,孕妇2次到店借用厕所和店员起争执,强烈反对
5090757681616412,OC51m6Mva,3242197187,做一个煎蛋-,最起码的礼貌要有吧，是你家吗说进就进，店家不承担风险吗，真是倒打一耙，这样的人也教育不出什么好孩子,孕妇2次到店借用厕所和店员起争执,"
强烈反对"
5090757557356356,OC519uRIU,7845418079,养鹅手册丞,还拍照发出来，得亏店里有监控，太坏了这两个人,孕妇2次到店借用厕所和店员起争执,中立
5090757383819583,OC50Sg1Eb,3958695291,釜山豆豆,孕妇宝妈是这样刻板印象了已经,孕妇2次到店借用厕所和店员起争执,中立
5090757176985200,OC50xtjaw,7458542541,是_小白呀,礼貌先询问，不是应该的吗？不要把别人第一次的友善当作理所当然！,孕妇2次到店借用厕所和店员起争执,中立
5090757115645307,OC50rnGBl,2237868912,隋英先吃饭,好歹在人家店里买个东西啊🙃,孕妇2次到店借用厕所和店员起争执,中立
5090742674391705,OC4D9iqtX,5699209179,爆扣你粑麻,借用厕所一句问话都不会没礼貌要是我是这家老板我也不借还要承担你万一摔倒的风险而且没礼貌的人没人会喜欢,孕妇2次到店借用厕所和店员起争执,"
反对"
5090742494305230,OC4CRi3Zc,7753082602,黎傲峰_爱音乐2022,微博大众评议超话咱就说不管如何都要有礼貌，第二次买杯咖啡会不会更好,孕妇2次到店借用厕所和店员起争执,中立
5090741911295222,OC4BV5qWG,7878306976,棠以言北,都说了不对外开放，第二次随便买一杯咖啡就行，居然还不打招呼就进，甚至辱骂店员，素质是没有的，道德绑架是一流的，周边人远离点这对夫妻吧，和白眼狼差不多，说不定什么时候就会被会反咬一口。,孕妇2次到店借用厕所和店员起争执,强烈反对
5090741894251152,OC4BThPUY,2779537603,Joyandgrass,别拿孕妇当借口！没素质就是没素质！小红书还打差评,孕妇2次到店借用厕所和店员起争执,强烈反对
5090726885460100,OC4dGmUq8,1426274585,韦飘飘,这种人适合在外面上厕所,孕妇2次到店借用厕所和店员起争执,中立
5090725815386749,OC4bXmBl3,7874748443,北京地母娘娘,在美国，星巴克不让路人上厕所，被判赔偿几百万美元。咖啡店开张营业，意味着所有人都是顾客，即使当天没买咖啡，也是潜在顾客。,孕妇2次到店借用厕所和店员起争执,中立
5090725442357339,OC4bm9TfB,2815594164,长谷川由纪,店家把你弄怀孕的？咋这么理直气壮呢？,孕妇2次到店借用厕所和店员起争执,"
强烈反对"
5090724842310154,OC4ao9GYy,5202542789,琪乐说育儿,您认为孕妇是否有权借用店铺厕所？,"孕妇2次到店借用厕所和店员起争执,健康登顶计划","
中立"
5090768035254336,OC5i3m2Tm,7160655436,-糯米绵-,干过一点奶茶店哈一般在操作台里面的厕所都是不对外开放的公司会监控没穿工作服的人都不能进来这个孕妇感觉太无理取闹了,孕妇2次到店借用厕所和店员起争执,"
强烈反对"
5090767872461686,OC5hNakoC,6937806984,慢慢即漫漫亦慢,我不买东西，是不好意思麻烦别人的,孕妇2次到店借用厕所和店员起争执,中立
5090757021797889,OC50i7xId,5699938592,晴天来送伞宝_____,又不是咖啡店员搞大了她的肚子，既然快生了为啥不好好的在家里休息….,孕妇2次到店借用厕所和店员起争执,"
强烈反对"
5090757020749507,OC50i38YP,7187194420,靴子里的长颈鹿,又不是怀了人家咖啡店老板的崽子，凭什么理所当然用人家厕所🙄社会对孕妇是应该稍微优待一些，但请记住，你只是怀了你家崽子爹的种，不是怀了全世界人的种，人家没有照顾你的义务。😒,孕妇2次到店借用厕所和店员起争执,"
强烈反对"
5090756903567898,OC506eYaK,7463636932,温润猫猫神,早上给你一个人情，让你去上个厕所，你中午就可以不打招呼，直接奔人家店里厕所吗？你把人家店里厕所当公厕用啊，外面有公厕还不去。这个东西明明是说几句好话，人家就会酌情通融的，而且人家也怕孕妇出了什么意外。你这直接理所当然的直冲厕所什么意思呢？还反过来网暴人家咖啡店，就这素质坏心肠,孕妇2次到店借用厕所和店员起争执,"
强烈反对"
5090756630940809,OC4ZF3WKl,6215601130,厄洛斯乐章,咋，你肚子里孩子是店员的？给你惯的…借用别人店的厕所好好说话，第二次去借用么随便点杯什么喝的人家也不会说你啥。人家店里厕所不对外开放你是一个字也听不懂吧,孕妇2次到店借用厕所和店员起争执,"
强烈反对"
5090756614684819,OC4ZDjEJB,6064526498,我是一只鱼ELF,最讨厌理所当然的人店里的厕所本来就是满足消费者为先你但凡告知一声或者消费一下也没那么多事,孕妇2次到店借用厕所和店员起争执,中立
5090756518217675,OC4ZtytN9,1659450922,月舞星随,这种人如果在店里出现什么问题，是不是会讹人呢，不让用也能理解,孕妇2次到店借用厕所和店员起争执,"
支持"
5090756336816533,OC4ZbsBi5,2010261880,社会与法频道阎肃,阎肃观察超话10月16日，云南昆明。一咖啡店店家发视频称：一位孕妇一早来借用厕所，当时刚开张让其使用了卫生间。中午，她第二次来借用厕所，但并没有询问店员，店员提醒卫生间不对外开放，并告知外面有公厕，对方称自己是孕妇憋不住了，要怎么样？两人发生争执。随后被孕妇和其同行男子辱骂，并拍视频发布网络，对店进行差评。对方则称：公共厕所被锁起来了才来的咖啡店，是商家态度恶劣在先。的微博视频,孕妇2次到店借用厕所和店员起争执,中立
5090741657538241,OC4BvvD2x,6008537272,九红东升,外面的公厕卫生并不是很好，咖啡店厕所全天有人打扫，卫生是到位的，网暴别人压根不提第一次别人让她上了厕所的事实，现在网暴别人，被店家反击了，如果有网友说难听的话，提前生了孩子，估计这女的又要别人咖啡店赔钱了,孕妇2次到店借用厕所和店员起争执,中立
