id,bid,user_id,用户昵称,微博正文,话题,立场倾向
5090628335305197,OC1EJmg7H,5400334094,慕容狄狄,两方都挺不会做人，以我个人来说，作为店家孕妇过来上洗手间，吱会了声都是可以的，这完全没有问题，也不会有任何不快。作为孕妇既然知道用了非公用厕所，买杯咖啡消费一下，你心里舒服，店家心里平衡。根本不会有什么争执。,孕妇2次到店借用厕所和店员起争执,中立
5090628124016799,OC1EogQX5,5703615378,邓为是蒙蒙哒,你虽然是孕妇但也得讲道理吧，孕妇不是你不尊重人的理由，你去借用人家的厕所最起码的礼貌要有吧！,孕妇2次到店借用厕所和店员起争执,"
反对"
5090627767238679,OC1DOun6T,2771458793,陪吴韬走过漫长岁月_认真养ss版,又不是自家厕所还差评关键是还没问,孕妇2次到店借用厕所和店员起争执,中立
5090627513749053,OC1DpfJiB,1869739161,糖糖糖糖儿er,｜怀孕并不是不讲理的借口，毕竟店家的厕所，不对外，人家让你用，你应该感谢，而不是无理取闹～这样只会让人反感～,"孕妇2次到店借用厕所和店员起争执,阳光信用",反对
5090627431957140,OC1Dh8d8M,1891461161,如果欣賞我堅強溫柔,第一次她来的时候肯借给她已经很公道了，别人开门做生意是需要成本的，为什么为了你的方便而买单，别来道德绑架,孕妇2次到店借用厕所和店员起争执,反对
5090797189335431,OC634Dazt,7546992649,只想做回清水镇的叶十七,帮助他人是道义不帮是常理别道德绑架别人,孕妇2次到店借用厕所和店员起争执,中立
5090796913821049,OC62Dg21P,5893077244,星座语录师,玄学很灵的…我今年会暴富的💰我今年会发财的💰我今年会有钱的💰,孕妇2次到店借用厕所和店员起争执,中立
5090785355895802,OC5JZoJLA,2196365434,Minerva爱谈天,我要是店员我会想：你怀孕又不是我让你怀孕的，憋不住关我屁事！,孕妇2次到店借用厕所和店员起争执,强烈反对
5090784722558309,OC5IYaJx3,2486282823,小_鱼儿-amy,一而再，实在有点过分。孕妇也不能这样搞店家啊！她这样的早知道第一次都不借给她用。,孕妇2次到店借用厕所和店员起争执,强烈反对
5090784526994479,OC5IEtlAb,7769213577,米法和希多,把别人的好意当理所当然，被挂被骂也是该的,孕妇2次到店借用厕所和店员起争执,"
强烈反对"
5090783965742402,OC5HKo5Ro,5529735967,五胞胎军队,这么理直气壮的，她怀的是咖啡店老板的孩子吗,孕妇2次到店借用厕所和店员起争执,中立
5090783818941787,OC5HvBwan,5063785677,路过打酱油的酱油君,去了两次，第二次就不问了？也不买杯什么吗？万一摔了是不是又要说为什么让她进去上厕所？不是你们店有问题她怎么会摔啊？,孕妇2次到店借用厕所和店员起争执,中立
5090776676303619,OC5vZqrRh,2196687260,小汤圆Fighting,会来事的早买杯咖啡给老公，对店家客客气气的。憋不住还有空拍摄视频啊？妥妥的蛮横无理,孕妇2次到店借用厕所和店员起争执,"
强烈反对"
5090776486250749,OC5vGqe6x,3319368414,文熙07,这就是好人难当的现实体现。做了一次好事，有人不感恩不见好就收，你第二次不对她慷慨，她觉得你欠她的。,孕妇2次到店借用厕所和店员起争执,中立
5090776034050181,OC5uXgZDv,5449761396,爆单婷酱,震惊住我了姐妹们，快去惊东嗖[有惊喜600]，刚领了600，真的太惊喜了,孕妇2次到店借用厕所和店员起争执,中立
5090775436101910,OC5tZpBnU,7550631718,聪明小田,孕妇咋了？是店长的孩子吗,孕妇2次到店借用厕所和店员起争执,中立
5090761880110003,OC5880sCf,7519397082,爱机少年,孕妇咋了？是什么特殊身份吗,孕妇2次到店借用厕所和店员起争执,中立
5090748238659885,OC4M7AkPz,3277443715,享耳文刀水景页,不在人家店里消费，数次上人家厕所还很理所当然？你家能随便接受不认识的人进去上厕所不？孕妇就有理了？,孕妇2次到店借用厕所和店员起争执,反对
5090747797473110,OC4Lpvm62,1862712961,凉月晚星,她咋不去骂锁住的公厕呢？呵呵,孕妇2次到店借用厕所和店员起争执,中立
5090747630748463,OC4L938HZ,5594953457,我爱宁小胖2012513,又不欠你的，你怀的又不是人家孩子，让你上一次都跟好了，还好意思来第二次,孕妇2次到店借用厕所和店员起争执,"
强烈反对"
5090747378568209,OC4KJzWYV,6633611311,Stock环球之旅,借用厕所连一句谢谢都不会，没礼貌，要是我是这家店老板娘我也不借，因为还要承担你万一摔倒的风险，而且没礼貌的人没人会喜欢,孕妇2次到店借用厕所和店员起争执,"
反对"
5090747101742738,OC4Ki7jmG,2807846824,木子的一只鱼-,可以好好沟通啊，大家各退一步啊，店员也告知不对外开放了的,孕妇2次到店借用厕所和店员起争执,中立
5090732694047434,OC4n3gYVc,7733496869,锐锐菜的很,不管怎么样，厕所又不是你家的，别人同意给你上你才能上啊，还把别人网暴，真的是无敌了,孕妇2次到店借用厕所和店员起争执,"
强烈反对"
5090732349588431,OC4muEeo7,6268574108,Coisini-唯为,追求你渴望的，挑战你未有的。光鲜背后是汗水，成功路上无捷径。道理再深刻，不如自己领悟；故事再动人，不如亲身实践。改变，从自我做起。泪水或许能博取同情，但汗水才能赢得尊重。拼尽全力，只为遇见更好的自己。,"网红小虎行账号已被封,孕妇2次到店借用厕所和店员起争执",中立
5090732002772764,OC4lWbDk0,1970323953,小诸葛风水命理,这个社会到底是怎么了，总会出现这样的事情，人的素养问题还是教育出了问题。,孕妇2次到店借用厕所和店员起争执,中立
5090731924392099,OC4lOiqAj,2410977007,骑怪的少年,没点情商的孕妇，他么有有理了你,孕妇2次到店借用厕所和店员起争执,"
强烈反对"
5090731897389412,OC4lLv0k4,5124848077,荷塘月色如画,孕妇也不能这么理所当然吧,孕妇2次到店借用厕所和店员起争执,"
反对"
5090714234390968,OC3Thiqi4,7736074567,橙鲸弛,这个孕妇也绝了其他孕妇的后路，让其他孕妇与她一起背骂名，如此恶毒，难道不想想为孩子积积福吗？,孕妇2次到店借用厕所和店员起争执,强烈反对
5090714134512531,OC3T7iVUL,6356471214,吨儿吨儿吨儿,赶紧给人道歉，孕妇又怎么了，人家店员精神损失更大,孕妇2次到店借用厕所和店员起争执,"
强烈反对"
5090714071860861,OC3T17O5T,5225624002,巨婴观测站,昆明一孕妇一早来咖啡店借用厕所，中午第二次来不打招呼直接上，被店员制止，孕妇称自己憋不住了，要怎么样？连基本的社会化都没有完成，就已经要养育后代了，这后代怕也难的微博视频,孕妇2次到店借用厕所和店员起争执,"
强烈反对"
5090714012353130,OC3SV9S9I,7861546240,东营区融媒体中心官方微博,万事尽心尽力就好，有则锦上添花，无则顺其自然早安超话,"孕妇2次到店借用厕所和店员起争执,民警搜山喊了4小时找回5名大学生,早安",中立
5090635837079619,OC1QPtHJp,5189828845,眼前的NR,有的女人别太离谱！古有倚老卖老，现有倚孕卖孕，别人欠你的？？？贱人，就是矫情,孕妇2次到店借用厕所和店员起争执,强烈反对
5090635241751367,OC1PS7lBR,5274568449,Fiona---na,如果摔了是不是又说店家地面滑，然后去获取赔偿？,孕妇2次到店借用厕所和店员起争执,中立
5090635038065042,OC1PxxQ5k,7129967443,梨花戏月,孕妇2次到店借用厕所和店员起争执呃呃呃进别人店里借用厕所不是本来就要询问吗，难道借了一次就默认都能用了？要是不小心出事儿了，商家咋办，别以为怀孕了就能横着走了,,中立
5090635029416537,OC1PwDvFD,5977060696,庄与袅烟·,:礼貌问一声说一下理由一般店家都会让你用，但是不礼貌真是…,孕妇2次到店借用厕所和店员起争执,中立
5090635012375867,OC1Pv9Y4r,5781782188,磊落唯爱,一开始店员态度还可以，别说陌生人了熟人如果麻烦别人也要询问声行不行的孕妇确实不够礼貌脾气有点暴,孕妇2次到店借用厕所和店员起争执,反对
5090626431877869,OC1BF7Swd,7809070525,紀轩_KN,人家是开门做生意的，麻烦了别人还连杯咖啡都买不起,孕妇2次到店借用厕所和店员起争执,"
反对"
5090625959496287,OC1ATDQpV,3096278482,柔软的格子,一个餐馆兼职默默应激了，为什么那么多人理所当然地把店里的厕所当公共厕所啊，不让用被客人骂，让用了被老板骂，反正横竖都是打工人倒霉呗,孕妇2次到店借用厕所和店员起争执,中立
5090625571262137,OC1Ah5il3,7560136105,寻诗归长安,人咖啡店又不欠你什么哪怕你是孕妇也不能道德绑架啊,孕妇2次到店借用厕所和店员起争执,中立
5090625059293373,OC1zrCZD7,3098750361,做个快乐的懒懒,跟他是什么身份没关系好吧，要知道没素质不礼貌的人不是因为怀了孕才不礼貌的，不要颠倒了！,孕妇2次到店借用厕所和店员起争执,中立
5090624351244181,OC1yj5dFr,6217559215,小熊糖纸D,搞不懂为什么要辱骂店员，人家都告诉孕妇了外面有公厕，还要来使用店里面的，万一出了什么事是孕妇的责任还是店里面的责任呢？,孕妇2次到店借用厕所和店员起争执,"
反对"
5090783071830731,OC5Gj7GfV,6813082533,蓝色的胖头鱼_,最烦这种吵架不对事搞人身攻击的，真是又脏又臭！,孕妇2次到店借用厕所和店员起争执,中立
5090783065804304,OC5GiolXO,1837877394,东鲁先森,还是要以人为本，与人为善，谁还没有急处？！,孕妇2次到店借用厕所和店员起争执,"
支持"
5090775148794054,OC5twATJA,7731586548,巴的酸奶疙瘩63,现在的人觉得别人就应该帮助，非但不感激别人的帮助，还趾高气昂理所当然似的，但凡态度好点都不是这个结果,孕妇2次到店借用厕所和店员起争执,"
反对"
5090774901589561,OC5t86Fw5,7730800918,池島月眠,人家也要做生意的呀，礼貌点会怎样？别人以为你怀的太子呢,孕妇2次到店借用厕所和店员起争执,"
强烈反对"
5090774847063439,OC5t2tDwr,5134328766,橘子猫蜜蜜,你怀孕你有理？第一次情分，第二次不会消费后再去？,孕妇2次到店借用厕所和店员起争执,反对
5090774716516668,OC5sPrlhy,5781046951,李振威08376,谁错谁对，不清楚，但这家店绝对会失去好几个客户，孕妇及其周边的亲朋好友，实体店服务很重要，毕竟你的客户几乎都是周边的居民，全部得罪的关门就行了，这也是和气生财。,孕妇2次到店借用厕所和店员起争执,中立
5090774666972204,OC5sKtfMU,5352037508,猫勇士犀犀利,我觉得，人家愿意借给她是情分，不愿意借给她是本分。又不欠她的，虽然是孕妇，但是没必要道德绑架店家，有的人做生意本来就很忌讳这些。,孕妇2次到店借用厕所和店员起争执,中立
5090774511257865,OC5sv5he9,7762994449,喵喵_喵喵_啦啦,怀的又不是店员或者店长的孩子，情分已尽，滚蛋少道德绑架,孕妇2次到店借用厕所和店员起争执,"
强烈反对"
5090774489760618,OC5ssEXbk,6438547678,今天请喝水,这年头网爆自己的人真多,孕妇2次到店借用厕所和店员起争执,中立
5090761609053905,OC57GBZkJ,7375010855,rini_Jay,🈶公厕为啥不去孕妇也不能给人家店找麻烦啊都让你上过一次了还想咋的,孕妇2次到店借用厕所和店员起争执,反对
5090761558720900,OC57BAAHG,1999959193,嘉兴咖啡爸爸,你到外面的时候，有没有借用过厕所？你到外面的时候，有没有借用过厕所？,孕妇2次到店借用厕所和店员起争执,中立
5090761382824715,OC57kbQPV,7855178870,坏控,孩子不是咖啡店的，照顾包容孕妇是人的善，但不是你可以用来道德绑架的绳子,孕妇2次到店借用厕所和店员起争执,中立
5090760989346979,OC56GDdzJ,7826830931,韭居人下,厕所真是个痛。商家痛，顾客也痛。不对外开放的厕所太多了。公厕又太少，太难找。急茬儿真没办法解决。爆发这样的冲突再正常不过了。孕妇用厕所可能是要吐，味儿还很大。咖啡厅不给借能理解。可你要孕妇去哪里吐呢？有时候真是憋不住。不让孕妇用厕所，建议孕妇来个现场直播。,孕妇2次到店借用厕所和店员起争执,中立
5090746969360977,OC4K4Dhdv,7444299712,Luck_fortune2024,孕妇就得让着你呢？人家自己店的厕所非得让你免费使用？一家人都无耻,孕妇2次到店借用厕所和店员起争执,强烈反对
5090746899629511,OC4JXEp4H,7457899806,搬起石头砸一下呀哈哈,不知道还以为怀的人家咖啡店老板的孩子呢,孕妇2次到店借用厕所和店员起争执,中立
5090746866337000,OC4JUqAxG,7660680493,小忧鱼不忧郁,但其实借用厕所是很正常的但前提也该礼貌的询问一下店员再进去吧,孕妇2次到店借用厕所和店员起争执,中立
5090746838024622,OC4JRxFzo,1840595524,ZzCclove嬋老大,先不谈她第二次招呼都不打就进去上厕所，看起来厕所还是在二楼，这要是在店里摔了之类的那不得讹上店里啊,孕妇2次到店借用厕所和店员起争执,"
反对"
5090746418594817,OC4JbA3U5,1645578093,南风窗,10月16日，云南昆明，一咖啡店店家发视频称：一位孕妇一早来借用厕所，当时刚开张让其使用了卫生间。中午，她第二次来借用厕所，但并没有询问店员，店员提醒卫生间不对外开放，并告知外面有公厕，对方称自己是孕妇憋不住了，要怎么样？两人发生争执。随后被孕妇和其同行男子辱骂，并拍视频发布网络，对店进行差评。对方则称：公共厕所被锁起来了才来的咖啡店，是商家态度恶劣在先。的微博视频,孕妇2次到店借用厕所和店员起争执,中立
5090731540089070,OC4lc0naC,5506455459,乌鱼子ca,不是公共厕所本来就有权利不外借的，孕妇很了不起吗？我也是孕妇，我都没这么不要脸直接跑人家私人店家上厕所，我在外面都是跑超市上厕所，没素质,孕妇2次到店借用厕所和店员起争执,强烈反对
5090731226300790,OC4kGqr7E,7414582833,-七号行星-苦b高三版,把别人的善良当理所应当,孕妇2次到店借用厕所和店员起争执,中立
5090731070588547,OC4kr2t6H,6181718929,孝一孝的Cyndi,孕妇真的素质差，这对夫妻真的坏到底，穷乡僻壤出刁民,孕妇2次到店借用厕所和店员起争执,强烈反对
5090730856417435,OC4k5qVt1,7622421724,Rose荆棘玫瑰,真没素质啊，啥人都有，买杯咖啡不就得了,孕妇2次到店借用厕所和店员起争执,"
反对"
5090730702539431,OC4jQaECz,6538965896,Allthetime_永不言弃,不能仗着你是孕妇就可以随心所欲，那是人家的店让不让用是人家的自由，不是你的自由,孕妇2次到店借用厕所和店员起争执,"
反对"
5090713872106641,OC3SH8Q25,2513178792,小小的我呀XW,人家店家没欠你的，不是怀个孕就要地球围着你转了。,孕妇2次到店借用厕所和店员起争执,"
反对"
5090713551241817,OC3Sb5d3j,7554144114,用户7554144114,微博平台理应尊重事实而不是听信一面之词，删除我们的微博，屏蔽我们发的记录真实情况的视频和限流,"孕妇2次到店借用厕所和店员起争执,玖富金融涉嫌大量合同诈骗,胡军代言翻车疑似涉及390亿元",中立
5090713273893583,OC3RJgkTJ,7769605678,许脆_song,啊？虽然我们应该照顾孕妇，但我们更应该做到有礼貌,孕妇2次到店借用厕所和店员起争执,中立
5090712977408050,OC3Rfv5aG,6020336915,我叫暖暖啊,孕妇是肚子大，不是脸大，但凡有点情商，都知道去买一杯东西在委婉提一下需要再次使用厕所，不知道孕妇就有啥可猖狂的,孕妇2次到店借用厕所和店员起争执,反对
5090711998824482,OC3PFB1Em,1648923432,大师罗莊,孕妇内急可以理解，但是孕妇也应该委婉一点或者买杯咖啡，哪怕她不能喝也可以给同行男子喝，哪怕他们两人都不能喝，也可以买一杯送给店员,孕妇2次到店借用厕所和店员起争执,"
支持"
5090711575462923,OC3OZmV9F,7608850484,小熊厌倦在魔法阵跳水,很多女的打着为女生出头的名义干着缩减女生空间的事！也不为孩子积德，夫妻千万别离锁死,孕妇2次到店借用厕所和店员起争执,"
强烈反对"
5090634661364856,OC1OW5J3O,5471664861,陷于孤岛逢春,孕妇2次到店借用厕所和店员起争执，额难评啊，双方各退一步就能解决的事情非得闹成现在这样,,中立
5090634522166085,OC1OI95uR,1157065300,微雨织燕梦,营业场所里的应该属于公共厕所，有明确规定餐饮等场所必须建厕所的，如果是私人厕所不给用也没什么，公厕就不应该不让用。,孕妇2次到店借用厕所和店员起争执,中立
5090633426930176,OC1MWt4R2,7491037518,丹阿鱼,又不是公厕，当你家呢？搞笑,孕妇2次到店借用厕所和店员起争执,"
强烈反对"
5090633263874630,OC1MGgfY2,7788438064,啊胖嘟嘟_,你谁啊，孕妇了不起啊，以为肚子大了所有人都得让着你啊,孕妇2次到店借用厕所和店员起争执,"
强烈反对"
5090633205678255,OC1MAnPaL,6692928240,米兰_叶,情商堪忧，但凡好声好气问一下！！！并不是你第一次去问了，第二次去就不用问了，啥也没消费，问也不问自己就理直气壮的走进去了，不知道的还以为你是走自己家呢！！！而且店员态度一开始挺好的，自己先拿手机拍别人，别人不能拍你吗,孕妇2次到店借用厕所和店员起争执,"
强烈反对"
5090624350453801,OC1yj1U3n,6482173868,呼噜小丞-,别人开门做生意是需要成本的，为什么为了你的方便而买单。帮是情分，不帮是本分,孕妇2次到店借用厕所和店员起争执,中立
5090623889342563,OC1xyDcqv,2548979252,可以让我先吃吗,网友的节奏不好带了，这不是纯纯的发上来网爆自己的吗,孕妇2次到店借用厕所和店员起争执,中立
5090621196864957,OC1tdsNT7,6786825414,虽然很丧但是努力开心每一天,又不是谁发视频谁有理。。。自爆何必,孕妇2次到店借用厕所和店员起争执,中立
5090774419771222,OC5slEZWm,7796777494,炝锅菜炒河粉,第一次来了人家没说你，第二次人家也要做生意的呀咋还骂店家呢不能好好说吗，自己还是个孕妇不知道注意着点吗,孕妇2次到店借用厕所和店员起争执,反对
5090774242559399,OC5s4aJOD,5641885274,TiAmo_Lyy,孕妇咋了，孕妇跟人家店家有毛线关系吗，也不是店家的孕妇，人家好心免费给你用第一次你都得感谢人家了，第二次要去不说给老板消费一点起码说几句好话吧。还敢舔个B脸联合老公去骂人家店家。现在这个社会就是太多这些傻X，让人与人之间更没有所谓的“同情心”，出手帮忙没有回报就算了还容易惹一身骚,孕妇2次到店借用厕所和店员起争执,强烈反对
5090774008463492,OC5rGzvJW,5325285053,爱吃芒果的锦鲤小茵茵,孕妇仗着自己怀孕就想全天下的人都让着自己吗，不知道的还以为肚子里怀着太子呢,孕妇2次到店借用厕所和店员起争执,"
强烈反对"
5090773697824230,OC5rbwPrg,6052330213,芋泥小幸,因为她怀孕不知道能不能买咖啡喝吧,孕妇2次到店借用厕所和店员起争执,中立
5090773664531415,OC5r8j0Pl,7559338701,听小结巴唱情歌,买一杯咖啡不就行了不经过人家允许就进去真是厚脸皮,孕妇2次到店借用厕所和店员起争执,"
强烈反对"
5090760888156599,OC56wydU3,7245818753,how塔姆5佛冷,这素质还是不要生孩子了，优生优育哈,孕妇2次到店借用厕所和店员起争执,强烈反对
5090760720909957,OC56g3OIJ,7646129066,种花家的兔55131,你但凡有那么一点点客气和礼貌，基本上店家都会让用的,孕妇2次到店借用厕所和店员起争执,中立
5090760458242808,OC55PyAkw,6612161751,圈内橙子,谁也不比谁高贵，都只有一次人生，都属于天地过客。人和人没有高低贵贱之分，所以，千万别瞧不起人,"广州首现登革热重症病例,孕妇2次到店借用厕所和店员起争执",中立
5090759523174481,OC54kdjPj,5623096120,劫杀生命的战场·1640,说都不说一声直接用员工卫生间还觉得有理了？店铺里卫生间不对外开放很正常啊，自己憋不住关店员啥事儿啊,孕妇2次到店借用厕所和店员起争执,"
反对"
5090746021446644,OC4Iy64kY,1961027990,绿萝菌,第一次询问了，人服务员也让你上了，证明服务员还是很通情达理的，那为什么第二次不问了呢，难道就因为第一次上过，就默认人家的卫生间必须对外开放吗。其实态度放软一点，求人就要有求人的态度。,孕妇2次到店借用厕所和店员起争执,中立
5090746021451024,OC4Iy65tC,7351979892,桃铃叮叮,天呐，店员也说了是厕所是不对外使用的，何必为难一个打工人呢？,孕妇2次到店借用厕所和店员起争执,中立
5090745986319013,OC4IuqvRz,6360667939,王王的旺,为什么不上公厕？给别人添麻烦也怪不好意思的,孕妇2次到店借用厕所和店员起争执,中立
5090745335939718,OC4HroVbU,7784564158,柠洛-1123,说实话，虽然是孕妇，情况特殊，但是这有点道德绑架了,孕妇2次到店借用厕所和店员起争执,中立
5090745293999560,OC4HngMt2,7762266537,兔叽也亭想见面,不让上就不让上呗，多大点事儿，但就算你身为孕妇也不能骂人啊，道德绑架别人干嘛？万一店里丢了东西你负责啊,孕妇2次到店借用厕所和店员起争执,"
反对"
5090730689169421,OC4jOCtnT,7469691651,怪你过分闪耀,第一次见到发到网上想网b自己的孕妇就可以为所欲为了么人家私人东西凭什么一定要借你用不懂得感恩就算了还在那里抱怨哈,孕妇2次到店借用厕所和店员起争执,反对
5090730649322202,OC4jKD786,1772729197,高勇养基,孕妇两次到店借用厕所与店员发生争执，孕妇态度欠妥，好言好语的相信大多数人会提供帮助的，也反映出社会对于特殊群体关怀的缺失与服务意识的不足。应倡导公共场所更加包容与人性化，同时提醒公众在面对争议时保持冷静，以和谐方式解决问题。,孕妇2次到店借用厕所和店员起争执,中立
5090730647486639,OC4jKvpCf,7912408526,北岛七颗星,你的孩子以后当不了童模,孕妇2次到店借用厕所和店员起争执,中立
5090730315350130,OC4jdmrOq,6618239676,巴扎黑是你大爷,什么时候给孕妇让座变成了让座是情分不让座是本分,孕妇2次到店借用厕所和店员起争执,中立
5090730182181025,OC4j099nP,3915484491,风啊终于来了,同行男子买杯咖啡不就行了,孕妇2次到店借用厕所和店员起争执,中立
5090729609396788,OC4i4Dqx6,7078499917,猫姐和熊宝那些事儿,现在每次出门到地方第一件事先找好干净的公厕好多时候就是尿意频繁但上不出,孕妇2次到店借用厕所和店员起争执,中立
5090729544649031,OC4hYjvqn,6976286606,闲唐闲宋,这种没素质的人能教养好孩子吗？,孕妇2次到店借用厕所和店员起争执,"
强烈反对"
5090729521319228,OC4hW5xbS,5242165401,植物大战葫芦兄弟丶,看完过程她为啥要网暴自己,孕妇2次到店借用厕所和店员起争执,中立
5090729426158879,OC4hMpQcL,6598744423,橘子柿子商店,这个孕妇是为了博流量吧,孕妇2次到店借用厕所和店员起争执,中立
5090711404282067,OC3OIhXXB,2900579573,空山幽并客,都能想到以后这孩子会是啥样了,孕妇2次到店借用厕所和店员起争执,中立
5090711349756521,OC3OCEW7f,6491975601,逢年定律,10月16日，在云南昆明的一家咖啡店，一名孕妇因两次借用店内厕所与店员发生了争执。当天早上，这名孕妇第一次来到这家咖啡店借用厕所，店员同意让她使用了。到了中午，她再次来到店里想要借用厕所，这次却没有事先询问店员的意见。店员告诉她，店内的厕所并不对外公开开放，并建议她可以去附近的公共厕所解决。然而，这位孕妇表示自己作为孕妇实在憋不住了，希望店方能通融一下。这一提议遭到了店员的拒绝，于是双方产生了口角。,孕妇2次到店借用厕所和店员起争执,中立
5090710896509172,OC3NTrjkE,3884286575,我被安利了,这个人怎么一点都没有同理心啊？,孕妇2次到店借用厕所和店员起争执,中立
5090710850372274,OC3NP1yQq,2877060527,钵钵鸡品尝官,你怀的是你老公的孩子，不是全世界的孩子。不能把别人的善意当理所当然！,孕妇2次到店借用厕所和店员起争执,"
反对"
5090710690464489,OC3Nz1WPL,7820320352,杳杳_yi,如果出现意外了那肯定会讹钱吧！这不让用也是有原因的,孕妇2次到店借用厕所和店员起争执,"
强烈反对"
