id,bid,user_id,用户昵称,微博正文,话题,立场倾向
5068709987096084,OsPsytM0Y,6354496584,你会喜欢浅夜嘛,影城是专门为小孩开的吗还不能播放儿童不能观看的影片，我算看明白了，当代家长就是喜欢把责任推给对方，反正就是不管怎么样都不是自己的问题。不是一两例了，遇到事就是别人的问题，求求三观不正连自己都教育不好的别结婚生子了，一个人嚯嚯两家,异形吓坏8岁小孩家长投诉影城,"
强烈反对"
5068701465839487,OsPeOov7h,6163321008,小南柯121,你咋不说你生孩子的时候涉黄呢傻逼和正常人的比例本来是正常的但是傻逼还格外爱生孩子孩子智商不够的前提下还在用傻逼的育儿方式教育这个世界看起来越来越癫了,异形吓坏8岁小孩家长投诉影城,强烈反对
5068700975629990,OsPe1nCCi,7827489328,祎零幺幺-开学初三不常在线版,？你都知道是恐怖惊悚片了，还带小孩子去，不是你自己的责任吗？,异形吓坏8岁小孩家长投诉影城,反对
5068700803927474,OsPdKgtIm,7584948483,你向我索求的都给你,求求你们别去看别给我投没了老子还想明天看呢,异形吓坏8岁小孩家长投诉影城,中立
5068675340568269,OsOyG2nPD,7403991271,系一晴ye,不是写了未成年谨慎观看，为什么还要带小孩去看呢吓到小孩自己不想想是谁的问题,异形吓坏8岁小孩家长投诉影城,反对
5068675287615662,OsOyAvXbg,7364862274,还想泪两滴,这泼天的流量分我点儿阅读量吧,异形吓坏8岁小孩家长投诉影城,中立
5068675230733546,OsOyv34Po,2158223902,鹿篱笆,不是这海报带孩子去看也是神金别小孩哭闹打扰其他人,异形吓坏8岁小孩家长投诉影城,中立
5068930388066615,OsVc2xQuH,1241252174,崔汀,异形超话《异形：夺命舰》争议越大，票房越高？影片的第三方预测票房从最初的2亿元，到后来的4亿元，再到现在的7亿元，预测上限不断提升。虽然有，但是影片的关注度越来越高。上一部引进的《异形：契约》内地总票房3.11亿元。《异形：夺命舰》目前收入票房1.94亿元，走势凶猛。,异形吓坏8岁小孩家长投诉影城,中立
5068887127491480,OsU4gvqSk,6260493698,Yun0130,还是原来的配方还是原来的味道还有我不懂为什么家长要带小孩去看异形除非他们之前没看过,异形吓坏8岁小孩家长投诉影城,"
反对"
5068876284958153,OsTMMkNQd,7422806367,中国网娱乐,作为好莱坞久负盛名的科幻惊悚片，《异形》系列塑造了打不死的外星怪物异形，成年异形身高2-3米不等，拥有坚硬如铁的外骨骼，腐蚀性超强的硫酸血液，受伤后快速自愈的能力，甚至可以在太空中存活，目前，电影《异形》系列的最新电影《异形：夺命舰》正在热映，此次《异形：夺命舰》与北美同步上映，在美国该片属于R级片，17岁以下必须由父母或者监护陪伴才能观看，电影在国内上映一刀未剪，出品方20世纪影业多次在其新浪官方微博上提醒“未成年观众谨慎选择观影”，影片海报上也同样提醒“未成年观众谨慎选择观看”。,"异形 降智,异形吓坏8岁小孩家长投诉影城",中立
5068873671381336,OsTIz5NlC,6515442527,乘客168,带8岁小孩看《异形》被吓到，要投诉影城；带1岁小孩去拥挤的景区，小孩淋雨发烧，要踩踏文物——这些家长是不是认为自己生了小孩，全天下都得跟着迁就TA啊？已经不带小孩出去作会死吗？自己懒不提前做功课为啥不举报举报自己？,异形吓坏8岁小孩家长投诉影城,强烈反对
5068872940260649,OsTHo15O1,7638571337,歪西歪酷,门口明明写了未成年慎看,异形吓坏8岁小孩家长投诉影城,中立
5068872413354062,OsTGxe4xM,7784136382,迟日小诗z,神经病吧？害怕就不要看啊人家辛辛苦苦拍的电影,异形吓坏8岁小孩家长投诉影城,"
强烈反对"
5068644990061463,OsNLJ0fZl,6292889767,幼犬飼養員_,啊？这不是都有年龄限制吗为什么还要带小孩子去看关影院什么事自己不看清楚就带小孩看电影这家长全责还要怪别人好无知…,异形吓坏8岁小孩家长投诉影城,"
强烈反对"
5068644919021704,OsNLBBQXm,7860455672,Tiixw5J17_墨汁米线,其实吧，这种片子不适合带这么小的小孩子去看什么啊中元节是鬼节？？？有人讲讲吗？,"异形吓坏8岁小孩家长投诉影城,突然就不害怕中元节了","
反对"
5068644881793281,OsNLy7wvT,6393904893,燃新闻,好莱坞知名科幻惊悚片《异形》系列的最新作《异形：夺命舰》正在热映。异形拥有强大能力，形象恐怖。8月17日，“异形太吓人了”登上微博热搜，某影城因有8岁小孩观影害怕遭家长投诉索赔。该片与北美同步上映，在美属R级片，国内未删减。出品方多次提醒“未成年观众谨慎选择观影”，但仍有家长带孩子观看。此事件引发观众讨论，媒体采访多人表示该片不适合孩子，家长应慎重选片，同时也引发了关于电影分级的讨论。新,"异形吓坏8岁小孩家长投诉影城,异形 科幻恐怖",中立
5068644856365678,OsNLvqI0e,5957832737,我一定会好运爆棚,每次都有这样的唇珠，你是带孩子看电影吗？自己想看就顺带把孩子带去了吧，真想陪孩子看电影不会找儿童区啊，海报您区分不来呀？以后电影院不是儿童电影能不能禁止小孩进入，真是大烧杯,异形吓坏8岁小孩家长投诉影城,"
强烈反对"
5068644788208958,OsNLoyrwy,7809655640,粉的95唯一top,异形吓坏8岁小孩家长投诉影城？？,异形吓坏8岁小孩家长投诉影城,中立
5068644683352284,OsNLee456,7805747712,木易bb大桃浦,你都去看了一定要带小孩吗！！,异形吓坏8岁小孩家长投诉影城,中立
5068503587230454,OsK5EukYe,1847261235,阿姨不想努力了_,你明知道是恐怖片为啥还要带孩子去？现在又来投诉电影院……一整个大无语！这是孩子可以看的吗？,异形吓坏8岁小孩家长投诉影城,反对
5068503572811359,OsK5DbNmv,1751566582,开心快乐每一天666123,这是来碰瓷的吗？我明天要去看，可千万别删减,异形吓坏8岁小孩家长投诉影城,中立
5068503519857264,OsK5xFmk8,1844540982,katy-杰杰,笑死了，今天去看还挺多带小孩的，一开始最吵的，刚开始进入正题时被爸妈带走了，别的孩子还蛮安静的，看完都还好。大家一起捂耳朵，往椅子里躲的氛围，还挺好的,异形吓坏8岁小孩家长投诉影城,中立
5068503298867452,OsK5bBcPq,6867377212,吓吓吓吓吓一跳_,白天刷到热搜被吸引立马晚上去看了✌🏻于是正在回家的路上,异形吓坏8岁小孩家长投诉影城,中立
5068503133984679,OsK4VgIB1,7745673629,猫子天下第一,越想越觉得可笑，如果这个事情他投诉就能顺着他给他赔偿，那以后缺钱了只要带孩子去看电影就好了，反正现在生孩子那么少，个个都是娇生惯养的耀祖，一点风吹草都能给吓出毛病，打打影院的秋风不是分分钟嘛,异形吓坏8岁小孩家长投诉影城,反对
5068629104133503,OsNm6hljp,1750356705,陪你长大_宝贝,娱乐超话笑死了家长心也够大的,"虞书欣正式被确诊为袁湘琴,异形吓坏8岁小孩家长投诉影城",中立
5068629018673558,OsNlXAoo6,6590196616,1点视频,家长带孩子看电影也太不谨慎了！这片子在美国是R级，国内海报也有提醒。呼吁多年的影片分级啥时候能有信儿？咱家长自己先长点心吧！的微博视频,"异形吓坏8岁小孩家长投诉影城,热门视频",中立
5068628900448101,OsNlM1Szr,1427361675,带上QQ去旅行,家长是没看过异形吗？带8岁小孩去看他她以为异型是迪士尼动画电影吗？😰,异形吓坏8岁小孩家长投诉影城,强烈反对
5068709938857799,OsPstBajJ,1256383697,谢尔比只喝酒,这是吓坏了哪家的皇子呀🤗,异形吓坏8岁小孩家长投诉影城,"
反对"
5068709555077994,OsPrRlj18,6261025409,嘀黎黎黎嘀黎嘀黎打蜡,哪怕电影分了级，也还是会有家长带去看。因为这些家长买票之前不会主动了解电影内容。那个异形这么大只放在电影海报上，家长难道没看到吗？？不仅是在选择电影上，这样的家长在养育孩子上大概率是没有精心给孩子挑选读物，没有关注吃的零食里有什么添加剂，没有关注孩子交了什么朋友……不负责任罢了。,异形吓坏8岁小孩家长投诉影城,中立
5068709511301173,OsPrN5suF,6499779837,超爱吃饭花大钱,神金吧...我个人不是很喜欢恐怖片我就不看啊...这都“异形”了还不明显吗我说大哥？？？无话可说...是不是觉得票太贵了想讹一下甚至怀疑,异形吓坏8岁小孩家长投诉影城,中立
5068709226089053,OsPrkpy2x,2621942023,syukumei-un,就像这样装洋蒜的家长，就是看熊出没、机器猫、天线宝宝遇见某些镜头内容，他们也是会投诉的，我就只想说，每个人别太把自己当回事儿了，差不多行了别装，这种只会让人觉得你真的很弱、很隔应人的。,异形吓坏8岁小孩家长投诉影城,"
强烈反对"
5068709106550774,OsPr8ru9E,6589067986,小米su7炸死你,且看且珍惜啊啊啊啊我今天就去看别哪天突然下架了,异形吓坏8岁小孩家长投诉影城,中立
5068708557096254,OsPqftM3I,1285853133,12道金牌,巨婴熊父母，自己不检讨带娃看这电影就不合适，还有脸去投诉影城。刚修改了结婚登记不需要户口簿了，社会财富分配发生巨大变动了，同时，脑袋一热结婚生娃的熊父母会更多,异形吓坏8岁小孩家长投诉影城,"
强烈反对"
5068700212270332,OsPcN9wCg,6124385732,nnnnn兔,sb家长，都说了未成年谨慎选择观看，你是眼睛一点都不长啊，还好意思投诉，不由得让我想起了之前还有家长投诉密室大逃脱来着真是奇葩,异形吓坏8岁小孩家长投诉影城,"
强烈反对"
5068700112126983,OsPcD8Vkb,7472775492,季時杏乐,此次《异形：夺命舰》与北美同步上映。在美国，该片属于R级片，17岁以下必须由父母或者监护陪伴才能观看。电影在国内上映一刀未剪，出品方20世纪影业多次在其新浪官方微博上提醒“未成年观众谨慎选择观影”，影片海报上也同样提醒“未成年观众谨慎选择观看”。,异形吓坏8岁小孩家长投诉影城,中立
5068699982367346,OsPcq9VR0,6437132128,波子汽水8,所以什么时候开始分级？？？,异形吓坏8岁小孩家长投诉影城,"
强烈反对"
5068675076067483,OsOyfpsqD,7773696369,暴走宝妈,自己带孩子看电影不先了解适不适合观看吗,异形吓坏8岁小孩家长投诉影城,中立
5068674936867898,OsOy1sOEy,5489765072,喜欢娱乐喜欢美食,影城公开明示14周岁以下禁看电影，有心脏病的人禁看电影，身体重病，精神过度虚弱和重度精神病人禁看电影。特别是惊恐片，正常健康人都是慎重观看，如果观看是感谢害怕请马上离开电影院，冷静下来，恢复理性，消除害怕。,异形吓坏8岁小孩家长投诉影城,支持
5068644616503435,OsNL7rhQ7,1855730643,圆又圆o-o,颠婆当家长带孩子看喜羊羊不好吗,异形吓坏8岁小孩家长投诉影城,"
强烈反对"
5068644533405973,OsNKZei33,7778202935,迷雾剧场版,家长想看，带着孩子去看，说到底孩子是陪着看的，然后小朋友看了怕了，就说电影导致小朋友害怕，就是一帮自私自利的“大小孩”搞出脑残的闹剧罢了！,异形吓坏8岁小孩家长投诉影城,强烈反对
5068644466034556,OsNKSpjRy,7868378343,CateroIIIXin_,人家都写了未成年谨慎观看还带八岁小孩去看家长带去看恐怖片也是够搞笑不负责任的,异形吓坏8岁小孩家长投诉影城,"
强烈反对"
5068644438772932,OsNKPAOeU,1880764343,荷倌,我能不能投诉白痴家长不适合当家长？,异形吓坏8岁小孩家长投诉影城,"
强烈反对"
5068503017589693,OsK4JvQqp,1046996070,昆山火弹,片洺都写异形了，nc家长还带去看？,异形吓坏8岁小孩家长投诉影城,反对
5068502797129229,OsK4ntUDz,7780429904,瑰酌,有这种家长真是中式教育的悲哀,异形吓坏8岁小孩家长投诉影城,"
强烈反对"
5068502735520339,OsK4hna5J,7908358369,奶油饺子皮xi,嗯嗯嗯我是动感超人，动感光波，啵啵啵啵不要着急，因为总会有人熬夜陪你，下雨接你，说我爱你，好的总是压箱底,异形吓坏8岁小孩家长投诉影城,中立
5068502637480282,OsK47vnXI,7473727790,平等的创死每个书杯,人家明明标了是恐怖电影了自己还要去看怪谁啊？孩子不知道你当家长的也不知道是没有🧠？,异形吓坏8岁小孩家长投诉影城,反对
5068502636168064,OsK47pSAU,2030935042,搞机王腾霄,我说实话这种家长多少有点问题，《异形：夺命舰》这电影无论电影院放的广告牌、电影海报还是购票平台界面都写名了“未成年观众谨慎选择观看”，那为啥还要带8岁小孩去看，看了又要怪影院为何要放儿童不能观看的影片，还要人家退票赔偿，你们说是不是有毛病,异形吓坏8岁小孩家长投诉影城,"
强烈反对"
5068628835697871,OsNlFnUh9,3181276783,双鱼May怡,不是说了，不要带小孩子去？,异形吓坏8岁小孩家长投诉影城,中立
5068628806601029,OsNlCrHed,5625376573,短腿兔子_,那你为什么带孩子去看？你不带他去看不就行了吗？看电影不了解背景吗？你孩子吓哭了是电影院带他去看的吗？不是你自己吗？你怎么不骂你自己呢？赶紧扇自己两巴掌吧。强烈建议电影分级，脆弱的家长，破碎的孩子，就该看过家家动画片。,异形吓坏8岁小孩家长投诉影城,强烈反对
5068628665828936,OsNloosn6,7503274425,sail会努力,所以为什么要带8岁的孩子去看惊悚电影？是不认识字吗？这种影片简介摆明了就不适合8岁的孩子，到底你是他父母还是影院是他父母,异形吓坏8岁小孩家长投诉影城,"
强烈反对"
5068628632536448,OsNllaDQs,1338667624,思想杂谈,随着影片上映，到底该不该带孩子去影院看恐怖片的话题，引发观众讨论。对此，红星新闻记者采访了多名观众以及业内人士，他们表示，《异形：夺命舰》确实不适合孩子观看，家长需慎重选片。,异形吓坏8岁小孩家长投诉影城,"
支持"
5068708248556307,OsPpKzTSX,1647457185,鲜鱼汤泡饭,家长非要带小孩子去这和影城有什么关系这里没有分级制度真要投诉也找对地方啊找影城有啥用,异形吓坏8岁小孩家长投诉影城,"
反对"
5068708110666372,OsPpx2NlW,7138858795,蝙蝠蝠蝠蝠蝠,这些家长整天投诉这个投诉那个，怎么不投诉自己呢？！带孩子看电影，你不了解一下电影讲的啥？？不出名的怪物也就罢了，就当你没听说过。带孩子看异形！？啊？？就算没看过，难道也没听说过异形是啥？啊？？连网络上的预告片都不看的家长，以后你娃被你带着踩坑的机会还多着呢！,异形吓坏8岁小孩家长投诉影城,强烈反对
5068707879715804,OsPp9ELww,2643913847,sproutsproutsprout,有些费解...以后恐怖类型的片儿是不是需要考虑加上程度分级了，并且还要放大到一眼可见，在所有物料里无限循环...为了保证本人确认知晓还要签署类似极限运动的知晓书...对于个性化需求来讲，它永远会增加，永远没有办法全部满足...,异形吓坏8岁小孩家长投诉影城,"
反对"
5068707237990824,OsPo7xwMg,2620344235,早點死-,这些家长可不可以先去死一死,异形吓坏8岁小孩家长投诉影城,强烈反对
5068707206269701,OsPo4qj2d,6081518111,-啵啵兔-,好好好这家长学会一点权力这都滥用上了。那么多动画片，喜剧片不看偏偏选个“未成年谨慎观看”，合理怀疑它是碰瓷。小孩遇上这种不负责任的家长也是够倒霉的，被吓一遭还要配合父母演出有多在乎孩子。,异形吓坏8岁小孩家长投诉影城,"
强烈反对"
5068699362921796,OsPbqcg5K,7281508623,来福斯坦,天啊，那天我朋友去看说看到有家长带小孩去，我还担心，咋想的啊，带小孩去看，待会儿又说吓到小孩要举报了。...果然出这事情了,异形吓坏8岁小孩家长投诉影城,"
强烈反对"
5068699273006260,OsPbhcC44,6910872670,不是霉子啦,神经病看电影之前不了解一下吗？官方都说未成年谨慎观看了小孩摊上这种家长也是算他命苦,异形吓坏8岁小孩家长投诉影城,"
强烈反对"
5068699170245169,OsPb711Ml,67219571,心理医生范新刚,孩子不懂事家长也不懂事吗出事怪别人家长就没责任吗,异形吓坏8岁小孩家长投诉影城,"
强烈反对"
5068698949256998,OsPaKCQaq,5902632972,小杨記春島,都说是恐怖片了，小孩看什么啊看之前不了解一下内容吗？家长也是神金。。。这电影本来就不是给小孩看的啊,异形吓坏8岁小孩家长投诉影城,"
强烈反对"
5068674920612891,OsOy02zrl,3258816980,格洛芮亚,没有责任感的巨婴能不能别生小孩，这种人从小就习惯把责任都推给别人吧,异形吓坏8岁小孩家长投诉影城,"
强烈反对"
5068674920615470,OsOy02A6W,2037509875,贵州交通广播,好莱坞知名科幻惊悚片《异形》系列的最新作《异形：夺命舰》正在热映。异形拥有强大能力，形象恐怖。8月17日，“异形太吓人了”登上微博热搜，某影城因有8岁小孩观影害怕遭家长投诉索赔。该片与北美同步上映，在美属R级片，国内未删减。出品方多次提醒“未成年观众谨慎选择观影”，但仍有家长带孩子观看。此事件引发观众讨论，媒体采访多人表示该片不适合孩子，家长应慎重选片，同时也引发了关于电影分级的讨论。,异形吓坏8岁小孩家长投诉影城,中立
5068674836990582,OsOxRtkzk,1709951635,哈尔滨日报,作为好莱坞久负盛名的科幻惊悚片，《异形》系列的最新电影《异形：夺命舰》正在热映。8月17日，某影城收到投诉，有观众称自家8岁小孩观影途中感到害怕，质疑影城放映儿童不能观看的电影，要求赔偿。对此，多名观众以及业内人士表示，《异形：夺命舰》确实不适合孩子观看，家长需慎重选片。此次《异形：夺命舰》与北美同步上映。在美国，该片属于R级片，17岁以下必须由父母或者监护陪伴才能观看。电影在国内上映一刀未剪，出品方20世纪影业多次在官方微博上提醒“未成年观众谨慎选择观影”，影片海报上也同样提醒“未成年观众谨慎选择观看”。,"异形吓坏8岁小孩家长投诉影城,异形提醒未成年观众谨慎选择观影",中立
5068644291969399,OsNKB8gkv,1088853474,逝去的幽默感,这家长看这海报难道看出了动画片的可爱，所以要带孩子去体验一番,异形吓坏8岁小孩家长投诉影城,中立
5068644009115761,OsNK8Cfqp,6597718943,退堂鼓表演艺术家裘卿卿,熊孩子长大了，成了不负责任的熊家长，祸害自己孩子，还跑社会上发癫撒野来了。,异形吓坏8岁小孩家长投诉影城,"
强烈反对"
5068643975562114,OsNK5nkXw,7554599793,盼齐-Rainco,被家长蠢到，这种电影本来就不适合小孩去看啊,异形吓坏8岁小孩家长投诉影城,"
强烈反对"
5068643949872521,OsNK2Fqid,7846241785,古雅典掌控杀鸡的猛汉,脑子是不是有问题不是你该看的自己非要跑去看脑残吧看不了就滚回家看喜洋洋,异形吓坏8岁小孩家长投诉影城,强烈反对
5068502577448660,OsK41vfJG,5205905620,木辛_Y,希望孩子能健康长大🙏🙏🙏,异形吓坏8岁小孩家长投诉影城,中立
5068502457124605,OsK3PtTqZ,7426076526,兔叽主义者,神经病啊孩子年纪小胆子小自己心里没点数，还怪上影城了,异形吓坏8岁小孩家长投诉影城,"
强烈反对"
5068643901637069,OsNJY6RSl,6044758561,忧郁小蟹_dear,怎么又是家长什么都能举报，真有他们的,异形吓坏8岁小孩家长投诉影城,"
强烈反对"
5068502406792549,OsK3Ksv3f,7646730710,悦动8月,没有分级制度下这孩子不应当投诉家长吗？谁能说清楚，为什么没有分级制度到底为什么？,异形吓坏8岁小孩家长投诉影城,"
支持"
5068502394472571,OsK3JiLwf,7528973845,小酥肉和炒米粉是绝配,电影像国外一样搞个分级制很难吗？有时不想去电影院，就是怕遇到不适龄儿童，在哪里十万个为什么和胡乱喊叫,异形吓坏8岁小孩家长投诉影城,"
支持"
5068502385823325,OsK3IoqUB,7638373589,咖啡加奶更好喝,巨婴家长，没有分级制度你就得帮孩子过滤一下，提示那么明显还带孩子去看，怨谁。本来审核就很严苛了，如果以后更严苛那别怪人想起来就骂你一句,异形吓坏8岁小孩家长投诉影城,"
强烈反对"
5068628590068922,OsNlh0hVE,5970172964,小金制药有限公司,昨天晚上看给我吓毁了，没看过异形系列，感觉抱脸虫还挺瑟瑟,异形吓坏8岁小孩家长投诉影城,中立
5068628510116050,OsNl90ubM,5834426470,翻滚的丸子_33975,神经病，家长长眼睛是出气的嘛，海报看不见？？？？,异形吓坏8岁小孩家长投诉影城,"
强烈反对"
5068628326352342,OsNkQqEx8,7391752143,賢調時刻,异形本来就是科幻恐怖片，内容涉及暴力和恐怖场景，不太适合年龄较小的观众观看。家长也有责任在带孩子观看电影前了解影片内容，确保其适合孩子的年龄和心理承受能力。,异形吓坏8岁小孩家长投诉影城,中立
5068707122386896,OsPnWa0Wk,6721514197,Lisounkea,现在好像是。。4202年。。。,异形吓坏8岁小孩家长投诉影城,中立
5068706559035020,OsPn1BUq8,1614444980,耳鼻喉科喏斯医生,谁给买的票？投诉买票的人合适点。,异形吓坏8岁小孩家长投诉影城,中立
5068706390212738,OsPmL0Tlg,7562566566,寻per启事,？不是未成年人不让去看吗？,异形吓坏8岁小孩家长投诉影城,中立
5068698858029732,OsPaBxGTO,5911011212,ia08uan,孩子害怕还要带去看家长想干嘛反过来倒打一耙不理解。,异形吓坏8岁小孩家长投诉影城,反对
5068698748979524,OsPaqBFZ2,7563769139,小猫又困了k,自己小孩能不能看没点数吗？还怪别人,异形吓坏8岁小孩家长投诉影城,反对
5068698702318477,OsPam9J8N,7807248663,禹肆冰茶,那么既然让我说几句呢，那我就说几句啊，也是想了想，说哪几句呢，那我就说这几句，那么我相信啊，这几句呢，嗯，也是比那几句强，所以我现在呢，就先说这几句，那么如果大家觉得这几句话不够全面，等会呢，再给我补充几句,异形吓坏8岁小孩家长投诉影城,中立
5068698670861021,OsPaj3BZr,1744927103,猴小沐,这个系列的电影给童年的我带来了生理和心理上的双重阴影……,异形吓坏8岁小孩家长投诉影城,"
支持"
5068698307793439,OsP9IwHqD,2128495763,-六淼-,就是有这种家长，国内做个游戏都麻烦的要死外国游戏那种超帅又写实的怪，我们也都能设计都能做出来，最终都要为了过审修改得萌萌哒,异形吓坏8岁小孩家长投诉影城,"
强烈反对"
5068698232032521,OsP9B8wKB,7801288635,凛熠y_,自己带孩子去看的还投诉影城自愿的能怪谁？是不是没读过书啊智商这么低见人,异形吓坏8岁小孩家长投诉影城,"
强烈反对"
5068674818114469,OsOxPy2Wx,7085262495,修改昵称谨慎提交-,家长的脑壳有问题吧去看之前就因该知道影片是什么类型小孩子能不能看跟人家影院没一点关系,异形吓坏8岁小孩家长投诉影城,"
强烈反对"
5068674713258476,OsOxFdFG4,6302179395,Clavicle_i,之前看个微恐的电影小孩子吓得嗷嗷哭父母还是逼着孩子看完，还在电影院大声喧哗“钱都花了给我看完再走”真不知道有的人是怎么当父母的。,异形吓坏8岁小孩家长投诉影城,"
强烈反对"
5068674690713778,OsOxD2ZGy,6271587219,不让修改昵称称称,不许赔听到没硬气一点！！！讹钱呢！！！,异形吓坏8岁小孩家长投诉影城,"
强烈反对"
5068502118959862,OsK3hBARU,5553683189,盲婚哑嫁7,这些B玩意真该死一死，带你的祖宗有多远滚多远，明知道是恐怖的就拉着你的B玩意往里带是吧？,异形吓坏8岁小孩家长投诉影城,强烈反对
5068502111617232,OsK3h6MIo,7643012354,小仙人球YL,装个毛线，就是来骗赔偿的,异形吓坏8岁小孩家长投诉影城,"
强烈反对"
5068501998115860,OsK35y3iY,6018051301,田柚黎,不是哥们，这适合小孩子看吗？,异形吓坏8岁小孩家长投诉影城,"
支持"
5068501997851442,OsK35wWwa,7788312220,除了小龙虾还有大杂烩,这还能投诉？这不是家长自己带孩子去看的吗？在看之前不了解下影片内容吗？不看看相关介绍？而且是R级提示，不适合未成年人观看好吗？关别人影城什么事？现在买票都是网上买，取了票就进去了。,异形吓坏8岁小孩家长投诉影城,"
强烈反对"
5068501938872095,OsK2ZBe2j,5489815797,卅离仨,还是值回票价的，好久没这么受刺激过了。未成年就别看了，真的又恶心又惊恐,异形吓坏8岁小孩家长投诉影城,中立
5068628225687895,OsNkGnRGf,7468507311,晖炫最重要,？什金嘛未成年人谨慎观看啊你自己孩子多大你自己不知道吗,异形吓坏8岁小孩家长投诉影城,"
强烈反对"
