id,bid,user_id,用户昵称,微博正文,话题,立场倾向
5068509908831482,OsKfQB3tg,1747766363,语文阅刊,作为好莱坞久负盛名的科幻惊悚片，《异形》系列塑造了打不死的外星怪物——异形。成年异形身高2-3米不等，拥有坚硬如铁的外骨骼，腐蚀性超强的硫酸血液，受伤后快速自愈的能力，甚至可以在太空中存活。目前，《异形》系列的最新电影《异形：夺命舰》正在热映。不过，8月17日，“异形太吓人了”话题登上微博热搜，原因是某影城收到投诉，有观众称自家8岁小孩观影途中感到害怕，质疑影城放映儿童不能观看的电影，要求赔偿。随着影片上映，到底该不该带孩子去影院看恐怖片的话题，引发观众讨论。对此，红星新闻记者采访了多名观众以及业内人士，他们表示，《异形：夺命舰》确实不适合孩子观看，家长需慎重选片。此次《异形：夺命舰》与北美同步上映。在美国，该片属于R级片，17岁以下必须由父母或者监护陪伴才能观看。电影在国内上映一刀未剪，出品方20世纪影业多次在其新浪官方微博上提醒“未成年观众谨慎选择观影”，影片海报上也同样提醒“未成年观众谨慎选择观看”。,"异形吓坏8岁小孩家长投诉影城,异形提醒未成年观众谨慎选择观影","
中立"
5068509904372398,OsKfQilsy,1870048752,晴qing空万里,难道这不是家长的责任吗！？,异形吓坏8岁小孩家长投诉影城,"
反对"
5068509725853495,OsKfyoyLd,7697245479,-陨石温泉烤鱼-,那为什么最开始不选一个孩子能看的影片啊？？影城这波无妄之灾啊,异形吓坏8岁小孩家长投诉影城,反对
5068509585867269,OsKfkoCln,2351772334,anna195410,海报写着不推荐18以下看家长真的就不长眼吗,异形吓坏8岁小孩家长投诉影城,反对
5068509342080586,OsKeW8JfQ,5683785715,沉迷学习的小陈_,那我是不是能投诉适合小孩子看的电影太弱智拉低了我的智商,异形吓坏8岁小孩家长投诉影城,"
反对"
5068509069183052,OsKeuCwVK,5709901383,微微de有点萌,这电影不都有预告吗？孩子能不能看家长心里没点数？这有啥好投诉的？看不了就离场呗。咋滴？以后电影院喜羊羊与灰太狼滚动播放呗。,异形吓坏8岁小孩家长投诉影城,反对
5072973444942068,OuCn6kJEM,2725600953,2024事事如意哈,奇葩家长太多，举报这个举报那个的，当年虹猫蓝兔都能被举报涉黄的。艺术来源于生活，感觉应该有个电影拍个奇葩集锦,异形吓坏8岁小孩家长投诉影城,中立
5071391014259169,OtXcNhS0h,7493037287,丅丄丅1412,2024.8.22去看异形，我右边的孩子都吓哭了，父母就光知道递卫生纸，啥也不管，我还好心问了一下那孩子，他说：我本来想看柯南的，父母非得拉着看这个。怎么还有这种父母，孩子的想法不是想法吗？你们父母是过瘾了，孩子呢，孩子都快吓死了你们也不管！一群光知道生不会养的，服了，光是看到这孩子哭就想起以前的我，旧伤也隐隐约约发痛，最后电影放了40分钟左右直接走了不看了以后再也不看这种电影了以上均为一气之下编辑，勿喷，谢谢,异形吓坏8岁小孩家长投诉影城,强烈支持
5071290366690059,OtUAss4ob,7509192755,粗竹鱼粉火锅,yt说这个像老坛酸菜。,"异形:夺命舰,异形吓坏8岁小孩家长投诉影城",中立
5071234838564672,OtT8TzW3S,7082773862,会玩君wpgmedia,《异形》新片吓坏儿童，律师称家长不应甩锅影院日前，一条影院顾客投诉电影《异形：夺命舰》吓坏8岁小孩的话题，登上了热搜榜。据羊城晚报报道，8月16日，顾客带8岁孩子观看《异形：夺命舰》，放映中途孩子表示观影不适、害怕。家长要求影城退票并赔偿。对此，陕西恒达律师事务所高级合伙人、知名公益律师赵良善认为，根据我国电影相关法规规定，“科幻惊悚”等此类影片的观众年龄限制为13岁以上，但这并不意味着13岁以下的孩子都不能观看，而是在家长的陪同下可以观看。赵良善表示，如果家长明知电影有恐怖元素，还坚持带孩子前往观看，那么，作为家长需承担相应的监护责任。《异形：夺命舰》是由20世纪影业出品，雷德利·斯科特担任制片人，费德·阿尔瓦雷兹执导，费德·阿尔瓦雷、罗多·赛亚格斯编剧，卡莉·史派妮、伊莎贝拉·默塞德、爱玲·吴、斯派克·费恩、戴维·荣松、阿奇·雷诺等主演的科幻恐怖电影。,,中立
5070855057446493,OtJglvfaJ,7748819872,新消费财研社,日前，一条影院顾客投诉电影《异形：夺命舰》吓坏8岁小孩的话题，登上了热搜榜。据羊城晚报报道，8月16日，顾客带8岁孩子观看《异形：夺命舰》，放映中途孩子表示观影不适、害怕。家长要求影城退票并赔偿。对此，陕西恒达律师事务所高级合伙人、知名公益律师赵良善认为，根据我国电影相关法规规定，“科幻惊悚”等此类影片的观众年龄限制为13岁以上，但这并不意味着13岁以下的孩子都不能观看，而是在家长的陪同下可以观看。赵良善表示，如果家长明知电影有恐怖元素，还坚持带孩子前往观看，那么，作为家长需承担相应的监护责任。O8岁儿童观影受惊吓家长索赔，影城是否该担责？,"儿童观影受惊吓影城是否该担责,律师称孩子观影受惊吓家长不应甩锅影院",中立
5070807309226058,OtI1kCI7o,1638782947,新浪财经,日前，一条影院顾客投诉电影《异形：夺命舰》吓坏8岁小孩的话题，登上了热搜榜。据羊城晚报报道，8月16日，顾客带8岁孩子观看《异形：夺命舰》，放映中途孩子表示观影不适、害怕。家长要求影城退票并赔偿。对此，陕西恒达律师事务所高级合伙人、知名公益律师赵良善认为，根据我国电影相关法规规定，“科幻惊悚”等此类影片的观众年龄限制为13岁以上，但这并不意味着13岁以下的孩子都不能观看，而是在家长的陪同下可以观看。赵良善表示，如果家长明知电影有恐怖元素，还坚持带孩子前往观看，那么，作为家长需承担相应的监护责任。你认为儿童观影受惊吓影院应该担责吗？,"儿童观影受惊吓影城是否该担责,律师称孩子观影受惊吓家长不应甩锅影院",中立
5070649879691608,OtDVpEFeg,6484449214,iwaitk82,明明知道是恐怖的还带八岁孩子去看，吓坏是谁的问题？一遇到事就投诉呢,异形吓坏8岁小孩家长投诉影城,"
反对"
5070468953933965,OtzdBgvp3,1471416721,萝卜叔叔的车,大半夜一进影厅就紧张《异形》会不会太恐怖，然后全部看完了之后。一个感受：就这？！！！,异形吓坏8岁小孩家长投诉影城,中立
5070323043800886,OtvqgfWMC,2882561962,是名侦探兔美,惊悚好看观影体验很棒，没有一个废镜头，没有一句多余的台词。非常推荐去电影院观看。我前排坐了一堆小朋友，安安静静。毕竟不是恐怖片，可以酌情考虑是否带小孩一起看。,"异形:夺命舰,异形吓坏8岁小孩家长投诉影城",中立
5070211048801029,OtsvCAVy5,1751279674,Hero淇淇淇,首先，我觉得这是家长的责任，片方和影城都有给提示，家长依就我行我素带着孩子去看。。有点不讲理了。。还要让影城赔偿，哪来的脸啊？？其次，只是部怪兽电影，通过音效，来烘托了恐怖的氛围，但是看完后，我过一会就恢复了情绪。没有那么大的影响。。再次，如果自己孩子还小，而且没那么大胆量，家长请考虑下孩子的感受。。自己喜欢自己去看，不要带着孩子看了，孩子吓到了找事情。。,异形吓坏8岁小孩家长投诉影城,反对
5070174111142779,Otry34NhV,3092405521,努力备考的某豆芽,带小孩看异形………宁可真行，但凡看一眼海报呢👋🏻,异形吓坏8岁小孩家长投诉影城,"
反对"
5070126376030029,Otqj3piGx,2618638282,湖南日报,当前，科幻惊悚电影《异形：夺命舰》正在各大影院热映，但“《异形》吓坏8岁小孩家长投诉影城”的话题也随之登上热搜。那么，这类电影儿童青少年适合看吗？看恐怖影片会产生哪些不良后果……8月21日，记者就此采访了湖南省第二人民医院儿少心理科心理治疗师周君玉。@湖南日报O《异形》吓坏8岁小孩？专家：儿童青少年看恐怖片可能导致多种疾病,"儿童青少年看恐怖片可能导致多种疾病,奥运冠军惊喜现身倡议阳光体育,湖南最好看的群文节目齐聚衡阳",中立
5069896098780062,OtkjDAQ5U,3521920721,可乐乐乐乐萌,故意碰瓷？？？孩子不懂家长能不知道？？？不是故意的我是不信的,异形吓坏8岁小孩家长投诉影城,反对
5069825086591176,Otit6rEFi,5226233822,孤独角落_,@孤独角落_:到处都有写未成年谨慎观看，家长非要作死带进去，纯属自己想看却要带上小孩子一起，有想过小孩子想不想看吗？孩子想看可以指引，不想看可以带回家后自己出来看，就算想看哪有一上来看最刺激的，还不如带孩子先看普罗米修斯入坑决定，还得看孩子有没有兴趣，给孩子练胆子也有个度吧，毕竟家长生的孩子，家长也要负责呀，这怪不了电影院，不然加大力度好了，售票前三次提醒，未成年是否有看过异形系列电影，是否对恐怖片感兴趣，是否做好了心理准备，不然一律拒绝未成年进入，家长眼睛瞎了就捐了吧。,异形吓坏8岁小孩家长投诉影城,"
强烈反对"
5069777402074844,Othec8HLe,2095092531,疯里来郁里去,上世纪七十年代美国就开始拍《异形》了，当年第一部投资一千多万美金，就算这个太遥远了，但是九十年代至今，关于异形的影视多的数不过来，几十部总是有的。万万想不到在2024年，在中国，还有家长带着孩子去看这种题材，然后因为孩子害怕而投诉电影院的事情发生。,异形吓坏8岁小孩家长投诉影城,"
强烈反对"
5069552772449100,OtbnTah7C,7564513756,复机368-,闪灵惊魂记生化危机的恐怖来自于特定环境特定角色强设定的恐怖异形的恐怖是一种高于现实但最后又能归于现实的唯物主义恐怖结合食用更佳,异形吓坏8岁小孩家长投诉影城,中立
5069538641315290,Otb165wam,1625784680,异形天下,约有十年没进影院了，这回专为了老异的“异形”走进了影院。因为听说反响不错，且基本无删减，所以好奇心加重。选择的可能是深圳最好的影院，买得最贵的票IMAX厅。荧幕确实很震撼，占据了满满的一堵高墙；音响也格外给力，震得人心里发慌；效果很清晰，因为剧情大多发生在室内更显效果。由于做足了充分准备，满怀希望而来。然而希望越大、失望越大，几次差点睡着。故事时间选择在异形1和异形2之间，故也是导演向异形老导演的致敬。舰艇内的电脑设备，也是异形1/2时间的老设备，所以更有点怀旧的感觉。其实，若真有异形存在，加上当时的航天科技，更应该是发生在未来。而未来科学技术如何，我们今天仍难以想像。影片也延袭了老异形电影的叙事模式，全程都在你追我杀。至于恐怖程度，私毫没有感觉。也许对于第一次看恐怖电影的观众，可能有点受惊。如电影吓坏了8岁小孩，家长投诉影城要求退票并赔偿。经过这次“上当”，老异又不想进影院了。当然对于喜欢看电影、又希望享受电影院巨幕巨声氛围的人而言，仍不失为一次良机。,,中立
5069533104570920,OtaSajb6w,2050260197,胖哥杨力,电影看完了，该吓人的地方还是挺吓人的。只是异形那个怪物的道具看上去还是塑料感或者树脂感十足，缺少肉体的质感。我不知道相比国外版本删掉了多少。但即便是现在这样，竟然能通过审查上映，我是特别感谢审查的那些人想带孩子去享受天伦之乐的，还是别去了。免得到时候吓哭了，你投诉或者发牢骚，也没有什么人支持你。最好看IMAX。除了巨大画面之外，声场也会跟普通的影院完全不一样。,"异形夺命舰,异形吓坏8岁小孩家长投诉影城",中立
5069454918549628,Ot8Q3zS9e,6421111471,黑猫投诉,|新京报快评？据报道，近日，某影城收到投诉，有观众称自家8岁小孩在《异形：夺命舰》观影途中感到害怕，质疑影城放映了儿童不宜的电影，要求赔偿。这也引发了家长到底该不该带孩子去影院看恐怖片的讨论。在北美地区，该系列电影一直被分类为R级，即限制级，“17岁以下必须由父母或者监护陪伴才能观看”。为此，该片出品方多次在其官方微博上提醒“未成年观众谨慎选择观影”，官方海报也有同样的提醒内容。但事实表明，还是有家长并没有在意这一提醒，带着未成年孩子去电影院看了电影，孩子被“吓着”后才提出质疑。你觉得家长该带小孩去看恐怖片吗？,"异形吓坏小孩家长不能无视观影提醒,家长该不该带孩子去看恐怖片",反对
5069454527956408,Ot8PqxnPa,5889334558,读秒财经,？？据报道，近日，某影城收到投诉，有观众称自家8岁小孩在《异形：夺命舰》观影途中感到害怕，质疑影城放映了儿童不宜的电影，要求赔偿。这也引发了家长到底该不该带孩子去影院看恐怖片的讨论。在北美地区，该系列电影一直被分类为R级，即限制级，“17岁以下必须由父母或者监护陪伴才能观看”。为此，该片出品方多次在其官方微博上提醒“未成年观众谨慎选择观影”，官方海报也有同样的提醒内容。但事实表明，还是有家长并没有在意这一提醒，带着未成年孩子去电影院看了电影，孩子被“吓着”后才提出质疑。投投看：你看过异形吗？,"异形吓坏小孩家长不能无视观影提醒,家长该不该带孩子去看恐怖片,暑期档高开低走电影院被抛弃了吗",中立
5069224055671246,Ot2PHnNlI,5673093466,我在沙滩画个圈儿,免费投屏看个能把小孩吓哭的《异形:夺命舰》😱👿👿其实也没那么可怕,"异形:夺命舰,异形吓坏8岁小孩家长投诉影城,异形",中立
5069209434850371,Ot2s7klNN,5103099680,love唯爱521,简直奇葩，带小孩去看惊悚片，家长谴责谴责自己吧,异形吓坏8岁小孩家长投诉影城,强烈反对
5069206704098643,Ot2nIhcf9,5040812990,千年糕贝贝,十八岁小孩也被吓哭了。。。@也曾种菜的卷鹅,异形吓坏8岁小孩家长投诉影城,中立
5069199078065985,Ot2bpxQkx,2416967903,鄂尔多斯融媒,？据报道，近日，某影城收到投诉，有观众称自家8岁小孩在《异形：夺命舰》观影途中感到害怕，质疑影城放映了儿童不宜的电影，要求赔偿。这也引发了家长到底该不该带孩子去影院看恐怖片的讨论。在北美地区，该系列电影一直被分类为R级，即限制级，“17岁以下必须由父母或者监护陪伴才能观看”。为此，该片出品方多次在其官方微博上提醒“未成年观众谨慎选择观影”，官方海报也有同样的提醒内容。但事实表明，还是有家长并没有在意这一提醒，带着未成年孩子去电影院看了电影，孩子被“吓着”后才提出质疑。O“《异形》太吓人了！”家长不能无视观影提醒|新京报快评,"异形吓坏小孩家长不能无视观影提醒,家长该不该带孩子去看恐怖片",中立
5069194603009392,Ot24ccCSA,6029541269,Carinadolls卡瑞娜布偶猫繁育人,电影超话总的来说还是很过瘾的，感觉是开了另一条世界线。值回票价，个人认为有7分。好的地方，尺度，据说没有删减，还真是审核开绿灯了。音乐棒，有致敬前作，有那种经典异形年代感的复古曲风。剧情简单没有硬伤。作为恐怖片，吓人的地方，除了那个人形的是真的有点心理上的恐惧！其他基本上就是一惊一乍突然出现的形式，感觉不是很高级，但是确实也是会被吓到，真真买的是imax票，看的是指缝版。不好的地方，男女主感情线交代的有点差。人类的自瞄武器太bug，后期是真的不带怕的，全用枪突突了，恐惧来源于火力不足呗。最后的最后这电影真真不适合小朋友看，还是别祸祸小孩子了。,"追剧打卡,暑期嘉年华,异形,异形吓坏8岁小孩家长投诉影城,电影正当夏",中立
5069193418378040,Ot22hz9vG,6571168702,隔夜也很宅,《异形：夺命舰》被家长举报上热搜了，但众所周知，“家长举报”往往也是一部影视作品能否成为佳作的度量尺，家长们越是凶狠举报的作品，那它就越有佳作的潜力。,"异形:夺命舰,异形吓坏8岁小孩家长投诉影城,亿点曝光计划",中立
5069191430537270,Ot1Z52fLE,1740779753,风铃爱吃甜提子,异形夺命舰看完。。怎么说呢。。集胆大无自知之明圣母心爆棚等元素之大成。。当然还有就是确实包含了大量科幻元素，好看的。重申不适合未成年人观看！！！至少是未上过初中生理卫生课的未成年人不适合！！,异形吓坏8岁小孩家长投诉影城,"
强烈支持"
5068509006532485,OsKeorpoF,2196096201,北京的晖子,都在骂家长不该带孩子看恐怖电影，自己脑瘫选择错误还有脸投诉。我就盼着什么时候能施行电影分级制，大家都能拍出自己想拍的，看到自己想看的，不用藏着掖着，大大方方痛痛快快。,异形吓坏8岁小孩家长投诉影城,"
强烈反对"
5068508176058414,OsKd3pq4m,6418908420,卡迪那通心特别脆,那么多电影和动画片，你不带孩子看，偏偏看《异形》？身为家长是一点功课都不做啊！,异形吓坏8岁小孩家长投诉影城,"
强烈反对"
5068508167407834,OsKd2v57c,5239100370,是卓zhuo啊,你别说你还真别说，有点想看了,异形吓坏8岁小孩家长投诉影城,中立
5069418306997899,Ot7T0tmtl,5609081779,凌晨没有14度风,中国电影这个不过审，那个不过审，这个删减，那个不行，都是因为这些SB家长，真气愤！！！,异形吓坏8岁小孩家长投诉影城,强烈反对
5069384902770841,Ot718bCOZ,6119645394,手可摘星陈Smile,没看的时候好奇看了之后纯恶心家长还是长点心吧，确实不适合带孩子观看,"异形:夺命舰,异形吓坏8岁小孩家长投诉影城",强烈反对
5069380239491859,Ot6TBDPgv,6124642021,新京报我们视频,近日，好莱坞科幻惊悚电影《异形：夺命舰》正在热映。在北美地区，该系列电影一直被分类为R级，即限制级，“17岁以下必须由父母或者监护陪伴才能观看”。此次国内院线引进《异形：夺命舰》，系与北美同步上映，也因此“一刀未剪”。这一点甚至成为了国内院线的营销卖点。为此，该片出品方多次在其官方微博上提醒“未成年观众谨慎选择观影”，官方海报也有同样的提醒内容。保护未成年人，选择适合孩子观看的影片，需要出品方、影院、家长各司其职。O“《异形》太吓人了！”家长不能无视观影提醒,"并非所有公映电影都适合带孩子观看,异形吓坏8岁小孩家长投诉影城","
反对"
5069362621056651,Ot6rc4qSL,1874361623,韩东言,不能因为自己的错误，倒打一耙，反咬一口！这都不是仙女了，简直是圣母级别！？据报道，近日，某影城收到投诉，有观众称自家8岁小孩在《异形：夺命舰》观影途中感到害怕，质疑影城放映了儿童不宜的电影，要求赔偿。O“《异形》太吓人了！”家长不能无视观影提醒|新京报快评,"异形吓坏小孩家长不能无视观影提醒,家长该不该带孩子去看恐怖片",中立
5069141707064566,Ot0GStDOC,1750349192,FM93浙江交通之声,93小调查：你觉得恐怖类的电影可以怎么提醒观众？杭州超话你觉得恐怖类的电影可以怎么提醒观众？,"杭州多家影院称异形新片正常放映,杭州影院对未成年观看异形进行提醒,异形吓坏8岁小孩家长投诉影城",中立
5069129118386287,Ot0mzzbEH,1506983251,朦呆的毛毛,这家长自己有问题吧，真是林子大了什么鸟都有，我自己不会看，更不会带孩子看,异形吓坏8岁小孩家长投诉影城,"
强烈反对"
5068870566283518,OsTDyqmD4,2741779222,SyfyRunner,20世纪福克斯高低要给这家长磕一个！至少预估不到3亿！现在票房都给干到预估7亿了！,异形吓坏8岁小孩家长投诉影城,中立
5068869117152236,OsTBdu0CE,6139721682,羽林街太微,从我本人来说，比较排斥血腥暴力的电影，所以一般不会去看。但是我支持这种电影上映，因为我不喜欢，总有人喜欢，别的国家都能上，我们当然也能上，我们不差啥！“我反对你说的每一句话，但我誓死捍卫你说话的权利”，这才是民主的题中之义！你可以不喜欢，但是请不要动不动就可耻的举报！,异形吓坏8岁小孩家长投诉影城,支持
5068853489698425,OsTc0EH0d,7091062455,明天不逃课,怪不得吓坏了，这部真的好吓人啊！！！！感觉比前几部节奏更快,异形吓坏8岁小孩家长投诉影城,"
强烈支持"
5068848513944080,OsT3Zgy2c,5684577237,Hasminee,大家快去看吧这电影只有中国上映的没有被删减其他国家的多多少少都被删减了再不看就没了,异形吓坏8岁小孩家长投诉影城,中立
5068843519313201,OsSVVD4MV,5681145892,oayel-,被这个热搜整得来兴趣去看现在只想说：骗人！！！,异形吓坏8岁小孩家长投诉影城,"
强烈反对"
5068836758620898,OsSL1AaGK,7600734263,快乐可心发财中,吓得我赶紧去看！就怕被投诉下架了。还是小时候的味道啊，说实话，没以前恐怖吧……,"各大影院回复异形新片取消放映传言,异形吓坏8岁小孩家长投诉影城,异形",中立
5068835806515222,OsSJurkUe,5547419543,多崎作和他,《Alien:Romulus》,"异形吓坏8岁小孩家长投诉影城,异形夺命舰",中立
5068834134301895,OsSGNi37p,5118926577,安阳市第二十五中学,安阳市第二十五中学超话引发热议，恐怖片让人看了胆战心惊，爱好者却不在少数。从科普的角度来说，这是为什么？有时候，看恐怖片是在释放压力。看恐怖片时，大脑会把电影情节当成现实，将自己代入电影中的人物，认为真的在经历危险，大脑迅速进入备战状态，极其紧张、兴奋。随着观影的结束，回到现实，大脑会马上判断现在安全了，就会解除备战状态而得到放松。一张一弛的过程会让大脑觉得自己打了一场胜仗，产生良好、舒适的感觉。另外，大脑还有一个特点，就是不能同时兴奋全部脑区，常常此消彼长。如果我们的学习和工作由A区掌控，观看恐怖片由B区掌控，当B区兴奋时，A区就会受到抑制。所以看恐怖片紧张兴奋时，掌管学习和工作的脑区是非常放松的。这也可以解释为何恐怖片对缓解学习和工作压力很有效。,"明明很怕为什么还忍不住要看恐怖片,异形吓坏8岁小孩家长投诉影城",中立
5068507777337898,OsKcpuMVc,7077174306,ThrISNnn,好不容易逐渐放开的尺度又要没咯,异形吓坏8岁小孩家长投诉影城,中立
5068507771574524,OsKcp6BBy,2855459004,可可爱chi鱼,这么脑残做什么家长啊？先去考个证吧，真是啥人都能当家长,异形吓坏8岁小孩家长投诉影城,强烈反对
5068507630800291,OsKcb3mbV,7801624068,见假期一面,自己带去的，还怪人家吗,异形吓坏8岁小孩家长投诉影城,中立
5068507595150698,OsKc7lBVM,7817222125,冰淇淋卖爆,还是快点推动分级吧，电视剧，电影，书籍，包括新出现的短剧，都需要分一下。,异形吓坏8岁小孩家长投诉影城,"
支持"
5068823189788279,OsSp8F4nt,1954442504,沃尔玛购物袋祖国版,鬼节看鬼片好看爱看精致下饭,异形吓坏8岁小孩家长投诉影城,中立
5068822734445189,OsSopiEoB,7384489998,悲伤小准,你自己不看简介还告上了好不容易审核松一点了,异形吓坏8岁小孩家长投诉影城,"
反对"
5068822674149511,OsSojhptB,7609726433,Taroballs_my,为啥要带8岁小孩看这种,异形吓坏8岁小孩家长投诉影城,"
反对"
5068820965758629,OsSlyoa57,1761213261,IMMMine,我真的不懂……就算没分级，你们以为《异性》听起来是喜羊羊大战灰太狼吗？？？,异形吓坏8岁小孩家长投诉影城,"
强烈反对"
5068816978023929,OsSf7xFod,2202121377,徒有旭名Hansen,七月十五，满街烧纸祭奠的人群，几丝残云蔽月，这么美好的夜晚，异形出没。,异形吓坏8岁小孩家长投诉影城,中立
5068815598355560,OsScTz3F6,1887935403,阴阳怪气的打工元气仔,不适合小孩，只适合我这种年纪大的在大荧幕上看真刺激！不过惊悚程度上不如前几部。感觉女主都有点莞莞类卿了。,异形吓坏8岁小孩家长投诉影城,中立
