id,bid,user_id,用户昵称,微博正文,话题,立场倾向
5068637453421114,OsNzzelZg,7766088986,豆豆十二k,异形是我唯一一个看到一半从影院跑出来的，很可怕。,异形吓坏8岁小孩家长投诉影城,中立
5068637427732892,OsNzwwrG4,6182471206,小神龙影视俱乐部,这种片子怎么能带小孩去看,异形吓坏8岁小孩家长投诉影城,反对
5068637421700280,OsNzw78jS,3951891017,喵喵9love狐作非为_D,明明是自己的问题，怎么还好意思投诉？片子明确注明了谨慎观看。8岁的孩子是不适合看这种电影的，但凡有点常识的家长也不会到犯这种错误！,异形吓坏8岁小孩家长投诉影城,强烈反对
5068637421700896,OsNzw78tO,1242857320,肥鱼鳞,家长也是心大，什么片都带孩子去看,异形吓坏8岁小孩家长投诉影城,中立
5068637347512698,OsNzovwoy,7547083580,下禹天淋雨,不是这种电影肯定会有提示啊那你带孩子去干啥,异形吓坏8岁小孩家长投诉影城,中立
5068637322350120,OsNzm9Rna,7356456681,zynnk1221,觀看前不是都多少會了解電影內容嗎這家長想敲詐賠償金也不是這樣子吧,异形吓坏8岁小孩家长投诉影城,反对
5068637310550099,OsNzl2j6z,5574688786,Jesus-Yang,家长看着海报是不是以为是熊出没,异形吓坏8岁小孩家长投诉影城,中立
5068637295608849,OsNzjnx7j,2887295930,玉树夜半,家长首先就该骂，不了解清楚电影就带娃去看，第二中国没分级，电影院海报也不标清楚这片美国都标注17岁以下禁看，这对8岁的孩子心理阴影会有多大啊，做噩梦算轻的了，8岁神经发育都还没发育完全呢！,异形吓坏8岁小孩家长投诉影城,"
支持"
5068637284861532,OsNzikoHO,2789942695,米格战斗飞机联合体,我国应该出台相应的电影分级制度了。至少先明确一个14岁以下儿童不适宜观看的电影标准。,异形吓坏8岁小孩家长投诉影城,支持
5068637249471554,OsNzeDJZ0,6625365115,林博洋的96号星球-,不是什么影片都适合带孩子去看的,异形吓坏8岁小孩家长投诉影城,"
支持"
5068637213296442,OsNzbdPyq,5638041646,云里朵朵,我服了某些家长能不能别太剑了,异形吓坏8岁小孩家长投诉影城,"
强烈反对"
5068637188391542,OsNz8zd1s,6290642101,黑评VVV,自己没文化真可怕，人家影院播放什么电影，适合什么人群观看都是有提示的，你自己想看然后带一个8岁小孩看恐怖片，之后又要求影院赔偿，这不是又当又立的做法吗？有些人虽然长着一个脑子但是又好像没脑子似的。,异形吓坏8岁小孩家长投诉影城,"
强烈反对"
5068637163225990,OsNz6dxe6,7874382237,虎天帝,我就奇怪了身为监护人，明明知道恐怖片成年人看都会怕，还带8岁小朋友去，还反手投诉电影院，真的想不到还有这种只会推卸责任的,异形吓坏8岁小孩家长投诉影城,"
强烈反对"
5068637008038604,OsNyQxJcU,7832029969,tianan甜安_kiku,作为好莱坞久负盛名的科幻惊悚片，《异形》系列塑造了打不死的外星怪物——异形。成年异形身高2-3米不等，拥有坚硬如铁的外骨骼，腐蚀性超强的硫酸血液，受伤后快速自愈的能力，甚至可以在太空中存活。,异形吓坏8岁小孩家长投诉影城,中立
5068636816146935,OsNyxpN67,7083843316,-辞酱-,看封面都知道很吓人想看自己去看就好了，带着孩子一起去看，怪自己怪影城干什么,异形吓坏8岁小孩家长投诉影城,"
反对"
5068636798845374,OsNyvB75k,6456703639,救援先锋玄德公,家长能让孩子去看异形？厉害了。不知道这玩意吓人吗，还是说就是故意的。,异形吓坏8岁小孩家长投诉影城,强烈反对
5068636798845340,OsNyvB74M,5111585570,配享太庙苏媚拉,不要上来就扯什么“电影分级制度”，拿这个当借口这么多年了，大家应该都心知肚明，在可以想见的未来都不会有这个制度的出现。像《异形》这种电影，无论是海报，标题以及观影提示都在明晃晃的劝退未成年人，家长一丁点背景功课都不做就带着小孩去看电影，看完还要投诉影城，我只能说这家长的心理年龄估计还没有他孩子大,异形吓坏8岁小孩家长投诉影城,中立
5068636769488435,OsNysDOnh,5039558895,十七岁的情话my,都说了未成年人禁止观看，你这小孩子带进去，出事还找影院？,异形吓坏8岁小孩家长投诉影城,"
反对"
5068636762933379,OsNyscj6z,5297670040,惹了白,你花钱看了异形害怕投也就投了，我请问731上都没上是谁给投下去的？投诉的人是什么成份？这么不敢正视历史吗,异形吓坏8岁小孩家长投诉影城,"
强烈反对"
5068636744322047,OsNyqi8mr,5387582161,Enemy_雪中诉祎念,。。。。那为什么还要带他去看。。,异形吓坏8岁小孩家长投诉影城,中立
5068636735668798,OsNypnMIe,5726464494,你在薛一遍x,小孩子不懂事，大人可懂点事吧。,异形吓坏8岁小孩家长投诉影城,中立
5068636718368468,OsNynz71i,5600461589,leon99349,怎么会有那么多无知说是家长的问题呢？这是影城的水军吗？这是制度缺失，既然知道国外要电影分级，为什么我们不分级，就为了那点金钱利益，分级了不能全民观看吗？有的人就是没见识没看过简介随便选一部和孩子看怎么办？,异形吓坏8岁小孩家长投诉影城,"
强烈反对"
5068636690055495,OsNyl0er5,7323939536,梦里桃花香丷,有点脑子的家长谁特么会带八岁孩子去看《异形》啊？？？傻苾！！！,异形吓坏8岁小孩家长投诉影城,强烈反对
5068636668824850,OsNyiB1Ki,2626622641,一只小麦桑,昨晚被超哥和朋友忽悠着看了，整个过程魂飞魄散，就此留下“异形后遗症”“画面不吓人，我要被边上的你拽着的手吓死了”,"异形太吓人了,异形吓坏8岁小孩家长投诉影城",中立
5068636654144221,OsNyhho6h,7827824720,時_祤,这家长不纯纯没事找事吗？,异形吓坏8岁小孩家长投诉影城,"
强烈反对"
5068636606431413,OsNycqZ6t,1856582954,尘嚣笛笛,脑子有病的人就别生孩子了害人害己,异形吓坏8岁小孩家长投诉影城,"
强烈反对"
5068636588870829,OsNyaBdHT,7869971867,单存想要你,人家辛辛苦苦拍的🙄🙄这不纯纯搞人心态嘛,异形吓坏8岁小孩家长投诉影城,"
强烈反对"
5068636546400563,OsNy6qR4T,6599899101,七夏诗,"先举报自己吧，怀上的时候涉黄了都说了未成年谨慎观看,去买电影票之前预告不看吗？",异形吓坏8岁小孩家长投诉影城,"
反对"
5068636525431970,OsNy4mN6q,7290723484,甜崽公证处,家长脑缺吗，这种东西不该自己甄别好再带小孩去看吗,异形吓坏8岁小孩家长投诉影城,反对
5068636522545282,OsNy4aG8W,6909989437,你磕的CP已经be了,拍了那么多，不清楚是什么类型电影的话，建议看完前几部，海报也看仔细,异形吓坏8岁小孩家长投诉影城,中立
5068636497381163,OsNy1uYb1,7544095566,挚爱始于阿志,可以家长自己去没必要带着孩子一起去看啊,异形吓坏8岁小孩家长投诉影城,中立
5068636491874519,OsNy17REb,6032296199,Tslshp,这个封面是个人看了都觉得很吓人，还带小孩子去看，真的没脑子,异形吓坏8岁小孩家长投诉影城,"
强烈反对"
5068636480604318,OsNy02xd4,7735183774,蜡笔-猫ang,@Twice127罗渽民哇这么恐怖吗我要去看,异形吓坏8岁小孩家长投诉影城,中立
5068636379940387,OsNxPFHWP,5055069472,爱吾及吾iii,先投诉投诉自己怎么成为家长的吧,异形吓坏8岁小孩家长投诉影城,"
反对"
5068636343765771,OsNxMfNEf,6631839855,薄荷波子糖,神经病。所以什么时候才能分级,异形吓坏8岁小孩家长投诉影城,中立
5068636190934619,OsNxx3V8v,5579689933,a小子别太拽_,没头脑和没脑子，还是呆在家吧。不要出门了,异形吓坏8岁小孩家长投诉影城,"
强烈反对"
5068636016610452,OsNxfrJGc,7612777341,英子吖1005,这个不能怪人家影城吧，带儿童去看电影就应该看儿童类的，把孩子吓了这难道不是家长的责任更多一些吗,异形吓坏8岁小孩家长投诉影城,中立
5068635996949825,OsNxdt9XX,7853709624,纯翎,护犊子的家长有病似的，它就不适合小孩去看非要带孩子去，8岁小孩你带他去看动画电影去呗，往这里钻什么，真是被这种无脑的家长恶心到了,异形吓坏8岁小孩家长投诉影城,强烈反对
5068635888420586,OsNx2zkzU,7725077904,kiku橘刈芷,啊家长怎么想的啊！带8岁小孩看这个！,异形吓坏8岁小孩家长投诉影城,"
强烈反对"
5068635810824809,OsNwV3szn,5846301681,一卷路人饼,哈哈哈哈幽默，年度笑话开始竞争了吗？富贵官方超话,异形吓坏8岁小孩家长投诉影城,中立
5068635808990386,OsNwUBIOe,7735183774,蜡笔-猫ang,若如纸吗不是又没人逼你去看,异形吓坏8岁小孩家长投诉影城,中立
5068635716715950,OsNwLsb7M,6006468247,零零7祺,笑死了我都18了我爸都不想带我去看怕吓着我带8岁小孩儿去看是真逆天啊,异形吓坏8岁小孩家长投诉影城,中立
5068635686830604,OsNwIsEX2,7888240509,恋晟世,破防了我真的破防了就因为你的一句质疑我直接丢盔弃甲了你拆穿我那一秒我满头大汗浑身发冷抑郁症瞬间发作了生活也仿佛没了颜色像是被抓住尾巴的赛亚人带上海楼石的能力者抽离尾兽的人柱力,异形吓坏8岁小孩家长投诉影城,"
强烈反对"
5068635645938682,OsNwEoUVc,6459373954,休想害本喵,带着小孩看啥啊，自己没一点责任，还投诉，莫名其妙的,异形吓坏8岁小孩家长投诉影城,"
强烈反对"
5068635640957055,OsNwE40Yn,7902564589,多多下雨JC-T,家长为什么要带小孩去看这种,异形吓坏8岁小孩家长投诉影城,中立
5068635632567929,OsNwDaM2d,7449941232,_瞌睡小狗,自己要带孩子去看怪影院干嘛胆子小就别看,异形吓坏8岁小孩家长投诉影城,"
反对"
5068635603731085,OsNwAfECN,6464531938,天贼傻只因_,你问我520是什么意思我笑了五是每周必跑五个地方易物所基础训练试炼场冬谷竞赛招集二是每天必喝两瓶冬谷神秘水零是对体力不够零容忍严肃,异形吓坏8岁小孩家长投诉影城,中立
5068635557594769,OsNwvvRKh,7726081157,函数凯喵_,明知道这种题材你还带小孩看。啥心里？,异形吓坏8岁小孩家长投诉影城,"
反对"
5068635527971333,OsNwsxrHT,2606812875,牛哥碎念,哎呀，真的是，就是因为有这样的人存在，才导致我们现在越来越难看到好电影了。你说说看，这事儿主要还真就得怪家长。家长们看电影的时候怎么能不看类型、不看预告就随随便便带着孩子去看呢？就比如说某些电影，在美国那可是属于R级片呀，17岁以下的孩子必须得由父母或者监护人陪伴着才能观看呢。咱国内影片的海报上也明确提醒了“未成年观众谨慎选择观看”，家长们可真得多长点心眼呀。你想想看，国内的观众都呼吁了好多年了，这影片分级到底什么时候才能有点音讯呢？咱也不知道啥时候才能真正实现影片分级制度，让大家都能根据自己的喜好和年龄选择适合的电影观看。要是有了影片分级，家长们带孩子看电影的时候也能更有针对性，不至于出现一些不适合孩子观看的情况。而且这样也能让电影制作方更加明确不同类型电影的受众群体，制作出更多更好的电影来满足大家的需求。总之，希望影片分级制度能早点到来吧。,异形吓坏8岁小孩家长投诉影城,中立
5068635492057795,OsNwp8Dkf,5852215869,芒果梨子味牛奶,这个投诉影城肯定都无语了，明明已经提醒了，总不能明明白白的拒绝小朋友吧。家长进去之前自己不看不在乎，孩子哭了怪影城，换个角度，不正是警示教育的好机会嘛。与其投诉，还不如好好想想怎么能让孩子从中学到点儿什么，毕竟都被吓哭了。情感超话,"异形吓坏8岁小孩家长投诉影城,新星闪光计划",中立
5068635468465963,OsNwmzwnN,2337934732,李妙卡不卡的,神经，家长带小朋友去看异形，自己行为无知怪别人,异形吓坏8岁小孩家长投诉影城,"
强烈反对"
5068635460862467,OsNwm3CmL,6942587817,古有风情月下谈之888,明知道这是恐怖片，家长为什么还要带小孩去看？明明电影有儿童专场啊。,异形吓坏8岁小孩家长投诉影城,中立
5068635313277437,OsNw7dKBT,5016528498,杨七羊-,可能是小孩带家长去看的，家长吓坏了,异形吓坏8岁小孩家长投诉影城,中立
5068635305150882,OsNw6lBYK,6836956604,偷傅诗淇的苦茶子,？真是不是一家人不进一家门,异形吓坏8岁小孩家长投诉影城,中立
5068635299121293,OsNw5CgRD,7869478191,衫衫1050,小孩这么容易就吓坏了吗，看那些小小年纪就在30层楼高玩空中飞人的。合理怀疑是自导自演想讹钱吧？,异形吓坏8岁小孩家长投诉影城,"
反对"
5068635247478531,OsNw0vnvt,5526336208,Battle_km,家长投诉了，影片要下架了，历史的齿轮又开始循环了,异形吓坏8岁小孩家长投诉影城,中立
5068635221000298,OsNvY4cdQ,6459775320,深一度,家长该不该带孩子去影院看恐怖片？家长该不该带孩子去影院看恐怖片,异形吓坏8岁小孩家长投诉影城,中立
5068635175912743,OsNvToOaP,2865811460,问心不吃香菜,这电影就不适合孩子，家长不知道？,异形吓坏8岁小孩家长投诉影城,反对
5068635119027569,OsNvNBStX,2494095171,爱做富婆梦的露露,带孩子去，吓到了就投诉，很符合一些中国家长,异形吓坏8岁小孩家长投诉影城,反对
5068635062930510,OsNvIcimi,6643316165,记得一直向上,异形拍了那么多部，海报也没仔细看的话，看名字都异形了,异形吓坏8岁小孩家长投诉影城,中立
5068634735512023,OsNvbn7VB,6474665160,眠弈寄风,不是你家长带小孩去看这个干什么？到头来还怪上人家影城了，小孩不懂大人也不懂嘛？,"异形吓坏8岁小孩家长投诉影城,异形提醒未成年观众谨慎选择观影",反对
5068634693045122,OsNv7cMaS,5657579866,我要左第一,这些类型的不本身家长就应该考虑一下自家孩子的承受能力吗？,异形吓坏8岁小孩家长投诉影城,中立
5068634672858969,OsNv5bZKp,6639940201,八宝水果硬糖,家长有毛病吧凭什么播放的影片就必须儿童也都能看啊有些就是不适合儿童还非要带着孩子看不就是家长自己不负责还要把责任转嫁给影院吗,异形吓坏8岁小孩家长投诉影城,"
强烈反对"
5068634598933548,OsNuXBu1u,6180778893,地铁判官呀呼嘿呦,家长自己心里没点B数吗带孩子去看反而投诉影院……晚上就去看,异形吓坏8岁小孩家长投诉影城,"
强烈反对"
5068634549912444,OsNuSFAG8,5241415576,花溪_x,啊？就是说你选电影的时候光看名字不看海报不看简介吗？那惊悚片你带孩子看？。孩子不知道是什么家长你不会没看过电影叭这观影之前看看啥类型的不就是一眼的事吗？？,"异形吓坏8岁小孩家长投诉影城,异形提醒未成年观众谨慎选择观影","
强烈反对"
5068634500891130,OsNuO3JP4,7367218743,不变的初心纯粹的热爱,知道是恐怖科幻心里没点数吗，还要带孩子去看，吓到了，又怪这怪那的。,异形吓坏8岁小孩家长投诉影城,反对
5068634355404913,OsNuzmG41,3987179734,爱傻的竹子,现在服务业不好干，就是奇葩太多，没人会有好心情了,异形吓坏8岁小孩家长投诉影城,中立
5068634336005828,OsNuxpcoc,1569904092,Tiger津言,实在不懂，这电影无论电影院放的预告、电影海报还是购票平台都写了“未成年观众谨慎选择观看”，就算没看过异型，购买或是看预告宣传的时候也知道这不是一个8岁小朋友能看的电影啊，为什么自己执意偏偏要带着孩子去，受到惊吓还要投诉影城，不知道的还以为影城绑着你和孩子去看呢,异形吓坏8岁小孩家长投诉影城,"
反对"
5068634327878233,OsNuwx3uh,7789979273,上网来玩的,异形不知道的话可以理解，后面“夺命舰”三个字也不认识？带八岁的孩子看恐怖片吓唬他，确定这是亲生的吗？该不会是来讹钱的吧,异形吓坏8岁小孩家长投诉影城,"
强烈反对"
5068634243728910,OsNuofE3I,7750995936,小洋快跑哒哒哒,…………中国电影有你们真是服气丫～,异形吓坏8岁小孩家长投诉影城,中立
5068634119210416,OsNubCE36,7617124937,改名中勿杠,怎么觉得更像是影片炒作呢？什么都没有就只有一个所谓的报备文字,异形吓坏8岁小孩家长投诉影城,"
反对"
5068634063898346,OsNu6gm8y,6013508393,环球总财,小调查家长是否该带孩子看限制年龄的电影吗？家长是否该带孩子看限制年龄的电影？,异形吓坏8岁小孩家长投诉影城,中立
5068670499554984,OsOqRE5GE,7816493301,ID_零下叁肆度,不都说了未成年谨慎观看吗,异形吓坏8岁小孩家长投诉影城,中立
5068670365338927,OsOqEmoTJ,7343463939,萨沙·AM·,能闹这么大，估计家长在现场是脸面过不去了或者被孩子的反应吓到了：1⃣️孩子吓吐了、吓拉了、吓尿了……2⃣️孩子吓抽抽了……说明还是不要带自家孩子看不适合自家孩子的内容。比如我到现在都不看日本、泰国、香港鬼片。🙏,异形吓坏8岁小孩家长投诉影城,中立
5068670342795177,OsOqCbJ9v,5300693232,春花上树,投诉天投诉地，投诉老师投诉学校投诉电影院投诉整个社会，遇事指责他人，绝不反思自己。当代家长是这样的,异形吓坏8岁小孩家长投诉影城,"
强烈反对"
5068670265200197,OsOqulOO9,6433667950,去看看未见的广袤y,…为啥家长要带小孩去看啊？看之前就能知道是惊悚片了，同期电影院里面又不是没有动漫电影看,异形吓坏8岁小孩家长投诉影城,反对
5068670206216388,OsOqoq5ak,7806973027,晚间花盛开_Kersville,那为什么要看啊，看的也是你，投诉的也是你，这个世界上又不是只有你们一家人，搞什么啊，领孩子去看就得注意一些吧，还是想要赔偿,异形吓坏8岁小孩家长投诉影城,"
强烈反对"
5068670149595639,OsOqiEggn,6244556687,大帅逼-宋阁蒽,这是家长自己要给人家看的还怪人家电影,异形吓坏8岁小孩家长投诉影城,"
反对"
5068670113940134,OsOqfgx0y,6973688484,阿粒_li,这些家长真的毫无边界感,异形吓坏8岁小孩家长投诉影城,"
反对"
5068670055747343,OsOq9o795,7787376268,迷樗思见露rosy-,斗志和干劲很重要，但更重要的，是不断坚持的努力。无论你已经工作还是仍在校园拼搏，都不要忘记当初你怀揣梦想的勇气。把那一刻的勇气，变成此刻的坚持，你终将遇见更好的自己。,异形吓坏8岁小孩家长投诉影城,中立
5068670030579450,OsOq72qJY,6595852867,韬略之王_,现在有些家长真是太离谱了，你家小孩是太子嘛，什么都不能看，那干脆让他一辈子吃喝拉撒都在房里，隔绝一切外界因素得了呗,异形吓坏8岁小孩家长投诉影城,"
强烈反对"
5068670030321035,OsOq71lvZ,2763361615,真水无香驾到_dx,为什么要带8岁的孩子去看这种片子,异形吓坏8岁小孩家长投诉影城,反对
5068669996766413,OsOq3sofH,1925878362,SMGNEWS,"近日，新一部""异形""系列之《异形：夺命舰》，正式在中国内地和北美同步上映。没想到，首映当天就有家长投诉：自己带8岁的孩子看影片，放映中，小朋友感到不适，害怕。一时间，到底该不该带孩子去影院看恐怖片的话题，又一次引发社会讨论。",异形吓坏8岁小孩家长投诉影城,中立
5068669931752486,OsOpX7lTU,7568095325,·逃出破楼·,受不了就别去看又不是没提醒无语,异形吓坏8岁小孩家长投诉影城,中立
5068669673803109,OsOpxfXmt,6035148281,Lweyot,标着恐怖片了还要带8岁小孩去看，这是什么心理,异形吓坏8岁小孩家长投诉影城,"
反对"
5068669644964777,OsOpukPz3,5926034915,祈嘉聆風,如果真的觉得会吓坏小孩的话就不要去带小孩看，人家都已经提醒过了未成年观众谨慎选择观看现在去投诉人家觉得有点那个,异形吓坏8岁小孩家长投诉影城,"
反对"
5068669623992896,OsOpsgKJy,7816701985,鱼_的-记忆,小孩不识字，家长也文盲？道德底线太低也不是好事，造就无赖。,异形吓坏8岁小孩家长投诉影城,反对
5068669608793191,OsOpqATvF,1304928494,老梁不郁闷,恕我直言，太小的孩子就不应该带去看非儿童片，很多片子小孩儿自己根本看不懂，就是家长想看，结果一些小孩在电影院吵吵，一会儿问这一会儿问那的，干扰别人看电影不说，小孩自己也没什么享受的部分,异形吓坏8岁小孩家长投诉影城,中立
5068669433941731,OsOp9gxqj,6116949836,咪好臻香,人家都提醒小孩子谨慎观影了还要怎么样无理取闹,异形吓坏8岁小孩家长投诉影城,"
强烈反对"
5068669423977692,OsOp8gGMk,7802250765,凛近茶花开,知道是恐怖片还要带孩子去看了还要怪影城神如经,异形吓坏8岁小孩家长投诉影城,中立
5068669414277136,OsOp7hWG4,7557274749,ci奶香芝士炸鸡,哦哦哦噢噢噢哦哦噢噢噢哦哦,异形吓坏8岁小孩家长投诉影城,中立
5068669410085940,OsOp70mm8,5129915226,这苟b互联网饶过谁,建议家长出门栓绳，由于太多家长出门不栓绳导致多起家长咬人事件,异形吓坏8岁小孩家长投诉影城,"
强烈反对"
5068669376006721,OsOp3pcCB,7731508430,零零要早点睡哟,看海报就知道不适合8岁小孩看吧,异形吓坏8岁小孩家长投诉影城,中立
5068669275345174,OsOoTmqwu,6196028795,甜为酥心酱,家长为什么带孩子看这种电影啊？不应该选适合孩子看的吗？,异形吓坏8岁小孩家长投诉影城,反对
5068669196174184,OsOoLpUbC,1929235593,今天也要精分一下,所以家长为啥要带小孩去看这个啊？海报就表明了这是不宜儿童观看的吧，又拿没人带孩子的说法反驳那你干嘛来看呢？看了又投诉，花钱买罪受,异形吓坏8岁小孩家长投诉影城,反对
5068668994589579,OsOorjfXt,6995424655,我替别人养猫的那些年,还是那句话，当父母为什么不用考证，买东西都要看说明书养小孩你是各种不合适你是一点不看,异形吓坏8岁小孩家长投诉影城,"
强烈反对"
5068668969162934,OsOooCrHg,7483096894,-大纯纯纯-,感觉和投诉密逃明侦吓人告动画片里面角色染发的是一波家长。。,异形吓坏8岁小孩家长投诉影城,中立
5068668960770801,OsOoo3ewh,7756816145,小俊没烦恼921,看海报不知道是什么类型的吗，还带着孩子去看，有时候多在自己身上找找问题吧,异形吓坏8岁小孩家长投诉影城,中立
5068668810297370,OsOo91fmi,6830028934,奈思DAYTOY,这年头真是什么神经病都有,异形吓坏8岁小孩家长投诉影城,中立
5068668752890250,OsOo3c7SW,7807680035,听她碎碎念-,"人家又没有逼你看,你小孩吓坏了谁让你看了,你投诉影城敢啥",异形吓坏8岁小孩家长投诉影城,"
反对"
5068668708848625,OsOnYB7VL,2640312885,兜兜可可粉,你妹，吓得我赶紧今天买票去看了，生怕被你撤回删减,异形吓坏8岁小孩家长投诉影城,中立
5068668591669880,OsOnN70py,5982877421,216室的匿先生,虽然我一般从不忌讳带5岁的女儿去电影院看的影片题材，但这个系列是真得不敢带,异形吓坏8岁小孩家长投诉影城,中立
5068668570704005,OsOnL2X8V,7743718011,LOVE终将会所向披靡,额，都说了是恐怖的还带小孩来看，什么样的家长培养什么样的小孩,异形吓坏8岁小孩家长投诉影城,反对
5068668487338025,OsOnCuMXf,1834159760,fala勇敢的心,🙄，这家长😟是🈶大病！知道是惊悚片还带自己小孩去看！被吓到还投诉电影院🎦，脑回路真独特啊！,"异形吓坏8岁小孩家长投诉影城,家长投诉影院,异形",强烈反对
5068668453522172,OsOnzeMhe,2593476242,机智的丁满,分级制度搞快点吧，另外做家长能不能自己有点数？,异形吓坏8岁小孩家长投诉影城,中立
5068668445396859,OsOnymDY7,2436494020,大颗舅舅,是不是有病带小孩看这种电影，我看的时候同场的小孩一直没停过叫，可以免费看也别啥都看吧,异形吓坏8岁小孩家长投诉影城,强烈反对
5068668441199213,OsOny51Y9,5576637181,多茜炸毛了,小孩不懂事家长也瞎吗，看海报不知道什么类型的吗?别害我们成年人又没电影看,异形吓坏8岁小孩家长投诉影城,"
强烈反对"
5068668425997777,OsOnwpail,6186180181,jeansun-小欢,自己脑阔有坑带娃看这种，吓坏了还要投诉影城神金,异形吓坏8岁小孩家长投诉影城,反对
5068668379597546,OsOnrEgL8,7869123948,养了只猫叫椰子,为什么要我等!你好狠的心啊你知道你的一句话会让我整夜整夜的失眠吗？想起来还要等这么久我的心像被凿了一个洞你在乎吗?你不在乎你只在乎你自己就像你不在乎狮子头里没有狮子老婆饼里没有老婆你还能若无其事的回复我消息那些冰冷的字句像利剑一样扎在我心上,异形吓坏8岁小孩家长投诉影城,"
强烈反对"
5068668365441517,OsOnqmPAp,7316105937,给我药嗑,不懂带着小孩去看恐怖片的家长是什么心理小孩被吓到反过来投诉影城的又是什么心理,异形吓坏8岁小孩家长投诉影城,"
反对"
