id,bid,user_id,用户昵称,微博正文,话题,立场倾向
5069337326782656,Ot5MosstG,7718572491,听源颖浔雾,就这么简单的处理了?老师的命也是命啊,教师遭网课爆破猝死案2成年人被拘留,"
强烈反对"
5069337234769303,Ot5Mfk0If,6996964242,唯你历久弥坚,《成年人》《网暴》《拘留》，如果连成年人都仅仅止步拘留这样的层面的话，以后越来越多的未成年人怎么办？助长网络不良风气😅,教师遭网课爆破猝死案2成年人被拘留,"
反对"
5069336832902104,Ot5LBcaY8,7754256800,栀訢椿韵,啊啊？人不是没了吧就拘留这么一会儿？,教师遭网课爆破猝死案2成年人被拘留,"
反对"
5069283228647861,Ot4n8AhHD,7707776388,抽屉里的信-,成年人啊哥可是命啊就拘留？？,教师遭网课爆破猝死案2成年人被拘留,强烈反对
5069281920811837,Ot4l23pc9,7817581282,提笔自相思_,成年人拘留十天这几个字眼就已经十分令人发指了,教师遭网课爆破猝死案2成年人被拘留,强烈反对
5069281427719363,Ot4kewo9R,5590455659,爱爬树的路人甲,处罚好轻啊…老师的命就这么不值钱嘛,教师遭网课爆破猝死案2成年人被拘留,强烈反对
5069274620101582,Ot49g0qqq,7487484610,海棠春礼,真的好坏啊这种人，拘留时间长一点真的要长长记性，好心疼老师,教师遭网课爆破猝死案2成年人被拘留,强烈支持
5069274402260444,Ot48U9u2M,7753623777,神悻,终于有结果了虽然结果并不那么如意教师一定要保护自己，身体健康最重要！,教师遭网课爆破猝死案2成年人被拘留,"
支持"
5069273658032372,Ot47HxHAo,7894001768,草莓琦琦-,好过分啊这种人就应该抓起来呀怎么这么坏！,教师遭网课爆破猝死案2成年人被拘留,"
强烈支持"
5069273613731321,Ot47DfEGB,7733035643,TAN翊次恋爱,才拘留十天！我觉得还可以久亿点，太便宜他们了,教师遭网课爆破猝死案2成年人被拘留,强烈反对
5069262161708041,Ot3Pa7al3,7724287842,F甘洒热血写春秋,这都多久的事了现在才出结果,教师遭网课爆破猝死案2成年人被拘留,中立
5069261808075564,Ot3OAxSP2,7620986369,虞小小欣欣,为什么只拘留十几天……,教师遭网课爆破猝死案2成年人被拘留,"
反对"
5069261585777745,Ot3Oeof3r,7827514344,桃叽可颂,这个事情过去很久了吧结果就是拘留十几天,教师遭网课爆破猝死案2成年人被拘留,中立
5069261422462785,Ot3NYakGl,5389674794,岂几jk,太搞笑了，老师得命根本就不值钱。,教师遭网课爆破猝死案2成年人被拘留,强烈反对
5069248672566027,Ot3tpaLxx,7860396011,Ftre-钟淇毅生,地狱空荡荡，恶魔在人间，拘留十多天？？？这是中文吗？,教师遭网课爆破猝死案2成年人被拘留,强烈反对
5069248503744170,Ot3t8fI1Q,7014693400,小汪邮局站,服了啊，老师的命也是命啊,教师遭网课爆破猝死案2成年人被拘留,"
强烈反对"
5069417509552279,Ot7RIE4Z1,6448659421,我k对人类过敏,围脖🚾里也一群喜欢报团网暴的人，拿开盒当乐子,教师遭网课爆破猝死案2成年人被拘留,中立
5069417504836110,Ot7RIki5M,7900518936,雯雯只想睡觉yu,教师遭网课爆破猝死案2成年人被拘留,教师遭网课爆破猝死案2成年人被拘留,中立
5069416272762595,Ot7PJbAFZ,3178141741,春天的阳光2016,小心超级大骗子詹晓康‼️‼️善意提醒所有中国人：投资圈的詹晓康是个超级大骗子！他和他同伙杨宗孟等人精心设局诱骗投资人，坑了投资人巨额资金，把他身边最信任他的投资人骗得倾家荡产，负债累累！老骗子现在死不认帐！这个不知廉耻的老骗子常年假冒清华大学新能源投资中心主任、清华大学教授、研究院院长……，到处坑蒙拐骗，为了骗钱骗项目不折手段！请大家一定一定要小心这个常年混在清华圈和投资圈的超级大骗子！！！这个道德沦丧、毫无人性的老骗子骗光了我们年迈的父母一辈子的养老钱，让我们投资人痛不欲生！骗子詹晓康自称有极其强硬的后台，没人敢动他！骗子无耻的骗术将在合适的时间公开曝光，真心希望不要再出现无辜的受害者了！！！,教师遭网课爆破猝死案2成年人被拘留,中立
5069404538929465,Ot7wNBsXD,2612772195,祝小干巴鱼,未成年可以写进档案里吗？,教师遭网课爆破猝死案2成年人被拘留,中立
5069403944911131,Ot7vQkBBN,6115245970,RMB丁丁铛,骂运动员判刑，辱骂老师致其死亡就行政拘留？某国法律这么双标吗,教师遭网课爆破猝死案2成年人被拘留,"
强烈反对"
5069403568477730,Ot7vezzrA,6883521658,扣叠纸战斗设计组工资,记得以前打两只麻雀还得坐几年牢,教师遭网课爆破猝死案2成年人被拘留,中立
5069403550385173,Ot7vd1Cct,1789086625,别致大视野,近日，一起涉及女教师的网课爆破案件宣判，引发了社会的广泛关注和讨论。这起案件的背景是，在网课期间，一名女教师在进行教学时，遭到不法分子的恶意入侵和网络攻击，导致课堂秩序被严重打乱，影响了学生的学习和心理健康。法院经过审理，认定侵入网络课程的行为构成违法，判处相关涉案人员一定的刑罚，并针对受害教师给予了相应的赔偿。这一判决不仅体现了对网络暴力行为的严厉打击，也为广大的教育工作者和学生提供了一个保护伞，传递了社会对教育环境安全的重视。这一事件的判决引发了公众对于网络安全、教育环境的思考，许多人呼吁在教育领域加强网络安全的防护措施，确保教师和学生的合法权益不受侵害。同时，也引发了关于网络素养教育的讨论，大家认为，随着在线教育的普及，增强公众的网络安全意识和素养显得尤为重要。此案的宣判不仅是对个案的处理，更是对整个社会网络环境的警醒，希望通过法律的威慑，能够构建一个更加安全和谐的网络学习环境。,"教师遭网课爆破猝死案2成年人被拘留,热门视频",支持
5069393151397777,Ot7er5RCN,7864298531,Kuoleee,我的天啊自己不想学也不用这样吧扰乱课堂纪律,教师遭网课爆破猝死案2成年人被拘留,"
强烈反对"
5069393100800558,Ot7em3mge,6104170457,-烟雨故城-,蹲到了结果，但是真的太轻了……,教师遭网课爆破猝死案2成年人被拘留,"
反对"
5069392659092384,Ot7dDC9lm,1959322671,叫我太颠,不当人子，有些人天生恶,教师遭网课爆破猝死案2成年人被拘留,"
强烈反对"
5069392391962655,Ot7dd8ezJ,7098655003,琢光朝瑶,网暴成本太低了，而维权成本太高。可是这个问题很严重而且已经很普遍了，难道不改有所改变吗？,教师遭网课爆破猝死案2成年人被拘留,"
反对"
5069377084330220,Ot6Owiaug,6028504016,西柚不甜y_,终于等到后续了，这处罚还是太轻了，犯罪成本如此之低？！,教师遭网课爆破猝死案2成年人被拘留,强烈反对
5069376648642854,Ot6NOAgoS,7082115497,张炳阳先生,刃头财，财星与羊刃劫财在同一柱，是跟别人抢来的财，也是突发的横财，是有风险的财，也是比较大的财。财星坐在七杀之上，也有博命求财的信息。格局中财星特别弱，然而又有食伤，财的源头没有断绝，若是财星与食伤间隔遥远，如中间有比劫，食伤难以生财，还有比劫克财，此人是贫穷之命，多招小人。,"教师遭网课爆破猝死案2成年人被拘留,网易云 没有删库没有跑路,银行为什么出现离职潮",中立
5069376577605533,Ot6NHvUxT,6459880566,远赴一场人间月,一直记得这件事但这处罚结果也太轻了……,教师遭网课爆破猝死案2成年人被拘留,"
反对"
5069376318081648,Ot6NhxUpa,6331632228,苏蔡kun,害死一条人命就只拘留十几天，难怪网暴犯肆无忌惮,教师遭网课爆破猝死案2成年人被拘留,强烈反对
5069375740841654,Ot6Mm3wX4,2794761744,最可爱的小不点儿,很多老师都是被气出病，甚至是气死的。所以精神压力极大。,教师遭网课爆破猝死案2成年人被拘留,中立
5069366373122462,Ot6xfd6ii,2941921077,EMILY0405,一条人命，拘留十天，不知道该说什么……,教师遭网课爆破猝死案2成年人被拘留,强烈反对
5069366120416300,Ot6wQ1Kiw,7795080638,骼紋,才拘留十天啊，这个处罚有点轻啊,教师遭网课爆破猝死案2成年人被拘留,"
反对"
5069366070345800,Ot6wL1rXq,6497376960,泼辣萝莉,有的时候真的感觉到心凉，如果是老师言行不当，家长们肯定蜂拥而至。现在课堂爆破孩子们身心健康受到影响，多数家长都是大度不计较了，如果老师没死，估计还得谴责老师,教师遭网课爆破猝死案2成年人被拘留,中立
5069366018179891,Ot6wFyjXJ,6141915983,改名是为了,没救了没救了，行政拘留。。。,教师遭网课爆破猝死案2成年人被拘留,"
强烈反对"
5069351560675876,Ot69m2PPe,7556713247,老公叫我早睡,不是吧就拘留10多天啊,教师遭网课爆破猝死案2成年人被拘留,"
强烈反对"
5069351516373273,Ot69hqJYJ,5133493019,是阿苏的su,自罚三杯得了，还拘留十天,教师遭网课爆破猝死案2成年人被拘留,"
反对"
5069351420692750,Ot6982Udo,3936528530,穗穗穗要开心,随心小站超话天呢。。。。。好歹是一条人命。。。,教师遭网课爆破猝死案2成年人被拘留,中立
5069351352274470,Ot6919xH0,7758476522,鲫鱼好吃亚_,啊哈怎么才被拘留十天啊,教师遭网课爆破猝死案2成年人被拘留,"
强烈反对"
5069351302988392,Ot68WcxpS,7229150336,yiuohin-桔猫橘知,？？一条命换拘留十天？？,教师遭网课爆破猝死案2成年人被拘留,强烈反对
5069351268647588,Ot68SAhDe,5883451603,辰小皓,真的无语了！不想说啥……,教师遭网课爆破猝死案2成年人被拘留,中立
5069351151994810,Ot68H8mWm,2450531940,_十一君_,哎，前段时间在看游戏直播，在直播间最怕有人带节奏的，也最容易被带节奏，打得好被人骂，打不好也被人骂，更不要说有行为瑕疵的，要么就不开弹幕，要开弹幕都是气。有个把个认真房管还好，没有，真的就是纯考验心里素质。这个氛围带到网课真的太委屈老师了，应该设置网课入会密码，一对一实名，谁敢作恶，截图发给家长，年底考试0分。,教师遭网课爆破猝死案2成年人被拘留,"
强烈支持"
5069351131283698,Ot68F5nWO,2065763751,清菡kathy,好歹一条人命，两个成年人拘留十几天，未成年人道歉，就这？人命这么不值钱？难怪现在网络暴力愈演愈烈，这犯罪成本太低了吧。。。,教师遭网课爆破猝死案2成年人被拘留,强烈反对
5069336610341250,Ot5Lf1qM2,5687967843,Siwei思为,现在的网络，爆破，老百姓大部分不知道是怎么回事，真的是连中国话也不会说了,教师遭网课爆破猝死案2成年人被拘留,"
强烈反对"
5069336347935175,Ot5KOxiiH,6360374601,本小姐降临,行政处罚，十天？？？清汤大老爷啊？你要不要听听看你在说什么,教师遭网课爆破猝死案2成年人被拘留,强烈反对
5069335293329490,Ot5J7dY9s,6016020391,难舍深蓝,女教师遭网课爆破后猝死一案宣判，教师女儿：两名涉案成年人被拘留十多天，对结果不太满意，被折磨得太难受了有个结束是好的,"教师遭网课爆破猝死案2成年人被拘留,蛟龙军事","
反对"
5069335170908329,Ot5IV3Oit,7907037331,小馨xaox,只是拘留几天这也太轻了吧,教师遭网课爆破猝死案2成年人被拘留,"
反对"
5069280506544165,Ot4iKrsr3,7360188200,磕尽天下cp_心中自然无码,行政拘留，甚至都没留案底,教师遭网课爆破猝死案2成年人被拘留,中立
5069280439436692,Ot4iDDAUI,7887719176,小雨杏舟,我的天…成年人才拘留10天…,教师遭网课爆破猝死案2成年人被拘留,"
强烈反对"
5069280201147431,Ot4ig4OuX,5309138767,摆烂11SEVEN,10天？当老师生命受到了威胁就10天是么老师也是高危职业了那就给老师涨工资吧,教师遭网课爆破猝死案2成年人被拘留,"
强烈反对"
5069280108872230,Ot4i6Be4u,6882868937,哥哥我是三郎啊,这处罚就这么轻？成年人唉不是未成年唉？？？,教师遭网课爆破猝死案2成年人被拘留,强烈反对
5069273213174829,Ot46ZdjUV,3148827081,tooyoungtoo新普,明白了，网暴人致死不会判太重的刑罚，10天过去了出来还是条好汉未成年保护法没整明白、婚姻法搞得一团糟、现在又来个网暴致死判10天……,教师遭网课爆破猝死案2成年人被拘留,强烈反对
5069272986419515,Ot46CqW0z,7869123948,养了只猫叫椰子,只拘留十多天吗？不是我请问？这对他们来说算什么惩罚！,教师遭网课爆破猝死案2成年人被拘留,强烈反对
5069272428576832,Ot45IzZe0,6220649702,喜越杏林奋斗君,没有意义，这是纵容犯罪，培养反社会人格的渣滓,教师遭网课爆破猝死案2成年人被拘留,强烈反对
5069272398693572,Ot45FAtAU,7879265963,养只小猫叫十七-富贵少爷版,就拘留人家十天？我滴妈这是一条人命为什么惩罚这么轻？不因该判刑吗？,教师遭网课爆破猝死案2成年人被拘留,强烈反对
5069261060178440,Ot3No0Kq4,7764663526,-昭宁,等了这么久你们要是不说出来都忘了呢~~虽然人家失去了生命，家人每一天都在被痛苦折磨，但是这两个人可是被拘留了啊~,教师遭网课爆破猝死案2成年人被拘留,中立
5069261058082464,Ot3NnxUCk,7876992042,Ding_椿鑫,都成年了这判成只是拘留吗人命换拘留吗,教师遭网课爆破猝死案2成年人被拘留,强烈反对
5069260676923465,Ot3MLt36N,7936160009,茉莉蛙茶茶,能不能认真处理啊。。。。这么严重的事,教师遭网课爆破猝死案2成年人被拘留,"
反对"
5069248193365422,Ot3sDe7v0,6735166067,白糖沾锅巴1002,原来当键盘侠最严重也才判十天呢搞笑吧那是条人命这完全就是纵容网曝吧,教师遭网课爆破猝死案2成年人被拘留,强烈反对
5069248139889476,Ot3sxFuHG,7015725654,Xx圈_,就跟你说了该恢复私刑了,教师遭网课爆破猝死案2成年人被拘留,"
强烈反对"
5069248116558937,Ot3svrwhj,7658940464,灏嘢Neo,我对这事有很深的印象，就拘留？？？闹着玩儿呢,教师遭网课爆破猝死案2成年人被拘留,"
强烈反对"
5069248070156305,Ot3sr0EF3,1088094825,全知全能猫,这个时候寻衅滋事就又没用了？,教师遭网课爆破猝死案2成年人被拘留,中立
5069403346176091,Ot7uSpUGn,2176084347,D雪雪XX,老师的命就这么不重要吗？,教师遭网课爆破猝死案2成年人被拘留,"
强烈反对"
5069403161104228,Ot7uA4Dg8,5033404336,富有聪明健康美丽平安阖家幸福,两年了，就这么个结果？,教师遭网课爆破猝死案2成年人被拘留,"
反对"
5069402782828962,Ot7tYbRWq,1762656655,暖暖青禾,一条人命换来十多天拘留，犯罪成本太低了吧！！！！,教师遭网课爆破猝死案2成年人被拘留,强烈反对
5069402468258564,Ot7tsyEqE,7720502504,秋日冰雹,一条人命，就只10天？悲哀,教师遭网课爆破猝死案2成年人被拘留,"
强烈反对"
5069375407915255,Ot6LOxd7p,6369294806,仙人掌_向日葵,不是前面骂有名的运动员都能刑事拘留，这个就不涉及刑事了？普通人的人命不如名人的名誉重要吗？,教师遭网课爆破猝死案2成年人被拘留,"
强烈反对"
5069375265046995,Ot6LAlaX9,3182963022,冰冷的勇士,拘留？这犯错成本太低了点吧！,教师遭网课爆破猝死案2成年人被拘留,"
反对"
5069375042487256,Ot6Lear32,5861890416,黑猫夜袭,以后这群人再爆破就有拿得出手的业绩啦，气死过一个老师这可是金牌爆破团队这不得抢着要,教师遭网课爆破猝死案2成年人被拘留,强烈反对
5069375041962189,Ot6Le8esd,5035865651,一织布,都死多少人了，网暴还不入刑啊？嘴上说着互联网不是法外之地，这网暴死人了才行政拘留几天赔点钱私密马赛就完了，这还不是法外之地？,教师遭网课爆破猝死案2成年人被拘留,强烈支持
5069374631445176,Ot6Kz63Xi,1944105843,Elderiusiha贰囍_,我国是一个过于谨慎的国家，表现在方方面面，社会发展极速，但法律更新的太慢！,教师遭网课爆破猝死案2成年人被拘留,中立
5069365890515325,Ot6wt2a3H,5090204304,冻雪_,真让人失望，司法上的“正义可能会缺席，但不会迟到”仿佛是个笑话，只实现了前半句。真的很失望！很失望！很失望！包括最近的婚姻登记草案意见稿。祖国爸爸，你真让人失望。,教师遭网课爆破猝死案2成年人被拘留,"
强烈反对"
5069365885535328,Ot6wsndZu,2932114741,好吃懒做的洋,还说网络不是法外之地，这么低的犯罪成本，不是在鼓励网络犯罪吗,教师遭网课爆破猝死案2成年人被拘留,强烈反对
5069365747128192,Ot6wetUmQ,7318169785,余生好好的2020,不能理解，代价太小了，惩罚太轻了，这可是一条活生生的生命，以后网暴犯更会肆无忌惮了,教师遭网课爆破猝死案2成年人被拘留,强烈反对
5069365668218783,Ot6w6yu51,1778145674,玖久焱炎,这处罚感觉有点轻了……应该严惩，以儆效尤,教师遭网课爆破猝死案2成年人被拘留,"
反对"
5069365550780260,Ot6vV3gYQ,6289456072,人鱼水仙仙,老师也是会被霸凌的，说出霸凌两个字很难吗，非要用爆破,教师遭网课爆破猝死案2成年人被拘留,"
反对"
5069350983434612,Ot68qepuY,7115591067,脊柱侧弯吴老师,特别不理解为啥会有这种恶魔的存在。有人失去母亲，有人失去妻子，有人失去女儿，而罪魁祸首只是被拘留。,教师遭网课爆破猝死案2成年人被拘留,强烈反对
5069350874908389,Ot68fkATz,7811591446,西瓜聆听一哥ya,才拘留那么点时间？哪个大聪明想出来的呢？处罚那么轻有什么用？,教师遭网课爆破猝死案2成年人被拘留,强烈反对
5069350728369751,Ot680z7lZ,7740881569,-look补罐窝酒曲丝-,这个结果你自己看看公平吗,教师遭网课爆破猝死案2成年人被拘留,中立
5069350608570673,Ot67OzXCF,7183005692,可爱俊包-发疯版,我去这件事终于有后续了啊不过这么恶劣的行为怎么才拘留十几天啊,教师遭网课爆破猝死案2成年人被拘留,"
强烈反对"
5069350526518293,Ot67GrlHL,7740250359,茵沃的零食,想办法把这两位成年人也气死行吗,教师遭网课爆破猝死案2成年人被拘留,强烈反对
5069334965387344,Ot5IAmBuE,2302894673,相约美好2021,现在好多学生，在网络上满口污言秽语，对骂喷脏，特别是追星的那些，简直三观尽失。,教师遭网课爆破猝死案2成年人被拘留,"
强烈反对"
5069334190489776,Ot5Hl23pC,2378269313,氛围感咸蛋,妈呀就拘留这么一会儿…心疼老师,教师遭网课爆破猝死案2成年人被拘留,"
强烈反对"
5069333961113709,Ot5GY4FJ3,7646671976,-粥可温-,法律不应该是保护受到伤害的无辜人么弄死一条人命就10天处罚,教师遭网课爆破猝死案2成年人被拘留,强烈反对
5069333924938360,Ot5GUkIGY,5516911894,常州武进检察,女交警执勤时被撞牺牲，年仅29岁；职中老师以学谋私收超255万好处费；浙大开学机器狗帮新生拿行李；东北虎“完达山1号”再现身；男子盗窃后留纸条求别报警；男子酒驾遇查弃车逃跑撞进交警怀里；游客全网寻找的青岛救命恩人找到了。详情点击👉,"武检说法,教师遭网课爆破猝死案2成年人被拘留","
中立"
5069333892433573,Ot5GRad5b,1453874424,月隐寒霜,教师遭网课爆破猝死案，两名成年人被拘留。我觉得这个事件上，能够利用司法渠道解决问题，是这件案件最值得称道的地方。那毕竟是在网络交流层面，突然发生的事件啊，毕竟是属于网络暴力的一个类型啊。很多人在网络里都经历过被攻击、辱骂的事情，能有几个人能被司法渠道处理呢？新闻里说的这起案件，当初就是热议话题，被攻击的教师是猝死了，通过大家的支持，督促司法体系重视网络暴力问题，使得这件案子，终于有了比较合理的处理结论。那么，比较使人担忧的事情是，大多数人被人侮辱攻击的时候，还是很难通过司法渠道解决问题的。比如，有人在我贴下辱骂、攻击、讽刺，实际是得不到法律支援的，通常解决这类问题的时候，上升不了法律层面。,教师遭网课爆破猝死案2成年人被拘留,支持
5069270832907920,Ot439cctW,6631675085,鹤归凌不回,哇塞这个事情我记得都好久了怎么现在才解决才十天？,教师遭网课爆破猝死案2成年人被拘留,中立
5069270076358776,Ot41VqGcU,5350857746,纽轱辘amazing,犯罪成本还是太低了，所以那些垃圾才肆无忌惮,教师遭网课爆破猝死案2成年人被拘留,"
强烈反对"
5069269962850457,Ot41KbXx7,1956696950,黑不拉几先生丶,要是把网课换成教室，这种行为怎么罚？网课和教室难道不一样吗？,教师遭网课爆破猝死案2成年人被拘留,中立
5069269855633994,Ot41znDES,7879788972,AAA手工烘焙鸡蛋糕谢师傅,该保护的保护不了，不该保护的保护的这么好，,教师遭网课爆破猝死案2成年人被拘留,中立
5069260479793179,Ot3MrF5Ev,7755843335,一坨美女狗,wcn不是免死金牌能不能好好处理啊,教师遭网课爆破猝死案2成年人被拘留,"
支持"
5069260458558116,Ot3MpzUm8,7727233304,SeoJi_,终于蹲到后续了但是感觉惩罚的还是好轻,教师遭网课爆破猝死案2成年人被拘留,中立
5069260419760383,Ot3MlEX7x,7476814290,交易沩泩,两个成年出生和三个小出生，应该被集体送到西伯利亚改造一辈子,教师遭网课爆破猝死案2成年人被拘留,"
强烈反对"
5069260330108463,Ot3Md0sdp,6165797992,任嘉小雪儿,阳光信用超话人生总如此，经历了一暴风雨，才能迎接风雨后的彩虹。开头的风雨，会化作来年的彩虹。,教师遭网课爆破猝死案2成年人被拘留,中立
5069260202705293,Ot3M0blLL,5149975911,好运鲤-,#教师遭网课爆破猝死案2成年人被拘留啊这么判是吧,,中立
5069259934532060,Ot3Lzj0ZK,6794546908,迟里扒外,只是拘留吗……这也算处罚,教师遭网课爆破猝死案2成年人被拘留,"
反对"
5069247773934053,Ot3rXgvqt,7237068156,蒸哒不理我啦,成年人才关十天！！！？犯罪成本真低啊。。人命这么...,教师遭网课爆破猝死案2成年人被拘留,强烈反对
5069247694767452,Ot3rPk0eo,7757615167,Dear-迪憬提,就只是拘留吗，这是一条人命啊！！,教师遭网课爆破猝死案2成年人被拘留,强烈反对
5069247667765664,Ot3rMwAcE,7866255027,吐司小猫栗,？就拘留了10多天？？,教师遭网课爆破猝死案2成年人被拘留,"
强烈反对"
5069247617434863,Ot3rHvc99,7787500591,纭枫志漾ETERNAL丨芝志筱,上个网课都能爆破，老师在上网课中有人进来捣乱，进行辱骂，给老师气的够呛，然后猝死，这两人结果才被拘留10天，一条人命啊！她是老师只是在完成自己的工作，将自己的知识传授给自己的学生，她到底做错了什么？,教师遭网课爆破猝死案2成年人被拘留,强烈反对
5069402083168000,Ot7sQdi8M,6074072621,竹帛不可宣,公众对轻判结果不满，认为处罚过轻。大量网民认为仅拘留十天的处罚太轻，无法体现法律的严肃性和社会正义，也无法弥补受害者家庭的痛苦。他们呼吁增加犯罪成本，严惩网络暴力，以保护教师权益和生命尊严。担忧事件可能导致更多网络暴力和不公。网友们担心这样的处理会鼓励更多类似的网络霸凌事件，加剧社会不公，对教师造成持续伤害。他们认为法律应对网络暴力采取更强硬立场，以防止其常态化。受害者家属的感受及社会反响。受害者家属虽然悲伤，但也表示感谢支持者并相信公正。与此同时，社会舆论对判决的质疑反映出公众对公正执法的期待。呼吁加重法律制裁，体现生命价值。很多人认为目前的处罚无法体现对生命价值的尊重，要求对网络暴力行为实施更严厉的法律措施，以确保法律的公正和人道主义精神。,教师遭网课爆破猝死案2成年人被拘留,"
反对"
5069401398972836,Ot7rJBEfa,7002634066,天赐幹耀祖,未成年害人的时候得到保护，未成年被人害的时候没见因为受害者是未成年严惩的。,教师遭网课爆破猝死案2成年人被拘留,中立
5069401289918415,Ot7ryFCer,1760808002,Vector_Prime,害4刘学洲的钕拳有几个被处理了，，一个都没有，一帮还喊判轻了,教师遭网课爆破猝死案2成年人被拘留,中立
5069401141550111,Ot7rk6vfN,3346521142,Summer___墨,违法犯罪成本太低了，跟鼓励犯罪有什么区别啊？,教师遭网课爆破猝死案2成年人被拘留,"
强烈反对"
5069401042721736,Ot7rabq2Y,7602892586,另寻巴分_,为什么才拘留10天？这可是一条生命啊,教师遭网课爆破猝死案2成年人被拘留,强烈反对
5069387919265046,Ot75ZCSge,6187307967,肖肖肖兔兔呀,也不能这么偏袒网暴犯吧，老师是什么很贱的职业吗，连维护自身权益的资格都没有？,教师遭网课爆破猝死案2成年人被拘留,"
强烈反对"
