id,bid,user_id,用户昵称,微博正文,话题,立场倾向
5069245782425856,Ot3oKab4I,7713813386,祁瑾_郁葭,我还有印象，这位老师教什么的，好像是初中老师吧，她女儿在微博的发声当时我也看过，她总让我想起我的高中历史老师。我心里堵得慌，初中生的恶是难以想象的，初中生有时候就是畜中生。,教师遭网课爆破猝死案2成年人被拘留,"
强烈反对"
5069245648734012,Ot3owAE7a,7868698185,糕手潜没烦恼,这么久终于等到了后续，但是有没有搞错，才十多天,"教师遭网课爆破猝死案2成年人被拘留,几枝里",中立
5069245262857845,Ot3nUbZsh,7847248221,猪小咪0913,教师这么值得尊敬的职业，你们怎么干的出来！必须严惩好吗？！,教师遭网课爆破猝死案2成年人被拘留,"
强烈支持"
5069245136765247,Ot3nHsnWT,6299588770,Divergent_丁丁,一梦超话不是很理解为什么会是这样的结果。,教师遭网课爆破猝死案2成年人被拘留,中立
5069363306564819,Ot6sirxOb,6026833005,则初-,命运最好的解释就是:当你面对一件事情时，按照你过往的性格和逻辑会做出的行为，这个就是命。如果事情发生时，你该做出的行为不符合你自己以往的性格习惯，有了很大的偏差，这个就叫运。没有任何外力条件下习惯性做出的行为是命，而思考之后逆着性格做出的行为就是运。所以说运是改变，命是定数。所谓的逆天改命，逆的不是天，是自己的本能。,教师遭网课爆破猝死案2成年人被拘留,中立
5069363241552123,Ot6sc6vMf,1116275530,视点视频,时隔近2年，河南新郑女教师遭“网课爆破”后猝死案，有了结果。该案已于8月6日宣判，其中两名成年人被拘留了10余天。此前报道，入侵网课捣乱的行为被称之为“网课爆破”或“网课入侵”。入侵者通过强行霸屏、骚扰信息刷屏，乃至辱骂师生等方式干扰教学秩序。的微博视频,"教师遭网课爆破猝死案2成年人被拘留,热门视频,女教师遭网课爆破猝死涉案人已道歉","
中立"
5069363230543234,Ot6sb2hjQ,7788174106,苳穎悸弦,就简简单单拘留吗？教师的命就不是命了吗,教师遭网课爆破猝死案2成年人被拘留,强烈反对
5069363223466300,Ot6saexK4,2712072383,兔女郎Amily,作恶者认为只是玩笑，凭借网络肆无忌惮。他们应该没有负罪感，甚至感觉很好玩，谁知碰上个较真的。使用语言暴力致使对方猝死，才拘留十几天。要我说这个案例就是“言语如刀”生动的演绎,教师遭网课爆破猝死案2成年人被拘留,强烈反对
5069348320051329,Ot6480dlT,6029323915,为喜欢喝冰咖啡_D,生活不是战场无需一较高下生活也不是选秀何须互相攀比生活就想一杯白开水你每天都在喝不要羡慕别人的饮料其实未必有你的白水解渴人生靠的是心态心态好了处处都是眼光相信未来，相信内在和坦然美好的心境。在心里，谁都有一道最美丽的风景。往前走，在这个世界上留下属于你的厉害印记。,"教师遭网课爆破猝死案2成年人被拘留,原来出门上班不关空调才省电",中立
5069348150444536,Ot63R1RDW,7855697440,kiku诗安祎秽年,就十多天那是一条人命啊,教师遭网课爆破猝死案2成年人被拘留,中立
5069264916317948,Ot3TBqvAo,7395133645,seherrrr,啊？才只是拘留而已吗我请问呢,教师遭网课爆破猝死案2成年人被拘留,"
强烈反对"
5069257062745635,Ot3GWbwgr,5632426475,陈爱李_,一条人命换来了拘留十来天我不知道该说点什么…,教师遭网课爆破猝死案2成年人被拘留,"
强烈反对"
5069244966371741,Ot3nqqJA1,6517063253,该博主是萌妹,老师好无辜啊好好的在工作被这些学生害了，结果这处罚力度能给谁交代啊,教师遭网课爆破猝死案2成年人被拘留,"
反对"
5069244896905005,Ot3njsYj3,6012868747,独昭奇迹,教师一定要保护自己，身体健康最重要！,教师遭网课爆破猝死案2成年人被拘留,中立
5069244822195253,Ot3nc9d5j,7867043746,霜花回忆录,啊啊啊啊啊？唐人诗话：“李山甫貌美。晨起方理发，云鬟委地，肤理玉映。友某自外相访，惊不敢进。俄而山甫出，友谢曰：‘顷者误入君内。’山甫曰：‘理发者即我也。’相与一笑。”余弟子刘霞裳有仲容之姣，每游山必载与俱。赵云松调之云：“白头人共泛清波，忽觉沿堤属目多。此老不知看卫蚧，误夸看杀一东坡。”,教师遭网课爆破猝死案2成年人被拘留,中立
5069244683780134,Ot3mYfRnU,7647686800,别动让我carry,才十天不严惩根本不管用啊,教师遭网课爆破猝死案2成年人被拘留,"
强烈反对"
5069244632665800,Ot3mTbbuM,7388807103,心灵白板卍,网络法能不能有点权威呢…摆设吗…这要是任何案件扯上网络就能撇干净，这么多年扫黑除恶扫黄扫赌辛辛苦苦做了那么多年不都成无用功了吗…,"教师遭网课爆破猝死案2成年人被拘留,慢脚文化","
强烈反对"
5069244628732128,Ot3mSADCM,7652597662,ENFP冒失鬼,10天？你是不打错了一个字啊？,教师遭网课爆破猝死案2成年人被拘留,中立
5069244486126776,Ot3mEpHQY,7227089468,某位优秀网友,这位老师气性太大，太正直、太仁义了。至刚易折。愿天国长存爱与正义。,教师遭网课爆破猝死案2成年人被拘留,中立
5069362897881578,Ot6rDx4me,5021632367,乖乖澜喵,网络暴力的成本真的很低了,教师遭网课爆破猝死案2成年人被拘留,"
反对"
5069362463248425,Ot6qWdD3X,7858852691,忤婧不是祎,绝望啊，教师一条人命，才换了10天拘留，那个道歉我不用看就知道有多勉强才会说出“对不起”。今后当老师的首要任务是保护自己，不然全世界都不会保护你。,教师遭网课爆破猝死案2成年人被拘留,强烈反对
5069362299405700,Ot6qFDsQQ,5537152882,freedom-椿序記,只是被拘留吗有点太轻了吧,教师遭网课爆破猝死案2成年人被拘留,强烈反对
5069348035626727,Ot63FnBLF,7481409071,栀悦几许祺_,天呐。。。太轻了。。。,教师遭网课爆破猝死案2成年人被拘留,"
强烈反对"
5069347894855877,Ot63rkneB,5870091113,酱酱偷喝汽水,8月19日下午，小王发微博表达了自己的感受：“终于都结束了。曾经我一直想会以什么样的方式在什么时间结束，结束了才明白所有痛苦不会随着事情的结束而消失。不管结果有没有完全达到预期，都已经有个交代了。”,教师遭网课爆破猝死案2成年人被拘留,中立
5069347754084033,Ot63dh8rv,7769635594,失眠记事簿_,不敢相信老师的家人该有多心痛,教师遭网课爆破猝死案2成年人被拘留,"
反对"
5069347330460209,Ot62x1VIJ,3642472303,爆炒蔷薇年糕,害死一条命结果过了这么久才拘留十天网暴成本太低了,教师遭网课爆破猝死案2成年人被拘留,强烈反对
5069347317876120,Ot62vx2Wc,7769635594,失眠记事簿_,未成年人真的越来越猖狂了希望能过推出新的法律政策管束未成年人,教师遭网课爆破猝死案2成年人被拘留,"
支持"
5069256967848505,Ot3GMwVKN,6730080412,冰淇淋蛋挞还有很多肉,这个处罚也太轻了吧，那他们根本不怕呀,教师遭网课爆破猝死案2成年人被拘留,"
强烈反对"
5069256930887870,Ot3GJ3IYu,6974851950,矿泉水我只喝怡宝_,拘留十天真搞笑一条人命就值十天未成年真是无敌,教师遭网课爆破猝死案2成年人被拘留,强烈反对
5069256890778201,Ot3GF3grD,5456809409,-阿笙笙笙笙-,这说明什么，犯罪要趁早是吗害死了人，什么责任都不用付，那干脆来个未成年雇佣兵得了,教师遭网课爆破猝死案2成年人被拘留,强烈反对
5069256880292255,Ot3GE1e1N,7361283436,奇怪小凑,十天？疯了吧。。。。这才十天。。。,教师遭网课爆破猝死案2成年人被拘留,"
强烈反对"
5069256855651515,Ot3GBnIdt,3872942156,自由的赤子之心,太便宜这几个小chu生了，人命就是这么不值当的，唉,教师遭网课爆破猝死案2成年人被拘留,强烈反对
5069256714881839,Ot3GnktZl,6201130364,正常的名字a,鼓励犯罪？？？想想还有哪些违法乱纪行为惩罚轻呢,教师遭网课爆破猝死案2成年人被拘留,强烈反对
5069244465677673,Ot3mCnP1n,7269358727,爱为人士hy,现在的喷子着实可很！殊不知就因为你们不恰当的言lun造成多少类似这样的事情，不知反省嘛,教师遭网课爆破猝死案2成年人被拘留,"
强烈反对"
5069244442348075,Ot3mA9QQb,6784273385,一渡情感,简直大开眼界了，十天？出来更得瑟了，这种人放出来……唉,教师遭网课爆破猝死案2成年人被拘留,强烈反对
5069244373664980,Ot3mtfnqA,7865777872,困桃本桃_黎非版,就10天……？惩罚太轻了吧,教师遭网课爆破猝死案2成年人被拘留,"
反对"
5069244333036585,Ot3mpcJXb,7725383427,Beloved-戀祎予晞,就10天搞笑呢好消息:后续蹲到了坏消息:离谱离大谱,教师遭网课爆破猝死案2成年人被拘留,"
强烈反对"
5069244289515810,Ot3mkDVuO,5640928707,红毛小哪吒,我对你老中法律是真的不理解了。,教师遭网课爆破猝死案2成年人被拘留,中立
5069244281129779,Ot3mk4JUf,7909576379,诅咒冠冕,就十天？放出来危害社会啊,教师遭网课爆破猝死案2成年人被拘留,强烈反对
5069362283153613,Ot6qEdeoJ,3263299272,简并度,这种处罚只会放纵那些未满十八岁的人，且心中潜藏恶意的人，他们不会后悔，也不会觉得受道德谴责有什么事，只会当成荣耀。,教师遭网课爆破猝死案2成年人被拘留,"
反对"
5069361901738524,Ot6q27igI,5575500166,弗洛莉安,有时候感觉磁场特别低迷，并不用太上心，在当下有太多的负面悲观想法，自暴自弃或者自我否定，而是打打游戏，或者放松一下去平缓度过就好。人生需要高低起伏，每逢六天地支是合，第七天就是冲，所以说好坏交替是人生常态。很多时候感觉真的过不去了，其实只是源自于今天流日不太好，磁场一换，人就想通了，有精气神有憧憬有希望了。尤其是八字金水旺偏阴的，再逢阴流年流月大运，就容易想不开没有活力，唯一阳的字逢了穿冲破，就会有很强烈的自我了结倾向，像原局有一些穿破的，例如子未，丑午，这两个穿这种倾向最强烈。确实不要太苛责自己，找个人说说话，打发时间，坏的流日，流月过去了，一样对生活是充满希望的。,教师遭网课爆破猝死案2成年人被拘留,中立
5069347005664556,Ot620nLBO,6527876076,我是0号,网络不是法外之地，共同营造清朗的网络空间。,教师遭网课爆破猝死案2成年人被拘留,"
支持"
5069346992818005,Ot61ZbP5H,6868164768,stonejiaa,拘留十几天加道歉？“如果道歉有用，还要警察干嘛！”警察来了也是道歉。“气死人不偿命”老祖宗说的对啊,教师遭网课爆破猝死案2成年人被拘留,强烈反对
5069346982593764,Ot61YaSKU,7769635594,失眠记事簿_,就这么轻的处罚啊？这样犯罪的成本不越来越低了吗？,教师遭网课爆破猝死案2成年人被拘留,强烈反对
5069346949562956,Ot61UE7Le,7848150454,小兔酥-,啊？我没看错吧才拘留10天,教师遭网课爆破猝死案2成年人被拘留,"
强烈反对"
5069346493694257,Ot61bfv2N,7769635594,失眠记事簿_,人们对教师的社会地位和工作环境表示担忧，认为教师在面对学生不当行为时往往处于弱势，且缺乏有效保护。有网友强调教师的生命价值，以及对教师职业面临困境的关注；有人提出教师在处理学生问题时常处不利位置，缺乏足够的管理工具，这导致了悲剧的发生。,教师遭网课爆破猝死案2成年人被拘留,"
反对"
5069346374680663,Ot60ZjDEz,7775139598,-何時恋小宁-,我的天，就这么轻的处罚啊,教师遭网课爆破猝死案2成年人被拘留,"
强烈反对"
5069256662977712,Ot3GicuDC,5767332560,今天没药,天呐。。。我打这段话的时候手都在颤抖，简直是细思极恐，粗思也极恐啊。。,教师遭网课爆破猝死案2成年人被拘留,"
强烈反对"
5069256618148998,Ot3GdybVs,1653984382,北风向南,别忘了还有山东杀害同学的三个小畜生………未成年不能当作免死金牌,教师遭网课爆破猝死案2成年人被拘留,"
强烈支持"
5069256439367685,Ot3FVDiXH,7925675829,Even-初初,人家人等了2年就判十几天,教师遭网课爆破猝死案2成年人被拘留,"
强烈反对"
5069256196620716,Ot3FxrMlK,6806575781,琮答不是小狗头,一个认真教书育人的老师，却被所谓的“恶作剧”导致其猝死，真是恶魔行为，判决也太轻了，真的很恶劣，一个这样老师可以教出多少好学生啊，就被这种人毁了,教师遭网课爆破猝死案2成年人被拘留,强烈反对
5069244167097838,Ot3m8tMtg,5681498413,辞晚SHHHHH,？？才十天？他们毁掉的可是一条人命、一个家庭啊！道道歉、赔赔钱、部分处生拘留十天就完事了？？这件事发生的时候我们也在上网课，所以对这个新闻印象非常深刻，没想到过了这么久再次看到后续，居然这么轻的处罚，哇，真的心凉了，本来就不想当老师现在更不想了,教师遭网课爆破猝死案2成年人被拘留,强烈反对
5069244152940570,Ot3m7ckYy,6540560659,当诺zz,？？？仅仅拘留10天？？？太不合理了吧,教师遭网课爆破猝死案2成年人被拘留,强烈反对
5069244108901497,Ot3m2BlGx,7628459686,听听物理,你喜欢的，并不是轻易可以得到的，这就是你应该努力的理由当实力撑不起野心时，请你努力,教师遭网课爆破猝死案2成年人被拘留,中立
5069244064859914,Ot3lYkohI,5463448993,尘埃中的陌人,不明白。现实生活里两个人吵架让对方一下气死了都会被判刑，这个为啥不是同理？而且入侵网课爆破，是不是该比照信息入侵；非课业学生的社会人士入侵捣乱上课，是不是该比照扰乱治安次序，寻衅滋事；辱骂师生是不是该比照侮辱他人人格什么的；因为该起事件直接导致受害人的死亡～～～这些，哪一点都不该只拘留10多天吧。匪夷所思,教师遭网课爆破猝死案2成年人被拘留,强烈反对
5069244067217693,Ot3lYuhEp,7887228291,暗点老二,加强网络空间法治建设，严厉打击网络违法犯罪行为！！,教师遭网课爆破猝死案2成年人被拘留,强烈支持
5069243806909973,Ot3lysZBb,7247941634,不愿再抠jio-兔耳朵比耶版,成年人被拘留10天？别太好笑了吧网暴成本这么低？谁还愿意当老师啊呵呵😅,教师遭网课爆破猝死案2成年人被拘留,强烈反对
5069361822303797,Ot6pU9Fk1,7842022792,7842022792_515,道歉有个屁用做做样子谁不会,教师遭网课爆破猝死案2成年人被拘留,强烈反对
5069361691757601,Ot6pH7nep,5646913221,如果能改7096次名字,未成年人也就算了，成年人也只拘留了10天，老师的命就这么贱吗？,教师遭网课爆破猝死案2成年人被拘留,强烈反对
5069361427513789,Ot6pgvwG9,7794957531,小楊要记得早睡,！？！？！？别太离谱，“天”还是“年”,教师遭网课爆破猝死案2成年人被拘留,"
强烈反对"
5069346254882642,Ot60Nkuci,6917959799,最美三河,河南新郑市女教师刘韩博遭“网课爆破”后猝死一案宣判，其中两名涉案成年人被拘留了十多天。,教师遭网课爆破猝死案2成年人被拘留,中立
5069346227880183,Ot60Kx3ZJ,7762965210,秋叶同星落,？？？？不是……绝了好吧,教师遭网课爆破猝死案2成年人被拘留,中立
5069346021835799,Ot60q7HzF,7711062685,时锦悦-挽星,只拘留十天，老师的命就不是命了吗,教师遭网课爆破猝死案2成年人被拘留,强烈反对
5069345657717382,Ot5ZPwnDU,1592863911,今天开始吃瓜,终有一天，教师会像儿科医生一样稀缺……,教师遭网课爆破猝死案2成年人被拘留,中立
5069255996080220,Ot3FdpvK4,6595528979,哇咔咔呜哇呜哇哇,惩罚太低了，现在的犯罪成本真的低,教师遭网课爆破猝死案2成年人被拘留,"
反对"
5069255886767967,Ot3F2soEL,6792419657,道一rainbow,社会的渣子，真该下地狱的,教师遭网课爆破猝死案2成年人被拘留,"
强烈反对"
5069255730530783,Ot3EN2e51,6619578462,椰椰奇奇冰,申金啊才10天。？？？,教师遭网课爆破猝死案2成年人被拘留,"
反对"
5069255693304293,Ot3EJdRB3,6592970951,柟崽崽,才10天吗？老天爷，这个处罚力度是不是太轻了,教师遭网课爆破猝死案2成年人被拘留,"
强烈反对"
5069243081821965,Ot3ko7DYx,7872862747,茶籽Liberty,成年人未成年人害死一条无辜的生命就是进去十天和轻飘飘的道歉，看到了吗？所有善良的人，你的善良要有锋芒，你的底色要无比坚韧，渣滓都这么容易活，你们比它们更有资格。,教师遭网课爆破猝死案2成年人被拘留,强烈反对
5069243039351298,Ot3kjDeHo,2608809495,安琪87babe,我去！啊啊啊啊啊啊！都能想象它们出来怎么炫耀这件事了,教师遭网课爆破猝死案2成年人被拘留,"
强烈反对"
5069242810764869,Ot3jX3cYB,7787906639,初什么夏-yi,虽然但是这个惩罚太轻了吧……那是人命啊,教师遭网课爆破猝死案2成年人被拘留,"
强烈反对"
5069242793726159,Ot3jVfDll,7371956743,htti_,三年维权换来拘留十天行政处罚，犯罪成本低没人当老师，正好也没人生孩子，福报啊,教师遭网课爆破猝死案2成年人被拘留,强烈反对
5069360928918455,Ot6osBq63,3216605701,柚子露的小可爱,咱就是说，打架斗殴还拘留5-10天呢……结果……不说直接，这咋的也算间接致死了吧？结果才拘留10天？？？？,教师遭网课爆破猝死案2成年人被拘留,强烈反对
5069360841101233,Ot6ok4CtP,1412859940,强信持,没有刑事处罚我也觉得不太够,教师遭网课爆破猝死案2成年人被拘留,"
反对"
5069345537656508,Ot5ZDw7O4,6612161751,圈内橙子,老师死了，才10天我真的服了服了服了,教师遭网课爆破猝死案2成年人被拘留,"
强烈反对"
5069345474740759,Ot5ZxjThR,6573299964,狐梨兔兔喵,都成年人了还只是拘留？？这判的你觉得合理吗？咋的因为是在网上就可以这么随意了吗怪不得现在喷子那么多呢,"教师遭网课爆破猝死案2成年人被拘留,狐梨兔兔喵","
强烈反对"
5069345161740427,Ot5Z27iLp,2897503914,珍惜当今,这些网暴者对于女老师来说，不仅仅是扰乱了正常的教学秩序，其中言语的表达更是对于女老师本人的侮辱和诽谤，所以，他们的行为不仅是简单的无知行为，而是非常严重的犯罪行为，但是目前仅仅是对两个成年人进行了行政处罚，也只能一声叹息，我们的法律有时候真的太仁慈了。现实中，一旦网暴成为一种形式一种手段，那对网络的安全秩序的稳定、网民的人身健康都是一种无形的巨大摧毁。网络中就有那么一部分人，敲着键盘，凭自我主观意识肆无顾虑的诋毁他人，以为自己就是化身正义的使者，用道德伦理的名义去谴责诋毁侮辱在网络中的另一方。其实他们不知道，在侮辱他人的情况下，自身的行为才是是个网络世界叫人最可耻的。网络非法外之地，言论自由也是存在合法合规正当正义的基础之上，谨言慎行，尊重别人也是尊重自己。,"教师遭网课爆破猝死案2成年人被拘留,律师说法,微博新知博主","
强烈反对"
5069344977979074,Ot5YJxtIK,6515958011,契如燕,很久没有做梦了，昨晚竟然做梦梦到了我的爸爸妈妈，从梦里醒过来时，是凌晨3：45，我看了手机上的时间。之后辗转反侧，再难以入眠。6：30分，闹钟响起后，我拨通了我爸的电话，告诉爸爸说，我梦到你和妈妈了，很想你们，爸爸不好意思的嘿嘿笑了起来，照例又拉了一会家常。那就起床吧，一切都好，就挺好。情感超话支持打击一切网暴,教师遭网课爆破猝死案2成年人被拘留,"
支持"
5069255655557153,Ot3EFnjFv,6031114609,艾琳娜女王,教师职业如今也是高危职业了真是防不胜防永远不要随意揣测人心半大的孩子也有坏心思,教师遭网课爆破猝死案2成年人被拘留,中立
5069255652148372,Ot3EF90Ta,6899439051,无语大坝,搞了半天拖这么久就拘留,教师遭网课爆破猝死案2成年人被拘留,"
反对"
5069255634059836,Ot3EDh29e,7727203177,我也爱吃桃-,就这？为什么惩罚这么轻。。。。。。,教师遭网课爆破猝死案2成年人被拘留,强烈反对
5069255596311367,Ot3EzqtSf,6233227979,会的6233227979,这个处罚不仅是对教师的不公，更是对未成成年的无底线纵容，法将不法,教师遭网课爆破猝死案2成年人被拘留,"
强烈反对"
5069255536283034,Ot3Etqmvg,7479311534,白雾夜逃,有病有病有病有病有病有病有病有病为什么才10天,教师遭网课爆破猝死案2成年人被拘留,"
强烈反对"
5069255420413661,Ot3Ei1JBX,7524919713,乌托邦秀场_,什么鬼结果才十天那可是一条人命诶语言攻击真的很可怕，再强大的人也受不了，会焦虑会心慌会猝4️⃣怎么能放过他们,教师遭网课爆破猝死案2成年人被拘留,强烈反对
5069242708528715,Ot3jMzMHV,7487629288,领航者-富贵,这处罚有点太轻了吧……？,教师遭网课爆破猝死案2成年人被拘留,"
反对"
5069242697519470,Ot3jLvy9M,7147510223,渝喃雾刷,隔这么久才出来这样的惩罚合理嘛必须严惩啊这关忧人命,教师遭网课爆破猝死案2成年人被拘留,强烈支持
5069242540228989,Ot3jw0Xzn,7447935419,__你要开心,成年人？？？十天？？？照这个法以后谁还有这个ming当教师,教师遭网课爆破猝死案2成年人被拘留,强烈反对
5069242510608032,Ot3jt2yaY,3002653010,-小时岚-,罚的太轻了，各种网络暴力越演越烈，还是得入刑啊,教师遭网课爆破猝死案2成年人被拘留,强烈支持
5069242409943687,Ot3jiFIO3,7855066853,爱吃蛋包饭_ovo,失望。。。为什么。。明明网络舆论这么严重了,教师遭网课爆破猝死案2成年人被拘留,"
强烈反对"
5069242396840948,Ot3jhsHDS,1890880097,灿烂指南,犯罪成本低到不忍直视交通事故里还有个无接触交通事故呢呸,教师遭网课爆破猝死案2成年人被拘留,"
强烈反对"
5069242254231400,Ot3j3hKMo,6035747103,MissyaaX,你要不猜一下它们出来之后会怎样炫耀？,教师遭网课爆破猝死案2成年人被拘留,中立
5069360544877282,Ot6nQksNQ,6573637263,摩天轮下听树读_,就十天？？？那可是人命啊，道歉有p用啊？什么时候能一命偿一命？,教师遭网课爆破猝死案2成年人被拘留,强烈反对
5069360416162587,Ot6nDpRaz,3862590694,拥海扑火,一条人命就抵一个道歉?那以后是不是就只要道歉就可以为所欲为了,教师遭网课爆破猝死案2成年人被拘留,强烈反对
5069360039985859,Ot6n1FTMf,2872520481,Mnygfrhl,拘留十天，换一条人命？？？,教师遭网课爆破猝死案2成年人被拘留,强烈反对
5069344482787413,Ot5XWbH8h,1667942985,长三角之声,时隔近两年，河南新郑市女教师刘韩博遭“网课爆破”后猝死一案终于有了结果。8月19日，刘韩博女儿透露，案件已于8月6日宣判，“该赔钱的、该道歉的、该进行行政处罚的，都做了。其中，两名涉案成年人被拘留了十多天。”2022年10月底，刘韩博遭“网课爆破”后猝死，一度引发热议。根据其家属提供的直播录屏记录，当天的网课中，有不明身份者闯入网课会议室，通过播放音乐、语音辱骂、共享屏幕干扰课件投屏等多种方式扰乱课堂秩序。,教师遭网课爆破猝死案2成年人被拘留,支持
5069344402572808,Ot5XOaNiU,7801887821,依慕沁耶,上个网课都能爆破，老师在上网课中有人进来捣乱，进行辱骂，一条生命就拘留10天？？？？,教师遭网课爆破猝死案2成年人被拘留,强烈反对
5069344205177600,Ot5XulIVG,6019787783,侠女山的小星球,以前讲到尊师重道，我们老师举例用的是日本的……,教师遭网课爆破猝死案2成年人被拘留,中立
5069344191022581,Ot5Xt4i1f,5439263434,等待沥川的小喵团子,怎么是这个结果不敢相信,教师遭网课爆破猝死案2成年人被拘留,中立
5069344134661122,Ot5Xnjyzo,5604442048,千玺弟弟家的小姐姐,这么轻的处罚，真是无语,教师遭网课爆破猝死案2成年人被拘留,强烈反对
5069255309526401,Ot3E6DYfD,7773374507,伊依_事业版,蹲了好久的后续居然处罚才十天？那是不是以后看谁不爽都可以用这种方式了。。反正处罚也不重，搞笑呢,教师遭网课爆破猝死案2成年人被拘留,强烈反对
5069255299041434,Ot3E5BW5A,5657442244,飞天大野猪1212,太气了，新郑你真是坨狗屎，新郑三中你也是，一坨狗屎,教师遭网课爆破猝死案2成年人被拘留,"
强烈反对"
5069255028769794,Ot3DEANqi,5266189967,不吃鱼的Dendu,上课随便教教得了，不至于太尽心把命搭进去,教师遭网课爆破猝死案2成年人被拘留,中立
5069254960087765,Ot3Dy0mPz,7477956242,GGBond不要小看大肚腩,看到这种新闻，总是可悲又可恨，心疼受害者，唉…天道轮回有的吧…,教师遭网课爆破猝死案2成年人被拘留,中立
