id,bid,user_id,用户昵称,微博正文,话题,立场倾向
5069387348840418,Ot754B5No,7420440007,Pretty_淇珍毅宝,现在未成年人做坏事成本太低了，助长不正之风！当老师还是保护好自己吧。,教师遭网课爆破猝死案2成年人被拘留,"
反对"
5069386953787487,Ot74rfTiv,7036133886,宁是大帅哥,成年人居然才被罚了十几天，都成年人了，能干的出来这种事未免也太轻了，道歉有什么用，人都没了,教师遭网课爆破猝死案2成年人被拘留,强烈反对
5069386868065334,Ot74ixQa2,6100400662,栉和有点甜,毕竟也不是直接致人死亡，算是扰乱秩序吧，判的也只能这样了，还行吧,教师遭网课爆破猝死案2成年人被拘留,中立
5069374169286262,Ot6JOCXMq,7845639082,J_Z不器-_soistoi-meme,这不是告知那些网暴他人的人，没关系，网暴他人至4️⃣也只是拘留十天吗？……这种处罚力度有何震慑力怎么一个胖猫就有无数人开盒无辜女性，拿了一杯奶茶就要在RS上被挂好几天，这种至4️⃣害了一条人命的男宝就这样完美隐身哈哈哈,教师遭网课爆破猝死案2成年人被拘留,强烈反对
5069373847636388,Ot6Jiw2zy,7679082524,blilywu鹿,不是吧……未成年人就这么放过了？未成年人这几个字是免死金牌啊,教师遭网课爆破猝死案2成年人被拘留,"
强烈反对"
5069372911782526,Ot6HN7tIq,3139317661,小何的碎碎念宇宙,如果一个国家不保护老师的权益，甚至是生命，那这个国家的未来可想而知！,教师遭网课爆破猝死案2成年人被拘留,"
强烈反对"
5069365440938068,Ot6vK3W28,7544785045,-菠萝拌饭o,就只拘留10多天？？！这算什么惩罚。。教师的命不是命吗...,教师遭网课爆破猝死案2成年人被拘留,强烈反对
5069365067907408,Ot6v8xb4Q,5836334711,米拉噢24,处罚太轻！感觉依据的法条是不是不太合适！？,教师遭网课爆破猝死案2成年人被拘留,"
强烈反对"
5069364947060718,Ot6uWtCOy,6449049891,鹤呀呵呵,网课期间经历过网课爆破，真的，深恶痛绝，他们毫无三观底线，不尊重教师和学生，现在想起来还是能破口大骂,教师遭网课爆破猝死案2成年人被拘留,"
强烈反对"
5069364908265523,Ot6uSyGeT,6736018426,酷炫狂拽菠萝蜜,现在这个社会，对教师真的越来越没有以前的尊师重道了,教师遭网课爆破猝死案2成年人被拘留,"
反对"
5069350424020893,Ot67wgS17,1962844372,GDONCJ,@GDONCJ：好好的一个老师，就这样活活被气死了，现实生活中这样捣乱课堂，辱骂老师，甚至打老师的情况也并不罕见。十天拘留，说实话个人觉得处罚太轻！,教师遭网课爆破猝死案2成年人被拘留,强烈支持
5069350308676911,Ot67kApgb,7275337739,天道茜丶,就这？？？？？十天？？？☝🏻命？？？？,教师遭网课爆破猝死案2成年人被拘留,"
强烈反对"
5069333061435911,Ot5Fw61xR,7709032840,蛋炒饭第一粉头,就拘留十天啊期待刑法早日完善的一天哈,教师遭网课爆破猝死案2成年人被拘留,"
反对"
5069332017054809,Ot5DPtBhf,7610004440,这是一个有你们的星球,无语，一条人命啊！就这？？？,教师遭网课爆破猝死案2成年人被拘留,强烈反对
5069269643560129,Ot41eeW9r,5763034018,龙卷风的卡罗拉,未成年还真是免死金牌，御赐黄马褂？？？？,教师遭网课爆破猝死案2成年人被拘留,"
强烈反对"
5069269362280493,Ot40M9zg9,7765460068,消失的红色枯茶,只把一件事做好，就是生活本初的节奏，再忙再累的日子都会云淡风轻，再苦再咸的生活都不值一提。这种无法放弃的力量就来自于内心。,教师遭网课爆破猝死案2成年人被拘留,中立
5069259816568997,Ot3LnryTz,6221710304,又把花盆打翻了,才？竟然？真是没良心啊,教师遭网课爆破猝死案2成年人被拘留,"
强烈反对"
5069259661903972,Ot3L87Zje,5472231574,葛玲伊,《他们就是问问》成年人，拘个留，十天半月就到头；未成年，摸摸头，父母帮忙洗个手。,教师遭网课爆破猝死案2成年人被拘留,"
反对"
5069259379573964,Ot3KFEaCM,7860262210,ID困--祎,只有拘留？不是对的起逝者和逝者的家人吗这就是法律？,教师遭网课爆破猝死案2成年人被拘留,"
强烈反对"
5069259182442620,Ot3Kmafr6,6299549189,慕珩澈,好好好，未成年当雇佣兵指日可待,教师遭网课爆破猝死案2成年人被拘留,中立
5069258905880746,Ot3JUoFQK,7565210416,小淇星星,这惩罚太轻了吧这可是一条人命啊,教师遭网课爆破猝死案2成年人被拘留,强烈反对
5069247451759704,Ot3rr7nMk,1285467053,闲看路上风景,一条人命，一名教师的生命，最严重的处罚不过是其中两名涉案成年人被拘留了十多天......法律，原来真的不是保护受害者的，法律就是和稀泥呀！,教师遭网课爆破猝死案2成年人被拘留,强烈反对
5069247186994823,Ot3r0tlFJ,5308184306,木子李永恒之塔,还老师公道，该判刑判刑,教师遭网课爆破猝死案2成年人被拘留,强烈支持
5069247154226061,Ot3qXhJoh,7476947035,甘蔗旁的小狗,不管你现在多迷茫，过得多累，走得多艰辛，请相信，生命中总有一段路是要你自己走完的，总有一段时间是“寒冷”的，不要放弃希望，不要放弃自己，再怎么冰冷也有阳光，再怎么艰辛都得努力。生命中，总得有一段回忆起来足够感动自己的时光。,教师遭网课爆破猝死案2成年人被拘留,中立
5069386631872657,Ot73V7Ra9,7315365058,sove-love,才拘留10天？没有别的惩罚？现在做坏事儿的成本这么低么？,教师遭网课爆破猝死案2成年人被拘留,强烈反对
5069386103131216,Ot734d8zu,2475066070,桃木sai的心,这种行为的受到的处罚远不及它的杀伤力，就是在鼓励犯罪,教师遭网课爆破猝死案2成年人被拘留,强烈反对
5069385881092263,Ot72I4A99,6320720817,三秋XI愉,2年了，就这个结果，10天拘留，你是来搞笑的吧,教师遭网课爆破猝死案2成年人被拘留,强烈反对
5069372456698269,Ot6H3s6wB,2173988713,前世的贝瑟芬尼,广大学弟学妹们看看，这就是当老师的社会地位，还没入坑的快转行吧,教师遭网课爆破猝死案2成年人被拘留,中立
5069372238336162,Ot6GHyYCe,6531902871,白菜韭菜花,老师也是会被霸凌的！很多人肯定不相信，班级里面骂老师打老师的大有人在！全体欺负老师的现象非常多！只不过没人关注罢了！！！,教师遭网课爆破猝死案2成年人被拘留,"
强烈反对"
5069372164937036,Ot6GAkIlC,2259510157,神曲寻梵歌,所以最终结果就是成年人拘留10天。。。未成年人就屁事没有。。。,教师遭网课爆破猝死案2成年人被拘留,"
强烈反对"
5069372162835885,Ot6GAbTK5,6128101141,努力努力更努力呀xzy,才拘留10多天，老师的命就不是命了吗,教师遭网课爆破猝死案2成年人被拘留,强烈反对
5069371867136142,Ot6G6tWr4,2301835877,弯道超车呀,一条人命，而最严重的处罚只是拘留10天、道个歉就完事了，这样的处罚未免太轻了吧？如果道歉能解决问题，那还要法律、监狱做什么!,"教师遭网课爆破猝死案2成年人被拘留,女教师遭网课爆破猝死涉案人已道歉",强烈反对
5069371609190534,Ot6FGCySq,1202725934,璞玉无痕,终于体现古人说的气死人不偿命。,教师遭网课爆破猝死案2成年人被拘留,中立
5069364766179340,Ot6uEpVwM,6076615525,甜妹小祎日记_,一路走好愿天堂没有痛苦,教师遭网课爆破猝死案2成年人被拘留,中立
5069364661063546,Ot6uu4sFY,6194851069,OPHION海,跪着的教师教不出站着的学生，如果教师的地位一直是那么低的话，中国尊师重道的文化会永远消失，中国的教育会一直失去它的脊梁骨。,教师遭网课爆破猝死案2成年人被拘留,中立
5069364459733854,Ot6u9EQdE,7845071338,祝我们大家都平安顺遂,无语了，教师不是人吗？教师的命不是命吗？,教师遭网课爆破猝死案2成年人被拘留,"
强烈反对"
5069364350946672,Ot6tZ3YgU,5463712704,风雨外yxlfuji,现在的法律真是越来越不懂，不理解,教师遭网课爆破猝死案2成年人被拘留,中立
5069349877188282,Ot66Dua02,6034550348,Calm-Investor,早☀，8月20日，美股三大指数集体收涨，道指涨0.58%，纳指涨1.39%，标普500指数涨0.97%，其中，标普500指数、纳指均录得日线8连涨，A股啥时候也学不会这个涨法。,"基金,教师遭网课爆破猝死案2成年人被拘留",中立
5069349735892897,Ot66poJ0J,5898455276,沐薿-连见两次Aimer版,才十天，未成年也就只需要道个歉，难怪现在越来越多人搞网暴，成本这么低,教师遭网课爆破猝死案2成年人被拘留,强烈反对
5069349566022249,Ot668pgF3,1862151124,新闻是历史,？你支持网络暴力严厉处罚吗,"教师遭网课爆破猝死案2成年人被拘留,你支持网络暴力 严厉处罚吗","
中立"
5069330318623140,Ot5B5AbgU,1750197355,四月好甜,河南新郑那位女教师刘韩博，就因为“网课爆破”这种下三滥的恶作剧，硬生生给气没了，这事儿，两年多了，终于算是有了个说法，但说实在的，这心里头还是堵得慌。网络暴力，必须严惩不贷！希望这样的悲剧能少一些，再少一些。刘老师一路走好，愿天堂没有这样的恶行,教师遭网课爆破猝死案2成年人被拘留,强烈支持
5069330113626970,Ot5ALfdxw,7808193705,春晓江南绿,河南新郑市女教师刘韩博遭“网课爆破”后猝死一案宣判，其中两名涉案成年人被拘留了十多天。刘韩博的女儿小王和家人也终于等来了道歉，“前不久，两名涉案成年人带上三个未成年人到妈妈坟前道歉了。”小王9月将在杭州读研，她表示，会努力完成学业，会把所有的情绪转化为力量，在以后的人生中时刻告诉自己“妈妈希望我们活得更好。”你了解“网课爆破”或“网课入侵”吗？来自的分享,"遭网课爆破猝死教师的女儿将在杭读研,教师遭网课爆破猝死案2成年人被拘留,女教师遭网课爆破猝死涉案人已道歉",中立
5069329606116210,Ot5zWpF6y,3931224384,事业咨询陶峰老师,早安，点赞领取好心情和好芸气。今天是2024年8月20日甲辰年，壬申月，丙辰日，辛卯时。火长生于春天，旺于夏天，衰于秋天，绝于冬天。所以，此四柱的五行喜忌是：日元身弱，喜木火，平水，忌土金！最喜火五音对应着五行，对应着五脏，也对应五芸。所以，五音不仅可以疗疾，还可以提芸。在两千年前，中医的经典著作《黄帝内经》就提出了“五音疗疾”的观点。中医认为，五音，即角、徵、宫、商、羽，对应五行，并与人的五脏和五种情志（怒、喜、思、悲、恐！相对应！火音入心：为二胡、琵琶、马头琴、小提琴、扬琴等弦类乐器。旋律热烈、欢快、活泼，如火焰跃动，热力四散，有拨动人的心弦的感觉。徵乐五行属火，通心，五志为喜。心主血脉，多听徴乐，有疏导血脉，平稳血压，调理神志，让人喜悦的作用，对心和小肠有极佳的理疗养生功能，也可以提升火运。余天易《何以歌》K何以歌@QQ音乐,教师遭网课爆破猝死案2成年人被拘留,中立
5069329267950555,Ot5zoxmiL,3241361350,快乐的60后小胖子,网络不是法外之地，违法一样要严惩。,教师遭网课爆破猝死案2成年人被拘留,"
支持"
5069267852592737,Ot3YlaSul,7808329880,齐齐努力扎揪揪,多久之前的事了我都以为没后续了就拘留十几天啊我去,教师遭网课爆破猝死案2成年人被拘留,中立
5069258620403886,Ot3Js1H4i,2168235637,Re_大铁锤,才拘留10天？犯罪成本太低了吧，这样不会让类似的情况更多么？,教师遭网课爆破猝死案2成年人被拘留,强烈反对
5069258444507739,Ot3JaiUFt,6121506343,穿一串小心心烤了吃,难怪老师的女儿不说结果，这个结果真的好难接受。希望法律可以尽快完善关于网络暴力的条例，今时今日，网络暴力仍然犹如是法外之地。,教师遭网课爆破猝死案2成年人被拘留,"
反对"
5069246654843129,Ot3q9kjUZ,7870409088,一鹿有我OK,怪不得网暴愈演愈烈，原来是惩治太轻了，根本起不到震慑的作用，必须严惩不贷,教师遭网课爆破猝死案2成年人被拘留,"
强烈反对"
5069246591402056,Ot3q35SJO,6589189371,歪梨小怡_,能不能严抓啊我的天！！！,教师遭网课爆破猝死案2成年人被拘留,"
强烈支持"
5069370918962612,Ot6EzBBAg,3717628855,木叶送南,霸凌这两个字烫嘴，这不就是在霸凌老师？还有说老师心理素质不行的，人家负责说人家心理素质不行，要是不管任由网课一片混乱，就是“老师没师德”，话都被你们说完了,教师遭网课爆破猝死案2成年人被拘留,"
强烈反对"
5069364227474811,Ot6tMvmxt,3189120942,气球味儿,犯罪成本太低，就是在鼓励犯罪,教师遭网课爆破猝死案2成年人被拘留,"
反对"
5069364115537995,Ot6tBneGv,6023232927,落在你肩头的飞鸟,突然怕当老师了，做家教的时候就经常被学生气到。。。,教师遭网课爆破猝死案2成年人被拘留,中立
5069364041354130,Ot6tu5GgO,5684693005,顺火暖奇剑店,还是生育率太高了，出生多,教师遭网课爆破猝死案2成年人被拘留,中立
5069363990235428,Ot6tp0Zfe,2806516411,蜜蜂烤红薯,十天一句道歉换了一位教师的生命,教师遭网课爆破猝死案2成年人被拘留,"
强烈反对"
5069363852084032,Ot6tb8K9q,1420841140,天狼星alpha,法律滞后了，得改，就这么轻描淡写可不行,教师遭网课爆破猝死案2成年人被拘留,"
反对"
5069349303878295,Ot65IggV9,7799981981,艺叙年正在输入中_,怎么才10天啊我嘞个豆,教师遭网课爆破猝死案2成年人被拘留,"
强烈反对"
5069349154980999,Ot65tkTMH,1633656642,魏春亮,人都没了，就拘留十天？这处罚也太轻了！现在犯罪成本都这么低了吗？,教师遭网课爆破猝死案2成年人被拘留,强烈反对
5069328865034489,Ot5yKl7Hr,5101138453,翩芊倾城,"阳光信用超话谁的人生不是荆棘前行，你跌倒的时候，懊恼的时候，品尝眼泪的时候，都请你不要轻言放弃，因为从来没有一种坚持会被辜负。请你相信，你的坚持，终将美好。善行一丈,远恶一米,积德一尺。以情恕人,以理律己,以善助人。以德化人,厚德而行,福自至矣。以书育人,以书上士忘善,中士行善,下士知善。为善须行,为德贵厚,为道酬勤。真行善者,当不求名,当暗处行。人心之广,何恶不容，何恶不容！人命关天这处罚是不是太轻了。","阳光信用,每日一善,教师遭网课爆破猝死案2成年人被拘留","
反对"
5069328448487795,Ot5y4zC3V,1355753742,风雪夜闭门读禁书,既然两名涉案成年人被拘留10多天，这个结果大家都不很满意，那么你写新闻的时候就要解释一下为什么要这么判？法院这么判的时候解释在哪里？依据的是什么？你搞清楚啊，你这不是挑拨对立吗？为什么现在大家戾气这么重，就是因为大家都在信息茧房里看的东西都是别人精挑细选给你搭配过的，不想让你知道的东西，就不让你知道，让你知道的东西都是让你产生疑问并且愤愤，让助长你攻击性的东西。所以大家都一知半解，所以大家在评论区都戾气很重，究其源头就是新闻没写好，太阳底下没有新鲜事，也没有那么多稀奇古怪的事，都让写新闻这帮杂碎给搞混了。为了流量点击率关注度转发量，所有的新闻都一个操性，不会一次性写一个完整的事件，都是写一部分保留一部分，给你一个非常悬疑的局面，引着你去讨论去争论，其实到最后球毛没有。这是流量时代的特色，不知道这种特色还能持续多久，反正耍手机是越来越没意思了。,教师遭网课爆破猝死案2成年人被拘留,"
强烈反对"
5069327885927483,Ot5xaoS0z,7162807952,云水轻盈的心,就这样一个结果？两年，教师被气死，让人无语！,教师遭网课爆破猝死案2成年人被拘留,"
强烈反对"
5069327201993573,Ot5w48mCp,1371163915,枣庄在线,对于这起教师遭网课爆破猝死案的审判结果，一些网友认为两名涉案成年人仅被拘留十几天的处罚过轻，不足以平民愤。也有网友认为，虽然处罚较轻，但至少给了受害者家属一个交代，也让涉案人员受到了应有的惩罚。“网课爆破”是一种严重的网络暴力行为，不仅会对教师的身心健康造成伤害，也会影响到学生的学习和成长。在这起事件中，刘韩博老师的离世让人痛心，而涉案人员的道歉和受到的处罚也算是对她的一种慰藉。为了避免类似的事件再次发生，我们需要加强对网络暴力行为的打击力度，同时也需要提高教师和学生的网络安全意识，共同营造一个和谐、安全的网络环境。,教师遭网课爆破猝死案2成年人被拘留,中立
5069326761067039,Ot5vm4tAj,6209092845,利刃空天,袁昊然公然发表“反动言论”！通报说开始调查，都已经好多天了，到现在没有任何调查回应！！！国际泳联游泳技术委员会副主席袁昊然@混合泳被曝在社交媒体发表辱军和诋毁国家功勋的极端言论，引发广泛关注。国家体育总局已对此展开调查。袁昊然同时担任我国自行车击剑运动管理中心副主任，曾有游泳部和反兴奋剂工作的背景。网民呼吁对其严惩，以正视听。事件也引起了对运动员道德教育和社会责任感的关注。其他体育新闻方面，包括世界反兴奋剂机构对于中国运动员兴奋剂检测争议的解释，以及各类体育赛事的筹备动态。,"国家体育总局对袁某某开始调查,教师遭网课爆破猝死案2成年人被拘留",中立
5069326474281783,Ot5uThXT1,7584263324,随便很微笑,好像法律是只保护活人的，死人，不管受到过怎么的伤害，死就死了，总能给施暴者找到脱罪的理由好人不长命，坏人臭万年，坏人可不会臭万年，秦侩不是现在就有人洗白吗，还有鬼子，二鬼子们不是越来越多了吗,教师遭网课爆破猝死案2成年人被拘留,"
强烈反对"
5069267042566466,Ot3X2aLEC,7850959857,朝镜I白帝霜华,老师的命不是命，老师是贱民吗请问？,教师遭网课爆破猝死案2成年人被拘留,"
强烈反对"
5069266451432536,Ot3W560Fq,7571602146,土豆饼小比,这么久才有结果结果就关进去十多天这是人命诶这么轻的处罚根本不会让他们长记性,教师遭网课爆破猝死案2成年人被拘留,强烈反对
5069258269393969,Ot3ISDpND,7634838051,礼栗豆卷_,不是才十几天？啊？这不够吧…,教师遭网课爆破猝死案2成年人被拘留,"
反对"
5069258214606459,Ot3INjklJ,7813569596,吒颜一,拘留十多天？？？请问这是中文吗,教师遭网课爆破猝死案2成年人被拘留,中立
5069258025338304,Ot3IumoJG,7395037838,片片小葵,都成年人了还只是拘留？？这判的你觉得合理吗？咋的因为是在网上就可以这么随意了吗,教师遭网课爆破猝死案2成年人被拘留,"
强烈反对"
5069246581440552,Ot3q262KI,6065232189,Jessi865,人命不值钱行政处罚十几天，不痛不痒，夺走别人一条命炫耀一辈子,教师遭网课爆破猝死案2成年人被拘留,强烈反对
5069246556276682,Ot3pZqkQO,6033161877,咩咩家小胖纸,我心眼毒，我希望这群人一辈子被网暴,教师遭网课爆破猝死案2成年人被拘留,"
强烈反对"
5069246461906269,Ot3pQ7ZUh,2405014007,TTMM_Yeah,只是拘留十天？造成这么大的影响，只进去10天，出来岂不是更猖狂。还有涉案的未成年人，能否有更多的约束力，能否完善相关法律？,教师遭网课爆破猝死案2成年人被拘留,强烈反对
5069246407639064,Ot3pKw3gI,6975812955,随随便搞个名字吧,五个人，另外三个未成年呢？留案底吗？尤其是联系这些犯罪分子的学生，如果考上学了现在被学校记过了吗？记档案了吗？,教师遭网课爆破猝死案2成年人被拘留,中立
5069246294132308,Ot3pzhl08,6993976084,兔礼颂愿,这处罚也太轻了吧……未成年的就道个歉，成年人就拘了10天……一条活生生的人命就这么没了，家人亲属还因此生活在悲伤阴影中饱受折磨，而做出这件事的始作俑者仅仅只是道歉+拘10天，不应该记入档案严惩吗，这种以此为玩笑的心理不应该被纠正被处理吗，未成年就应该好好教育，而成年人更该被严惩，受到更有力的惩罚，如果都是这么轻描淡写地揭过，受害者怎么想，加害者更不以畏惧，就应该关个几年,教师遭网课爆破猝死案2成年人被拘留,强烈反对
5069246124001356,Ot3pigMW0,7276875886,限量版苦茶籽,那些只被口头教育的学生回归校园后：老师算什么东西你知道那件事吗我都算逼死她也什么事没发生再说一遍既然多建一所学校就能少建一所监狱那么请国家保护好老师现在的学生已经不像以前那么淳朴一心想着读书了谢谢,教师遭网课爆破猝死案2成年人被拘留,"
反对"
5069246009180869,Ot3p6Cwmx,1772501653,小兰小葵是一家,涉案成年人拘留十多天，未成年人到死者坟前道个歉就完事了？代价这么轻，这处罚是来搞笑的吗？还是来纵容网课爆破的？?,教师遭网课爆破猝死案2成年人被拘留,强烈反对
5069363811975762,Ot6t78hZ8,6961662618,唐唐唐雨塵00146,都不判刑的，只是拘留，这还是成年人所承担的法律后果。剩下那些未成年人更不用说，连去坟墓前道歉都没去去全。,教师遭网课爆破猝死案2成年人被拘留,"
反对"
5069363670943374,Ot6sT3XpI,1868944794,蜜糖兔兔狗,2名成年人被拘留10天，这是告诉大家网络骚扰事儿不大？在网络上致人死亡了也就10来天儿，然后就可以继续。这还是成年人，未成年人更没所谓了，掉几滴眼泪道个歉就行？,教师遭网课爆破猝死案2成年人被拘留,强烈反对
5069363588106327,Ot6sKy0Pd,2514964327,水后她很水,现在新闻标题越来越离谱了，一点严谨性都没有，你们自己读一下能读通吗,教师遭网课爆破猝死案2成年人被拘留,中立
5069363583648572,Ot6sKfj9W,1233965570,川外川,两个成年人拘留了十多天三个小畜生道歉了。。。妈的,教师遭网课爆破猝死案2成年人被拘留,"
强烈反对"
5069363486393193,Ot6sAqPa1,7895570521,榴莲爱读书,你败给了自己做人的基本素养。,教师遭网课爆破猝死案2成年人被拘留,"
支持"
5069348934781050,Ot657k3LI,1851289991,看我喵喵喵拳,不痛不痒的处罚起不到任何威慑作用！,教师遭网课爆破猝死案2成年人被拘留,强烈反对
5069348729520180,Ot64MDWDi,6768560290,星月皆闪,就这？？？？这种人渣就拘留几天？？？？滑天下之大稽,教师遭网课爆破猝死案2成年人被拘留,强烈反对
5069348558866727,Ot64vBcDJ,5666650160,清水镇卐鸭货铺,怪不得这么肆无忌惮呢，反正哪怕死了人也只是道歉拘留而已，如果是未成年就不用承担任何责任，还真是给足了空间,教师遭网课爆破猝死案2成年人被拘留,强烈反对
5069348492280258,Ot64p9zcm,7333449407,璧夏忻昇,送峨眉山上让猴王带猴子们天天揍才行，不懂人话不配为人,教师遭网课爆破猝死案2成年人被拘留,"
强烈反对"
5069326018674966,Ot5u9AoKO,7433759798,呼安给你擦擦,所以就十天吗？能不能重视一下。这个标题到底是成年人还是未成年人？,教师遭网课爆破猝死案2成年人被拘留,"
反对"
5069325430161987,Ot5td0G8H,7800103232,Y_筱攸,这个事情好像很久了吧罚这么轻吗,教师遭网课爆破猝死案2成年人被拘留,中立
5069266097276007,Ot3VvuwOX,3479777241,空巢傲娇多拉贡,法律既然重判不了，那能不能曝光施害者,教师遭网课爆破猝死案2成年人被拘留,中立
5069265226696735,Ot3U6s67R,7876526975,天才兎牙,唉是不是罚得太轻了不过也算是有了结果坚持到现在真的不容易,教师遭网课爆破猝死案2成年人被拘留,中立
5069257991260573,Ot3Ir5hVP,7639713176,推特星狮子座田螺,记得人家女儿奔走几年了这是一条人命你就拘留几天就草草完事了？？？,教师遭网课爆破猝死案2成年人被拘留,强烈反对
5069257868312843,Ot3IeySy7,6653548012,沈嘤嘤嘤嘤竹,我靠？不是吧就拘留？这算什么啊？人家老师招谁惹谁了啊？,教师遭网课爆破猝死案2成年人被拘留,强烈反对
5069257836857790,Ot3IbsM1w,7777462349,虎牙小懵盐my,10天？？10天？！？！这个世界终于是疯了,教师遭网课爆破猝死案2成年人被拘留,"
强烈反对"
5069257668559523,Ot3HUzUIP,7056504264,我要喝酸奶啊,我天呐最近真的好多这种意外事件是想压什么热度吗一路走好,教师遭网课爆破猝死案2成年人被拘留,中立
