id,bid,user_id,用户昵称,微博正文,话题,立场倾向
5084786888808747,OzzH2AXyz,7492961562,江辞恋颖,怎么王楚钦输了你就冒出来了,王楚钦止步中国大满贯32强,中立
5084786886444918,OzzH2r2Ci,7779749697,开鑫的susu,人类永远无法共情，你没走过也走不了他的路我只能说,王楚钦止步中国大满贯32强,中立
5084786877535227,OzzH1vCfV,6622500172,奇异果味的摩托,你们怎么骂他也是世一怎么骂他也是主力.笑死了你们都闲的没事干？骂运动员？,王楚钦止步中国大满贯32强,中立
5084786876223714,OzzH1q74u,5554286458,阿梦小疯子,楚圣太有实力辣！天选32强！,王楚钦止步中国大满贯32强,中立
5084786870190110,OzzH10Nsi,2240437782,星辰大海里的一粒沙,很正常，不是升国旗的比赛无所谓，哪有次次拿第一的,王楚钦止步中国大满贯32强,中立
5084786865997026,OzzH0pa6e,7812162927,头头意见簿,输了也真诚恭喜对手的楚钦说回赛场希望少一点闪光灯球都发出去裁判又喊闪光灯真的很影响比赛观感也会影响运动员今天对手的小动作也很多很会扰乱节奏被冲击的这一路会很艰难相信王楚钦不会被困难打倒勇敢向前继续加油,王楚钦止步中国大满贯32强,中立
5084786859444825,OzzGZDD1T,7621975572,要gun去睡觉了,我不行了哈哈哈哈哈哈哈哈哈哈哈哈哈哈哈哈哈哈哈哈哈哈哈笑得想死,王楚钦止步中国大满贯32强,中立
5084786859445353,OzzGZDDap,6126366584,岁栈,好熟悉的数字。。。奥运会也。。。连商业赛也。。。,王楚钦止步中国大满贯32强,中立
5084786861803576,OzzH07zbW,7641003040,呆头猫wilt,喷子敲个键盘还真高估上自己了，你们怕不是站在球台前双脚都打颤，只敢躲在屏幕前彰显自己的优越感，积极正面的建议提出来也是对王楚钦改善自己的一个帮助，至于看不懂球还硬要嘲讽两句的人先去提升一下自我修养，你们没有资格对运动员展开恶意言论,王楚钦止步中国大满贯32强,"
强烈支持"
5084786862068444,OzzH08G60,2008672165,FANG方方童鞋,疑似准备实现男单32强大满贯。,王楚钦止步中国大满贯32强,中立
5084786857349734,OzzGZuQ06,5766860562,柚柚海盐茶,这次总不是拍的问题了吧,王楚钦止步中国大满贯32强,中立
5084786850794034,OzzGZ3kz0,7861254747,Ddunik_x,然后呢然后呢那咋了那咋了那咋了今年是只有这一场大满贯吗新加坡和沙特王楚钦在身兼但项的情况下完成的非常好你们都看不见今天一场又否认上了你们真的是眼里长了针容不得半点瑕疵所以你无法否认去年杭州亚运四冠王沙特三冠王,王楚钦止步中国大满贯32强,反对
5084786849481518,OzzGYDMzI,7685339398,嗯你要这样想我也没办法,那些说粉丝溺爱他的你们是没有脑子吗难道他输了就要像你们一样骂他打击他吗他的球迷粉丝在他输了之后就应该继续鼓励他让他有个好的心态去面对下一场比赛反而说他怪这怪那的人家一句话没说采访也没有你们又替他怪上了我看完比赛的确觉得他今晚发挥不好好几个球都没有过网他和教练肯定也会总结归纳骂他的替他挡灾,王楚钦止步中国大满贯32强,"
支持"
5084786848175155,OzzGYyiJl,6122090328,Dazouzou2121,………………此处省略32个点.,王楚钦止步中国大满贯32强,中立
5084786845030151,OzzGYl6zt,7729217691,穿过风花雪月的流年,今天最大的意外，也是预料之中，唉！扶不起来的阿斗,王楚钦止步中国大满贯32强,中立
5084786838472646,OzzGXzy7A,7313549886,天使小猫氧化锌-withme,粉丝继续溺爱吧对手猛擦汗，但是也防住了头几个反手，你说对手完全没实力是不可能的。。。头的状态不好你们就一直溺爱吗？难道每次都说他状态不好所以输了？路人没说啥你们粉丝先骂起来了先开始玩啦嘿了？还说别搞饭圈那一套如果对手搞黑球，如果你足够有实力你也照样能赢，别当永远的32强了，下次加油吧,王楚钦止步中国大满贯32强,反对
5084786834282649,OzzGXhY6Z,6226465525,Le1xs_0825,有些人要不拿马桶塞清理一下自己嘴巴，满嘴喷粪,王楚钦止步中国大满贯32强,"
强烈反对"
5084786831920146,OzzGX83w6,5545519523,530号太空人,好的！好好调整状态！下个比赛继续加油！,王楚钦止步中国大满贯32强,"
支持"
5084786831399532,OzzGX5S56,1789488430,sjrhejdkdhshsjwnehe,请问他到底发生什么事情！,王楚钦止步中国大满贯32强,中立
5084786829822590,OzzGWFdiS,6119757645,可乐缺点糖,输了就总结为什么输，这次就当积累经验包。竞技体育有输有赢很正常，下个赛场加油。我们客观接受赛场的结果，但是不接受对运动员的人身攻击。,王楚钦止步中国大满贯32强,中立
5084786825892309,OzzGWoIRf,7782170847,Ss_小孙,为国争光的运动员都是最好的,王楚钦止步中国大满贯32强,中立
5084786827460854,OzzGWviUm,5852720483,三份咖喱粥,多么令人熟悉的数字啊原来幸运数是32,王楚钦止步中国大满贯32强,中立
5084786813305317,OzzGVdRRz,7588916718,我这个电饭煲真的会哭泣的,太幽默了，又是32强。。。,王楚钦止步中国大满贯32强,中立
5084786810427099,OzzGV1N6H,7671006608,此生不入内娱门,不是，这次没有兼项、没有妈生拍了吧，在国庆当天耶、在北京耶，哥们儿你已经习惯32了吗？,王楚钦止步中国大满贯32强,"
反对"
5084786807278988,OzzGUuxB2,6489723748,蓝小颖ying,没关系的！比赛有输有赢！楚钦老师好好总结，找找状态，找找手感，接下来也要继续加油！后面的比赛期待看到更好的你！加油加油！,王楚钦止步中国大满贯32强,支持
5084786807279194,OzzGUuxEm,5894033753,鼠鼠派汉堡王,大国庆的自家运动员和白人打比赛不仅不支持中国球员还对着人家骂骂咧咧的这个词条下骂王楚钦的乒丝有一个算一个是不是都乳化呀,王楚钦止步中国大满贯32强,强烈反对
5084786807280123,OzzGUuxTl,5684017110,猫咪森林园,🏓️WTT中国大满贯男单R32：王楚钦1-3不敌丹麦选手林德，止步男单32强，比分：11-13、11-9、6-11、7-11。王的实力还是没那么稳定，最近已经连输几次了,王楚钦止步中国大满贯32强,中立
5084786807017400,OzzGUtrxS,5532093929,枝头月色明丶,学习一下老🪣老姨韬光养晦是正确的区区商业赛而已，“路人”不是一贯看不起商业赛吗？,王楚钦止步中国大满贯32强,中立
5084786802038097,OzzGU8ycx,7762511473,巴别塔流萤,没关系，很快就要达成🇨🇳第一位32强大满贯了,王楚钦止步中国大满贯32强,中立
5084786800463792,OzzGU1WEw,7748376454,5-16号李子铺,有些人真是啊，不关注自担，天天来wcq这随地大小便,王楚钦止步中国大满贯32强,"
支持"
5084786800722309,OzzGU31U9,7795332877,苍白之后重生版,那咋了，32强输16强不是应当应份的吗？,王楚钦止步中国大满贯32强,中立
5084786800459807,OzzGU1VCf,7604123391,yu妮酱_pooh,我这就是真纯路人了评论了，大家都是中国人，大头是为我国争过光的运动员，不仅仅是他，每一位运动员都值得尊重，这次的失利是事实，但不能否定他的一切，请嘴下留点情吧,王楚钦止步中国大满贯32强,中立
5084786792078046,OzzGT8IAS,7413280617,为什么数学课总犯困,加油吧自从巴黎奥运会之后感觉就。。。。,王楚钦止步中国大满贯32强,中立
5084786794959839,OzzGTkOhp,6984268002,xklih,评论区所有喷运动员的有能耐你们上一个个只会当网络上的巨人实则背后什么也不是算什么能耐啊就应该实行政策把你们这些喷子都绳之以法胜败乃兵家常事没有一个人是完美的如果大家都有一颗包容的心那么中国会更加繁荣昌盛最后祝大家国庆快乐祝运动员健康涨球,王楚钦止步中国大满贯32强,中立
5084786798887222,OzzGTBhYi,7787500575,嗑帮首席,哈哈哈哈哈哈哈哈！！！！！！！,王楚钦止步中国大满贯32强,中立
5084786790499880,OzzGT262A,6720592290,别欺负我喵,这不就说明了他确实不太行么多少次了都…,王楚钦止步中国大满贯32强,"
反对"
5084786786309664,OzzGSqtqM,3162128542,钱何其多,不是世界第一吗怎么又32强,王楚钦止步中国大满贯32强,中立
5084786785786150,OzzGSohf0,7772467363,冲锋的小阿嬛,……哦哦哦好好好挺可惜的啊哎继续加油,王楚钦止步中国大满贯32强,中立
5084786783950439,OzzGSgzGL,7685269931,云间清酒,烙铁。。。无敌了。又是32强。。。,王楚钦止步中国大满贯32强,"
反对"
5084786781586453,OzzGS6EHX,7646121906,没有-假期,有输有赢不是很正常吗，又不是神仙每次都能赢的.都是为国家争光的，真的有必要搁着骂吗！！,王楚钦止步中国大满贯32强,中立
5084786773986684,OzzGRgJ7m,6385481434,小橘注意树枝,32强拿32强也不算啥反正你就是这水平,王楚钦止步中国大满贯32强,"
反对"
5084786760881635,OzzGQ3HlV,6098364718,衣衫如雪徐凤年v,粉丝有没有那个什么杂志top1多少多少钱图来一张，我帮你们对线黑粉,王楚钦止步中国大满贯32强,中立
5084786760615103,OzzGQ2A11,7686133118,蝶吻nabi,虽然他这次是32，但奥运也是32啊，下次也可能是32啊，32岁的时候是34啊,王楚钦止步中国大满贯32强,中立
5084786753012127,OzzGPcDAH,7876351002,用户7876351002,我一定是写数学写恍惚了哈哈哈,王楚钦止步中国大满贯32强,中立
5084786748821721,OzzGOB0VP,5413620440,aefukv,走不出32这个魔咒了吗,王楚钦止步中国大满贯32强,中立
5084786742003112,OzzGO8p6g,7357873457,917719another_day,恭喜卫冕32，望继续卫冕！,王楚钦止步中国大满贯32强,中立
5084786731780286,OzzGN7t8i,6604686188,颓废酥肉,你对讨厌你的人好善良。,王楚钦止步中国大满贯32强,中立
5084786730997143,OzzGN4boX,6997281477,别闹了昂__,差不多行了各位看了比赛再来说他从巴黎回来就没有休息过,王楚钦止步中国大满贯32强,中立
5084786732041906,OzzGN8zbY,6659874245,驴小鱼儿儿,按我看球的感受，王楚钦属于有杀招但是基本功不扎实的那种。就是能一招制敌，但做不到刀枪不入，一旦爆冲失败就基本脆皮了,王楚钦止步中国大满贯32强,中立
5084786722346575,OzzGM9QrZ,7489501984,萌soso萌,王楚钦辛苦了，继续加油！,王楚钦止步中国大满贯32强,"
支持"
5084786716837370,OzzGLsGIa,3208865865,雪雪雪雪de,没关系的，四年周期还长，早发现早调整早解决！打干净球,王楚钦止步中国大满贯32强,"
支持"
5084786713957015,OzzGLgBoP,6379309990,鲨鱼姬-,妈呀竟然是乒乓球啊，你不说王楚钦我还以为国足呢，吓死宝宝啦,王楚钦止步中国大满贯32强,中立
5084786712642488,OzzGLb5qM,1848613552,澄芷晨,那年今天的2023年10月1日，微博是孙颖莎战胜早田希娜，国庆节抗日成功，大快人心。没想到2024年10月1日，国庆节王楚钦输外协了，不管什么32强不强的，国庆节输国球，挺让人不舒服的，多向马龙学习吧，真正的实力，别总让大家失望。,王楚钦止步中国大满贯32强,反对
5084786704253717,OzzGKhQAl,6324919227,鸣星闪耀,叫你妈叫，怎么，巴奥的三十二是兼三两金，你羡慕了，羡慕他第一次上奥运就为国家赢得两枚奥运金牌吗？别羡慕，因为你上不了奥运，这次的三十二但凡有眼睛看的都知道对面在比赛的时候是啥样哈，不评价了哈，脏的很想怎么样？咪咕，你自己觉得带这个话题很好看吗？@咪咕,王楚钦止步中国大满贯32强,强烈反对
5084786703991238,OzzGKgKiO,7489966787,要来一块提拉米苏嘛,王楚钦快乐乒乓健康完赛辛苦了好好休息ipad雪碧允指原味鸡,王楚钦止步中国大满贯32强,中立
5084786697440925,OzzGJvdIV,7092382334,懒虫suger,别说他他是最棒的，观众要尊重爱护球员，相信他，他还年轻，状态有起伏是正常的，他一定能打出来，我们期待他下次的表现！大家要多夸夸，不然粉丝该不愿意了,王楚钦止步中国大满贯32强,支持
5084786695608995,OzzGJnx9F,5044281310,澎湃新闻,WTT中国大满贯男单1/16决赛：王楚钦1-3不敌丹麦选手林德，止步男单32强。北京日报客户端,王楚钦止步WTT中国大满贯男单32强,中立
5084786701893919,OzzGK7WH5,7713545778,7_Yomi,骂王楚钦的都什么心理啊健康涨球不好吗成功路上怎么可能那么顺难免有些坎坷吧也没见你们考试次次都考年级第一吧我真服了你们都厉害你们怎么不上就会在网络上敲敲键盘你们都是什么心理啊,王楚钦止步中国大满贯32强,"
强烈支持"
5084786697962365,OzzGJxpnf,5304732484,言早勤谨实,很不错的👏🏻跟奥运会相比没有退步👍🏻,王楚钦止步中国大满贯32强,"
支持"
5084786694032776,OzzGJgV6M,7689110185,Rosiazzzzzz,王楚钦心态很好有眼睛的都知道,王楚钦止步中国大满贯32强,中立
5084786693769547,OzzGJfOD9,7783221064,小丽一直在奔跑,粉丝快来公关呀是不是用的备用球拍,王楚钦止步中国大满贯32强,中立
5084786681710773,OzzGI7b37,7891724237,虎爸周星,运动员娱乐化的问题出来了，上次大赛拍子坏到现在已经成为一个梗了，有娱乐圈那种万人踩的势头,王楚钦止步中国大满贯32强,中立
5084786678830507,OzzGHB3dx,6204238619,永远不会老的小王子,输了就好好总结下次再来！谁能一直赢呢？这次输了不代表以前取得的成绩就没了不懂那些一直阴阳怪气骂人的人是怎么骂的出口的运动员们的训练和辛苦只有他们自己知道赢了我们高兴输了我们也不要气馁一个运动员的成长不是一两场输球就能磨灭的好好加油！希望不要被这些挫折打败！也希望不要在网上轻飘飘打几句话攻击运动员，多点善意，少点戾气。,王楚钦止步中国大满贯32强,支持
5084786680401038,OzzGI1Gkm,5674216676,Sweetoranges,输赢很正常吧，出现问题就解决啊，有些人至于嘛,王楚钦止步中国大满贯32强,中立
5084786683019564,OzzGIcFwE,7814687559,特别的哲学家,打的差，还不允许人说吗？？就是很差啊？？你看之前主力队员打32啊？？最差也是16。。。,王楚钦止步中国大满贯32强,强烈反对
5084786685641336,OzzGInFzi,7834415364,ctm发疯日常,大哥我内蒙古票都买了你别又是32强不然我真的需要退票🎫,王楚钦止步中国大满贯32强,"
反对"
5084786676205231,OzzGHq2gn,7751549739,秋白鲜红死,大家都笑你，你最不争气,王楚钦止步中国大满贯32强,"
强烈反对"
5084786674896676,OzzGHkxQE,7461456108,现形吧十三郎,这下拍子没坏吧特殊的日子真是给了一份大礼👍🏻,王楚钦止步中国大满贯32强,中立
5084786676990707,OzzGHtkBl,6508016609,风闻社区,10月1日晚，世界乒乓球职业大联盟中国大满贯男单1/16决赛，王楚钦1-3不敌丹麦选手安德斯·林德，止步男单32强。四局比分为13比11、9比11、11比6、11比7。,王楚钦止步中国大满贯32强,中立
5084786672015666,OzzGH8smK,5700836143,EBE0512,有人八一独自抗日最终夺冠，有人国庆北京轻松输外协，大家都有美好的未来,王楚钦止步中国大满贯32强,中立
5084786667818324,OzzGGwNU0,6576832135,_上海关心你,粉丝真觉得说很棒了能安慰到运动员吗…,王楚钦止步中国大满贯32强,中立
5084786666509287,OzzGGrjmv,7804043082,咻狗总部,行啊都进来了那就看看第一局局点这个误判吧原来比赛判球可以这么随意的啊,王楚钦止步中国大满贯32强,"
反对"
5084786664408386,OzzGGiuP0,6295383421,不上岸不改名的我我我,止步又怎样，重要的是这次比赛学到了什么，楚钦老师好好复盘好好总结，希望之后不管遇到什么球风的运动员都可以战胜对方，战胜自己，这才是比赛的意义，而不是黑子们一味的谩骂，运动员难道不想赢吗？他们比谁都想赢，所以希望舆论对楚钦老师好一点。,王楚钦止步中国大满贯32强,支持
5084786664412543,OzzGGivU3,6059144643,回到起点91799,以前我一直觉得32和物资一样的cjb，我想多了，乌兹搞搞不出两次32,王楚钦止步中国大满贯32强,中立
5084786664671601,OzzGGjBip,6107791095,x小马cookie,运动员祛媚最好的方式就是实力、成绩,王楚钦止步中国大满贯32强,中立
5084786664934046,OzzGGkHzo,7634814372,塞纳留斯之眼,花我们纳税人的钱，不许我们纳税人说话。好霸道。,王楚钦止步中国大满贯32强,"
强烈反对"
5084786656283762,OzzGFqmH0,7657268555,发呆小豆包-,继续努力王楚钦证明给他们看,王楚钦止步中国大满贯32强,"
支持"
5084786656280954,OzzGFqlXI,5771593827,EmoryDrew,没有退步就已经很棒啦继续保持我们下一个“32强”见,王楚钦止步中国大满贯32强,中立
5084786649465550,OzzGEDIqa,6655070056,山上那棵红牡丹,王——楚——钦～～～你是和32强杠上了是吧，虽然胜败乃兵家常事，但是一直这样真的很伤啊，不知道说你什么好，还是只能说要你加油啊！,王楚钦止步中国大满贯32强,中立
5084786647630947,OzzGEw19N,7162268029,好运热心小企e,男乒感觉是真的断层了，女乒那边，一直在上小将，小将也能扛起大旗，男乒这边打多少年还是那几个，新来的小将也顶不上来，yx做的蛮好的，梯队建设是没有的,王楚钦止步中国大满贯32强,中立
5084786890901744,OzzH33MAg,7673096256,天生Top妈,头头辛苦啦，好好休息，骂的人没事干的话就赶快自己好好练习乒乓球打到世界第一吧,"王楚钦1比3林德,王楚钦止步中国大满贯32强","
支持"
5084786641339740,OzzGE5CwI,5979140330,--小嗯,对这种打法好好总结存在的问题吧。加油,王楚钦止步中国大满贯32强,中立
5084786863636636,OzzH0fg3q,6964500436,扶堤杨柳13522,白皮🐷各种赖皮，关键是他们还是乒丝的爹。真的令人🤢的乒乓球。,王楚钦止步中国大满贯32强,"
强烈反对"
5084786838470693,OzzGXzxC5,5387900157,默冉dream,兄弟你是懂怎么让黑粉享受的,王楚钦止步中国大满贯32强,中立
5084786924192608,OzzH6hAGI,5505107152,多晒太阳85,对王楚钦的包容还挺好，24岁，还挺年轻。细数前辈们，早已登顶了。,王楚钦止步中国大满贯32强,中立
5084786861801770,OzzH07yIO,6201401330,LYW平安喜乐就好,今天是国庆节，反而……,王楚钦止步中国大满贯32强,中立
5084786639505364,OzzGDDSMk,7248152754,jjucianerovu,你真的太厉害啦我真的怕再不夸你下次你就要64强啦,王楚钦止步中国大满贯32强,中立
5084802187793317,OzA5IwHoF,1730967711,闪耀小草莓,从来不骂运动员，骂得是脑残粉刚刚在dy刷到这张图片，有人说总赢也不是好事，养精蓄锐才是正道胜败乃乒家常事，坚定就好了好好好那希望你们哥哥姐姐以后输内战别骂哦骂运动员的都是汉奸请你们记住这句话,王楚钦止步中国大满贯32强,中立
5084802118323321,OzA5ByVh7,7810351931,每年都有张淼怡,至少没有退步保持好心态期待下次比赛！会有更好的成绩的,王楚钦止步中国大满贯32强,中立
5084802010582503,OzA5r2rxd,7786521497,沢斩,真正的高贵，应该是优于过去的自己，勇敢做自己成为只有你自己才能制造的风景，以自己的方式绽放青春。,王楚钦止步中国大满贯32强,中立
5084801893666732,OzA5ffnSQ,2237611887,一辈子一起走517,虽然王楚钦此次止步32强，但他仍然得到了很多人的支持。其实失败是成功的一部分，只要继续保持积极的心态，不断努力，王楚钦一定能在未来的比赛中取得更好的成绩,王楚钦止步中国大满贯32强,支持
5084801885803467,OzA5eolKj,5013832645,莱阳是爱迪的擦屁纸,现在加入国足还来得及，正是闯的年纪,王楚钦止步中国大满贯32强,中立
5084801582764821,OzA4KbBfT,7593546002,Zuang的饺子,黄豆种植黄豆可在春季、夏季、秋季种植，春季一般在3-4月种植，夏季一般在麦收后的5-6月种植，秋季一般在8月种植。在我国，北方春大豆一般在4-5月播种，南方春大豆一般在2月至3月初播种，黄淮海春大豆一般在4月底至5月初播种，长江春大豆一般在3月底至4月初播种；黄淮海夏大豆一般在6月播种，南方夏大豆一般在5月至6月上旬播种；秋大豆一般在8月10日前播种。二、黄豆种植技术1、整地选择选择灌排良好、土层深厚的地块，将基肥均匀的撒在地表，深翻土壤，深度22-25厘米，使肥料和土壤充分混合，再将土壤耙细。可用优质农家肥1-2吨、磷肥10-13公斤、硫酸钾3公斤、锌肥1公斤做基肥。,王楚钦止步中国大满贯32强,中立
5084801558905585,OzA4HBmKt,2512580333,守护夏都,大头，不要气馁，我们支持你，加油！,王楚钦止步中国大满贯32强,"
支持"
5084801411318494,OzA4t5x02,6835598773,恰逢冬日遇礼,啊啊啊啊这和奥运会有什么区别🌚真是不忘初心牢记使命呢,王楚钦止步中国大满贯32强,中立
5084801411057144,OzA4t4r0I,7490465173,闻笙来,王楚钦1-3丹麦选手林德，止步WTT中国大满贯男单32强北京时间10月1日，2024年WTT中国大满贯男单第二轮32强进16，世界第一王楚钦以1-3爆冷不敌世界排名第50位的丹麦选手林德，止步32强。第一局，两人一上来打得相当胶着，比分先后来到9平、10平、11平，随后林德连得2分，以13-11拿下首局。第二局，两人依旧打得难解难分，王楚钦在9-9平后通过犀利的进攻连得2分，将比分扳成1-1平。第三局，林德在中段连续得分，以11-6拿下，总比分2-1再度领先王楚钦第四局，林德以11-7拿下，总比分3-1爆冷战胜王楚钦。头号种子王楚钦则止步WTT中国大满贯男单32强。这也是王楚钦在巴黎奥运会男单比赛不敌莫雷加德止步32强后，输掉的第一场外战。,王楚钦止步中国大满贯32强,中立
5084801243022422,OzA4ccGgK,5970204973,洛斯顿序章,王楚钦止步中国大满贯32强没事哒没事哒，再接再厉！,,支持
5084801050870352,OzA3T3EpW,7778767882,_叫我兔子先生_,沉浸式挑球中，是比赛就有输赢，正常看待，健康涨球[比心][比心],王楚钦止步中国大满贯32强,中立
5084801046679541,OzA3Ss1Ex,7850899736,稚叙猫珉_圣采儿1108生日快乐,继续加油吧，下一场比赛见,王楚钦止步中国大满贯32强,中立
5084800967248138,OzA3Kupzs,6549555775,鲁鲁猫,怎么感觉看见他出现在rs上一直跟32强摆脱不了了,王楚钦止步中国大满贯32强,中立
5084800946013120,OzA3IpehO,1573794683,杰夫,国庆节啊，亚冠联赛上海双雄输了，乒乓球结果也惊到我了。王楚钦1-3输给丹麦选手安德斯·林德，止步男单32强，有点可惜啊！,"王楚钦止步中国大满贯32强,王楚钦1比3林德,林德回应战胜王楚钦",中立
5084800905906750,OzA3EoMCa,6620445732,我有椰椰耶,王楚钦超话不管是哪个平台来的宝宝都来跟我们一起溺爱不用分析这那的也不用看乒丝说什么只需要记住相信王楚钦就够了,"王楚钦止步中国大满贯32强,王楚钦1比3林德","
强烈支持"
5084800897517734,OzA3DvxHM,6235655507,奶困二烨,嗯嗯嗯我是动感超人，动感光波，啵啵啵啵不要着急，因为总会有人熬夜陪你，下雨接你，说我爱你，好的总是压箱,王楚钦止步中国大满贯32强,中立
5084800774050948,OzA3rgZPS,5989149132,丽丽去见昕,大头加油！要永远相信自己,王楚钦止步中国大满贯32强,"
支持"
5084800759371668,OzA3pDjZW,7586395784,·晚睡酸奶·,已经很厉害啦下次一定会更好！！不要丧气,王楚钦止步中国大满贯32强,"
支持"
5084800624886285,OzA3ckv93,2797393794,陶笙畅评测,有点意外啊，感觉状态还没调整过来，继续努力向前冲吧,王楚钦止步中国大满贯32强,中立
5084800594218872,OzA39hHwk,6660265994,吸一口太阳布丁x,王楚钦超话输了一起扛，赢了一起狂！没事的，比赛有输有赢。相信大头，这是他顶峰之路要经历的，不可能百分之百都喜欢一个人，有喜欢的就有不喜欢的。咋们坚定信心就好！,"王楚钦止步中国大满贯32强,王楚钦加油",支持
5084800578752977,OzA37AJ33,7463192552,rich瑞贝卡,搞不懂为什么一群人在那里阴阳？？人家得冠军的时候你们就看不见是吧失误了，世界排名第一怎么可能会输给他，我觉得肯定不是技术不行，论技术，王楚钦可以说遥遥领先，世界第一，我觉得肯定是对方使坏，导致王楚钦心疼出了问题！,王楚钦止步中国大满贯32强,"
强烈反对"
5084800542573008,OzA34aNm8,2527520833,吃不饱的普普,孙颖莎混双的含金量还在上升，马龙别退役了，再护送一届吧。奥运32强后咋还没缓过来？,王楚钦止步中国大满贯32强,中立
