id,bid,user_id,用户昵称,微博正文,话题,立场倾向
5084807992443939,OzAf5afMn,6571446367,u_epilogue,32强就32强吧，没关系的姐妹我抱抱你啊毕竟这也不是第一次了，不就是32强吗虽然奥运会止步32强国庆又止步32强但他可是世男一啊，世男一是多少人的一辈子啊！世男一的女人不要认输好吗,王楚钦止步中国大满贯32强,"
支持"
5084807939752193,OzAeZEUZr,1991298053,半边007,爆冷！王楚钦止步WTT中国大满贯男单32强,,中立
5084807877103336,OzAeTtNTW,2099539470,呼哩_huli,又是32强啊？和这个数字杠上了？行吧，这次又是？拍子还没用习惯？,王楚钦止步中国大满贯32强,中立
5084807822316195,OzAeO9IxZ,7304840745,玫瑰樱桃卷-,有输赢正常吧，也不能说是错吧，不然赛场上对的人难道只有一个,王楚钦止步中国大满贯32强,中立
5084807783254583,OzAeKdEFh,1199581807,态度岛,在刚刚结束的WTT中国大满贯男单1/16比赛中，王楚钦1:3不敌丹麦选手林德，遗憾止步男单32强，比分为：11:13、11:9、6:11、7:11。林德在赛后采访表示：我这场比赛放慢了节奏，如果打快节奏的比赛，王楚钦是最优秀的选手，今天他犯了一些错误，没有发挥最佳的水平。,王楚钦止步32强,中立
5084807761234977,OzAeI5bgZ,7802857831,Rojingtic_初秋枫寄语,野心昭昭，傲雪斗霜，荆棘缠身，陷入沼泽，挣脱束缚，杀出重围，刻骨铭心，所谓“成长”，夜涨山崖，你于暗夜生长，冰如冷锥的文字，历练自己，打倒不公，成就诸多荣耀，登上山顶，俯瞰众生。,王楚钦止步中国大满贯32强,中立
5084787050549095,OzzHj2iQn,5351925097,1551干嘛呀,有没有退步，大家别遮样,王楚钦止步中国大满贯32强,中立
5084787050283703,OzzHj1bNR,5366582555,是你们最恨的麻辣女兵喵喵喵,粉丝最饭圈的一位看笑了,王楚钦止步中国大满贯32强,中立
5084787046095267,OzzHipzEL,7660200887,丫丫丫丫一一一一一一,辛苦啦楚钦老师继续加油,王楚钦止步中国大满贯32强,"
支持"
5084807757827611,OzAeHwQjN,1400652955,funny-6,在WTT中国大满贯2024男单1/16决赛中，王楚钦对阵丹麦选手安德斯·林德。经过四局激战，王楚钦以1-3的比分不敌林德，遗憾止步男单32强。这场比赛中，林德发挥出色，而王楚钦则未能发挥出最佳水平。,王楚钦vs林德,中立
5084807702780368,OzAeCbFiE,2293703917,BRTV体育休闲,林德赛后表示，没想到能赢王楚钦，这场比赛他也是发现了王楚钦有些发挥失常之后，才开始相信自己有机会赢。,"王楚钦止步中国大满贯32强,王楚钦1比3林德,WTT中国大满贯",中立
5084807661095581,OzAey4B0F,1908194624,红星视频,10月1日晚进行的WTT中国大满贯男单1/16决赛中，王楚钦1-3不敌丹麦选手安德斯·林德，止步男单32强。的微博视频,,中立
5084807602114020,OzAes8RX6,7551636816,唐俪辞的啵啵可荔多,没有人能永远32除非你是,王楚钦止步中国大满贯32强,中立
5084807581926788,OzAeq85fe,5347537335,韬闻,王楚钦这是第二次单打过早出局了，再这么输，恐怕就难当单打大任了。,"王楚钦止步WTT中国大满贯男单32强,王楚钦爆冷出局",反对
5084807538674667,OzAelAoFZ,1747513637,我少年老成,别骂。王楚钦即使单打失利，也是中国男队表现最优秀的成员之一。奥运会混双、男团两块金牌，已经是载入史册的优秀表现。单打接连失利，说明还没迈过心里的那道坎，于公，中国男队后备人才济济，王楚钦单打不能扛旗的话，有的是人顶上。于私，洛杉矶还有四年，提前输点球未必是坏事，挑战和困难越严峻，对优秀运动员的锻造才越可贵。所以真的没啥好骂的。我觉得给年轻人多点空间和善意，是中国体育的应有之义。,王楚钦止步中国大满贯32强,"
支持"
5084807379552315,OzAe5E4ZB,2472872571,迷妹王德发,还是需要调整好心态，步步为营，稳扎稳打。,王楚钦止步中国大满贯32强,中立
5084787033509554,OzzHheIZI,1760298927,陆锡鑫,这个就有点邪性，难道32就是王楚钦的宿命？,"王楚钦止步中国大满贯32强,王楚钦不敌丹麦选手",中立
5084787031149130,OzzHh4OWm,5336638914,梨波雪,再也不用冰箱了自己就可以次次爆冷,王楚钦止步中国大满贯32强,中立
5084787023022056,OzzHgcGaQ,5339001942,坨坨醒醒,奋力追分的王亲亲最帅了！如肖指导所说般：遗憾也是一种前进的动力，不然太完美动力就不够！加油加油加油,王楚钦止步中国大满贯32强,中立
5084807140478554,OzAdI20uC,6351705477,京视频,中国大满贯1/16赛事，王楚钦1-3不敌丹麦选手林德，遗憾止步。下次比赛，再战！大头加油，再来一个漂亮球！王楚钦超话,"年轻人从头再来一次又如何,王楚钦止步中国大满贯32强,王楚钦1比3林德",支持
5084806982143948,OzAds8ZJO,6620445732,我有椰椰耶,王楚钦超话这图好第一次见,"王楚钦止步中国大满贯32强,林德称上次就觉得能赢王楚钦",中立
5084806955666157,OzAdpnM1D,1546600647,滚滚爱躺平,林德其实也不容易，他经历过别人无法想象的人生困境，还勇敢地走出来了，真的很励志。当然，后面遇到中国运动员，还是请中国运动员多加油,王楚钦止步中国大满贯32强,中立
5084787024855426,OzzHgkn7k,2873823224,Bloodsurge,不愧是32强，实力太稳定了哈哈哈哈哈哈哈哈哈哈,王楚钦止步中国大满贯32强,中立
5084787020139547,OzzHg0AiL,7650079336,最爱馥芮白Flatwhite,这小伙是不是心态不好？,王楚钦止步中国大满贯32强,中立
5084787016210622,OzzHfq3Fk,7077651567,灌汤小醋,王楚钦你最棒！继续加油！！那些闲言碎语不要去听爱造口业的人终究会折寿并且一辈子倒霉,王楚钦止步中国大满贯32强,强烈支持
5084806927614218,OzAdmvWNY,6525597692,迪仔漫游元宇宙,啊，又是32怎么跟32是杠上了吗？大头收收心吧，希望能多多训练争取更好的成绩。,王楚钦止步中国大满贯32强,中立
5084806669144312,OzAcWCmQU,3847642518,麦子哥哥QaQ,林德炫耀战胜王楚钦|我刚拿下了世界第一，在他们中国的主场，这是我人生中重要的时刻。真的是有点小人得志的感觉，本来没那么讨厌，听了他说的话，这人真是没品。||,"林德回应战胜王楚钦,王楚钦止步中国大满贯32强,林德称上次就觉得能赢王楚钦",强烈反对
5084806652366704,OzAcV9VGE,2891416631,matemia,林德赛后掩饰不住击败王楚钦的骄傲:“嗨，我刚刚击败了世界第一，在他的家乡中国，这真的是我人生中最伟大的时刻。感谢你们的支持，我将继续战斗，并希望赢得更多的比赛。”,"林德说王楚钦没发挥最佳水平,王楚钦止步中国大满贯32强,王楚钦1比3林德","
强烈支持"
5084787013060903,OzzHfcQhp,3608330333,不是一颗柠檬-,一开始没注意看以为是两个月前的词条,王楚钦止步中国大满贯32强,中立
5084787004670654,OzzHejB38,6134173300,紫莎啦啦,输就输了，没必要找那么多借口，王楚钦技术和心态还是需要继续磨练，精进，下一站比赛加油。你们黑子请积点口德。,王楚钦止步中国大满贯32强,中立
5084806537022306,OzAcJtsP0,7413040672,玺屿咚莎,有的时候真的不得不说有的人真的挺遭报应的这个时间点卡的刚刚好buff还叠满了那怎么办只能说一句恭喜32了呗携32岁老婆在奥☁️32之后的第32天的国庆第一天比赛上对战外协又喜提32,王楚钦止步中国大满贯32强,"
强烈反对"
5084806473320838,OzAcDdVTU,5624309957,Shakinwind,粉丝们是喜欢他打球也好，喜欢他颜值也好，喜欢他性格也好，都请停止毒奶吧，不要再说健康就好，已经很努力了，已经很棒了，这一周过去，单打积分就会更新，输了外协要扣3000，年轻队员不断涌现，林德这种奇奇怪怪的打法后面也会遇到，希望他认真复盘，积极应对每一场比赛，强化内心和技术，就当是清零了再来吧。,王楚钦爆冷止步中国大满贯32强,中立
5084806463361145,OzAcCe6o1,7833325161,柒柒闲聊,输球正常，运动员都不该被骂，但是粉丝有点过了，所以正主连带被骂，为国争光，远离饭圈。,王楚钦止步中国大满贯32强,中立
5084806402807747,OzAcwbMqf,7501766636,蓝若相夕,王皓：球啊，球都没打起来过。王楚钦遗憾止步中国大满贯32强，大头还年轻，还有很多机会，回去好好总结，好好休息，下个赛场见。,,中立
5084806398350547,OzAcvz2mf,2054300185,虎扑的步行街,爆冷！WTT中国大满贯：王楚钦1-3不敌林德，止步32强虎扑10月01日讯WTT中国大满贯男单32强赛一场焦点战刚刚结束，王楚钦1-3爆冷不敌丹麦选手安德斯-林德，无缘16强。四局比分为：11-13，11-9，6-11，7-11。安德斯-林德将在1/8决赛中对阵中国台北选手高承睿。,"王楚钦止步中国大满贯32强,王楚钦1比3林德,王楚钦vs林德",中立
5084806373707707,OzActfyxJ,5234068572,轻轻小猫呀,感觉对32这个数字情有独钟,王楚钦止步中国大满贯32强,中立
5084787001790666,OzzHe7vPI,3215518945,隔壁王五-,时隔两个月恭喜卫冕！！！！！快乐乒乓还得是你！！！！！,王楚钦止步中国大满贯32强,中立
5084786999696464,OzzHdEGuA,2244244547,受压易爆的稚,没事的，集齐32强大满贯也很厉害的。,王楚钦止步中国大满贯32强,中立
5084786991305684,OzzHd5tFq,5543135890,wlwazls_,让我上我也进不去十六强，我们差不多的，加油！未来可期！,王楚钦止步中国大满贯32强,中立
5084806123881477,OzAc4ghKt,6326746393,不熬夜的神仙,没有人要求你必须拿冠军🏆你不拿冠军我们依然爱你尽力就好比赛辛苦啦好好休息最棒的小王,王楚钦爆冷止步中国大满贯32强,支持
5084806011945557,OzAbT8a7X,1959451603,锦观新闻,今晚，世界乒乓球职业大联盟中国大满贯男单1/16决赛，王楚钦1-3不敌丹麦选手林德，止步男单32强。！,"王楚钦1比3不敌林德,王楚钦双打加油",中立
5084805995173397,OzAbRlHPT,7131554118,爱宁嘻嘻,输了就输了、怎么…这次输了下次再赢回来不就好啦咱是要赢但是也输的起。加油少年加油王楚钦,王楚钦止步中国大满贯32强,"
支持"
5084786987894798,OzzHcx7Ns,6689746616,闭着眼的大象,要成长，就要受抽筋扒皮之痛，好好总结比赛经验，相信下个赛场你一定会更好，也坚定的相信你一定可以越来越好；没有哪个冠军是轻而易举得来的，都经历了漫长的磨练与等待，捂住耳朵向前冲吧，不要在意外界的眼光和声音，专注做自己。,王楚钦止步中国大满贯32强,"
支持"
5084786987894323,OzzHcx7FN,6744956639,弓弦洲,感觉来娱乐圈发展更有前途,王楚钦止步中国大满贯32强,中立
5084786986849890,OzzHcsJY6,7288733117,本年已无修改昵称次数,？？他心态是不是不太好？？咋感觉看到很多次他止步xx强了？,王楚钦止步中国大满贯32强,中立
5084786985014370,OzzHcl2sW,3860137567,胜酱要胜利哟,胜败乃兵家常事，下次再战，以冠军为目标，王楚钦加油！,王楚钦止步中国大满贯32强,支持
5084786980821361,OzzHc3rFL,6604458598,爱玩点抽象呗-,看了实时，人怎么可以这么有梗,王楚钦止步中国大满贯32强,中立
5084786981083964,OzzHc4xZi,7659955375,_第七次日落_,不是我说。输了就输了嘛运动员也挺不容易的粉丝能不能不要老是说什么打球脏什么的他在场上也没有提出来判罚发球有问题啊世界上没有那么多阴谋论的。为什么要去网暴路人呢？,王楚钦止步中国大满贯32强,"
中立"
5084805723066842,OzAbqcRPc,7318105045,80后梦想家,各位，不要这么尖酸刻薄对世界排名第一，大家应该还给年轻队员专心打球的空间。他输了自己比谁都难过，这时候一句暖心话能温暖一个人的心。谁都有高潮低谷的时候，不是吗？,王楚钦止步中国大满贯32强,支持
5084805511512618,OzAb56lv4,6401251756,进阶的漂亮辰,多么熟悉的数字，也算稳定发挥了,王楚钦止步中国大满贯32强,中立
5084805477958737,OzAb1xoqJ,1808062110,王权-茜茜,啊😱发生了什么？我感觉像在做梦，运动员有输有赢，继续加油吧。,王楚钦止步中国大满贯32强,中立
5084786983700817,OzzHcfwKB,1737144707,範范笵DAY_DAY_UP,想问这比赛我们国家还有其他人剩下吗,王楚钦止步中国大满贯32强,中立
5084786983702201,OzzHcfx6V,1863449300,李好马甲,哪个冠军成长的路上还不遇到点挫折呢？没必因此而要唱衰一个人！,王楚钦止步中国大满贯32强,"
支持"
5084786985009503,OzzHcl1cr,7405529505,团团仔DT,王楚钦后面继续加油吧…对面选手为什么可以在不是6的倍数的时候跑去擦汗？我以为这算违反规则？,王楚钦止步中国大满贯32强,中立
5084786982650819,OzzHcb7B9,6384226962,YaYa小希,我想请问一下，头头是上场之前身体不舒服了吗，感觉候场的时候他很冷，是现场冷还是发烧了呀还有就是这外协路数是真脏，不吃发球之后再申诉偏偏等头头发球时候去申诉，哪有这样的，打乱比赛节奏嘛这不是王楚钦超话,"王楚钦加油,王楚钦止步中国大满贯32强",中立
5084786979244479,OzzHbCMUv,7328598295,荔枝Q甜-o,一次又一次，这次又是因为什么啊世界第一就这样的啊,王楚钦止步中国大满贯32强,中立
5084786978194389,OzzHbynJz,1920378253,una_624,你吐槽一下他们就说你侮辱为国征战的ydy害怕,王楚钦止步中国大满贯32强,中立
5084805125637545,OzAasnEA9,1671109627,包容万物恒河水,🔻🔻刚看到，有点惊讶。对手世界排名不高啊。,王楚钦止步中国大满贯32强,中立
5084804714597664,OzA9Nji3S,2129432122,茶人有话说,吸取教训，在下一届奥运会到来之前这些都是历练，输了不怕，总结经验就是了，继续加油吧，以后面对一些情况才能更好的应对,王楚钦止步中国大满贯32强,"
支持"
5084786975050137,OzzHblbLP,5555018732,乐山大佛看不得人间疾苦,中国乒乓从王开始走下坡路,王楚钦止步中国大满贯32强,"
反对"
5084786972692176,OzzHbbimc,7797124058,久酷宝宝_接梓墨转会版,加油，相信你少年不缺从头再来的勇气,王楚钦止步中国大满贯32强,"
支持"
5084786968496059,OzzHazEdd,6319864609,dudusama11,还在断拍的悲伤中没走出来啦,王楚钦止步中国大满贯32强,中立
5084786969810127,OzzHaFa3R,7467159786,浮华逝之,又是32哈哈哈哈哈哈哈,王楚钦止步中国大满贯32强,中立
5084786973999133,OzzHbgMm9,7826015852,幸運lucky_goodresult140,感觉他比较适合混双，单打有点难了,王楚钦止步中国大满贯32强,中立
5084804657710010,OzA9HwlJ0,6349538614,梨园糯糯包,大头加油已经很棒啦好好复盘一切都会过去的一直支持你,王楚钦止步中国大满贯32强,"
支持"
5084804655879242,OzA9HoFsu,7711086381,快乐堡W呀,关关难过关关过，好好休息，总结这次问题，期待你下一次的比赛，要坚定自信大步向前走王楚钦超话,"wtt中国大满贯2024,王楚钦止步中国大满贯32强",中立
5084804561244314,OzA9y5dHA,2435539977,常常常新宇,刚看完王楚钦比赛，我内心是比较平静的，因为我不算是他的球迷，只是报道工作有过接触而已。但看了一圈网上评论之后，我真的久久不能平静，我永远想为本不该陷入舆论风波却总是被架在火上烤的人说说话。我做博主八年，做体育解说员三年，做记者两年，和大部分人相比，我接触舆论会更多一些，我在做体育解说员的时候也曾深陷舆论攻击。有一句话说“因为淋过雨所以也想为别人撑把伞”，我想说，我淋过的雨远不及这些运动员，但也想在每次下雨的时候把我的小伞撑开，伞越来越多，总有一天能把漫天大雨的天空撑满。,王楚钦止步中国大满贯32强,中立
5084804503046098,OzA9scMqC,1497002441,数码猫,我觉得运动员还是应当专注于比赛吧，今天一个采访，明天一个直播的，确实很容易影响成绩。,王楚钦止步中国大满贯32强,中立
5084804456383617,OzA9nqMFz,1929687534,贪睡的Body,不知道这次球拍有没有坏,王楚钦止步中国大满贯32强,中立
5084804246407531,OzA92qSTh,5164074179,好好学习a,继续加油吧别的不说了好好复盘,王楚钦止步中国大满贯32强,中立
5084786962205278,OzzHa9fH0,1655509237,混吃混喝瞎快乐,"对面""放缓节奏"",打一个球擦一把汗,发球动不动就示意擦网，球儿压根儿没打起来，七零八落的一场比赛而且第一局最后那一分判确实看不懂当然这都不是借口，输了就是输了,新周期楚钦健康涨球外也练练心态！面对什么牛鬼蛇神都要稳住，新周期加油！！",王楚钦止步中国大满贯32强,中立
5084804230416926,OzA911KsC,7305997295,摩天轮的思凯wjk,其实球拍有问题状态有问题自己肯定多多少少有一些问题不假，但是真的没必要冷嘲热讽的吧？大家是不是早就开始把力气使错了方向，从开始看见的是大家担心什么“梯队建设”“国家光荣”变成了只要王楚钦输了就会被嘲笑被辱骂。不管那里有问题他自己肯定也是有一些问题的，有问题就想办法解决问题就好了，身为中国人你可以中国队的王楚钦一些建议甚至鼓励就够了真的没必要偏激的觉得好像王楚钦犯了什么天大的错不能容解一般。王楚钦如果真的是实力有问题jlz比任何人看得都要清楚，如果问题达到一定程度了那把机会给别人也是有可能的，失败多了也可以积累经验，说不定那一次就赢了呢？还有麻烦大家开玩笑也个度吧！,王楚钦止步中国大满贯32强,中立
5084804208398942,OzA8YzeWO,7598265389,头牌五花肉,毛茸茸小狗永远支持你🫶🏻,王楚钦止步中国大满贯32强,"
支持"
5084804152561055,OzA8TaKfl,7451020728,不喝茉莉椰ovo,虽然不是很懂体育这方面的东西，但是真的很懂这种感受，因为电竞有些方面跟这差不多，加油吧！,王楚钦止步中国大满贯32强,中立
5084804142338074,OzA8S9OeS,2129432122,茶人有话说,竞技体育尤其是乒乓球这几年外协的发展还有国乒运动员的压力都很大，尤其像主力队员，从巴黎回来活动不断，系统训练都没有而且一直在被各国研究，这个时候输也未必是坏事，冷静冷静再出发，调整好心态又是一条好汉！我们从来都不缺从头再来的勇气！相信王楚钦！加油！,王楚钦止步中国大满贯32强,支持
5084804049012740,OzA8IBOCM,2360581144,路子垚,熟悉的剧情，不会有心理阴影了吧,王楚钦止步中国大满贯32强,中立
5084786945952644,OzzH8oYyo,7183902347,明月清风与海,还以为自己看错了，刚想骂手机这是多久前的又给我推送，定睛一看没看错,王楚钦止步中国大满贯32强,中立
5084803773240653,OzA8hdB2B,2129432122,茶人有话说,王楚钦止步中国大满贯32强。WTT中国大满贯男单1/16，王楚钦不敌丹麦选手安德斯·林德，止步32强。,王楚钦止步中国大满贯32强,中立
5084803464430653,OzA7MiAC9,6662116307,Auiuui,王楚钦我希望你要越来越强，希望未来你用实力证明一切，总结经验,王楚钦止步中国大满贯32强,"
支持"
5084786940708321,OzzH82Ygx,5023418656,啊cezhou,爆冷机上线。。。。敬请期待。。。。,王楚钦止步中国大满贯32强,中立
5084786936255956,OzzH7qfsw,6365130331,耀钦钦小豆包,竞技场上，胜败乃兵家常事，理性看待输赢！下了赛场好好休息，备战明日男双，王楚钦你一直都是最棒的！,王楚钦止步中国大满贯32强,支持
5084786937304588,OzzH7uEfW,7265006655,乱意o,球是不看的，人是要骂的，别这么exOK,王楚钦止步中国大满贯32强,"
强烈反对"
5084786939134373,OzzH7CkgB,7844788406,morishda,少年不失从头再来的勇气，新的周期才刚刚开始，本命年的你已经很棒了，第一次参加奥运会就夺回了属于我们中国第一块混双金牌，这个是历史性的成就，今天在这个赛事上止步没有关系的，快乐乒乓，继续加油！王楚钦，加油！再赢一个漂亮球！,"王楚钦,王楚钦止步中国大满贯32强",支持
5084786941755664,OzzH87mJa,6518149853,厚德载富啦,王楚钦再拿三个三大赛冠军就全满贯了，加油,王楚钦止步中国大满贯32强,"
支持"
5084786932587788,OzzH7aRcw,2754561857,怕有什么用_,哈哈哈哈哈哈哈哈哈哈哈哈哈哈，看着看着剧呢又来逗我笑了,王楚钦止步中国大满贯32强,中立
5084803330475474,OzA7z1ZGW,7725067852,用碗盆能干架嘛,怎么又是止步32强了，头头要不去拜拜，怎么跟32杠上了,王楚钦止步中国大满贯32强,"
反对"
5084803254714513,OzA7rjMsx,7858307298,啵啵小猪顺,有梦想、有追求，是件弥足珍贵的事。别轻易怠慢了这份逐梦之心，别用“来不及”去敷衍自己，更不要因“不可能”而轻言放弃。——《人民日报》,王楚钦止步中国大满贯32强,中立
5084803204385539,OzA7mioSv,7103306604,杨洋---孤独成瘾,粉丝又不会说是表演赛吧,王楚钦止步中国大满贯32强,中立
5084803068597726,OzA78A4F0,1502169164,MebiuW,又是32强亏得粉圈那么多人给他刷了好多热搜呢🚞🚞🚞,王楚钦止步中国大满贯32强,"
强烈反对"
5084802871724349,OzA6P7eA5,2706887834,可爱赛高哩,今日份赛场📷你打我们就看你怎么打我们就怎么看就是爱你和支持你两回事儿～,王楚钦止步中国大满贯32强,中立
5084802849967486,OzA6MFOZU,5794124185,娱闻星空,林德3-1赢了王楚钦，受采访时说对方没有发挥好。评论区直接真相了，真球迷会失望，上次还好说输给亚军。多练，多沉淀吧，技术到位，心理素质不行。积分排名第一，到了真正的大赛单打了就不行，男单金牌随便拿就行。,王楚钦止步中国大满贯32强,"
反对"
5084786930485125,OzzH722cB,5052954591,J_xlimpossible,微博真的是太不友好了！天天没完没了的黑！这些糟心的事已经严重影响到当事人了！,王楚钦止步中国大满贯32强,"
强烈支持"
5084802847872119,OzA6Mx1TF,1733049557,超级火星赛亚人,自奥运会以来，围绕着“大头”，我觉得都该好好静静……包括球员、球迷、粉丝、黑粉们……,王楚钦止步中国大满贯32强,中立
5084802799898138,OzA6HFwXo,6734021789,一碗芝士鱼丸面_,不敢想wtt的皮下到底是什么人不尊重运动员的情况也不止出现这一次了吧敢在外网发不敢来国内发吗@WTT世界乒联,王楚钦止步中国大满贯32强,"
强烈反对"
5084802779185939,OzA6FCxGj,7495951625,洋芋叽圆,嗯没错嗯嗯..历史好像重演了只不过这次没有女方带飞了😋👯还得继续训练啊心一定不能浮躁,王楚钦止步中国大满贯32强,中立
5084802677477238,OzA6vvnaC,1768636231,烟雾与镜像,王楚钦1-3不敌丹麦选手安德斯·林德，止步男单32强了,王楚钦止步中国大满贯32强,中立
5084786915280427,OzzH5m9Gb,5661277006,一个狗蛋儿_,喜不喜欢我们出勤哥哥的32强？嗯？说话？kisskiss😘,王楚钦止步中国大满贯32强,中立
5084786915806950,OzzH5omEu,7710669069,沉默的分母YOLO,就这么喜欢32强这个头衔吗,王楚钦止步中国大满贯32强,中立
5084786908202609,OzzH4ypS9,6264541673,朝光__,好幽默啊啊啊啊啊啊啊啊啊啊啊啊啊啊啊啊啊啊啊,王楚钦止步中国大满贯32强,中立
5084802523333549,OzA6gdZcV,5865602221,差不多是个废仙了,竞技体育输赢太正常了，这次大满贯好多种子选手都早早出局，给他们一些时间去调整吧，毕竟没有人比运动员本人更想赢！,王楚钦止步中国大满贯32强,中立
5084802449411558,OzA68Dunk,1730915462,宛宛的花园,32只要一单打就止步，就爆冷。,王楚钦止步中国大满贯32强,中立
5084802420048132,OzA660cwk,7807382291,兔恋方程式,啊啊啊啊啊啊啊啊啊怎么又是32天选32跟这个数字杠上了挺好的，怎么不算另一种的没退步😂😂,王楚钦止步中国大满贯32强,中立
5084802358710195,OzA5ZAxV1,7318105045,80后梦想家,不用说，后面的王皓教练心情跟我一样，我就想不明白了，世界排名第一居然打不过排名20名开外的，论技术王楚钦应该是遥遥领先啊，我不得不怀疑，是不是这次的球拍又被人踩到了，导致心态问题，你们觉得呢？,王楚钦止步中国大满贯32强,中立
5084802344816162,OzA5YkcU2,6356947414,圆圆马歇尔,这次和球拍没关系了吧？,王楚钦止步中国大满贯32强,中立
5084802309162985,OzA5UCrI5,7851099251,Aloe小困神,没事没事，咱们下次加油,王楚钦止步中国大满贯32强,中立
5084786907415961,OzzH4v7eh,6259472802,是橙橙橙七,输了又如何一场比赛而已好好休息加油下次见,王楚钦止步中国大满贯32强,中立
5084786894839695,OzzH3kj1B,7556927659,nuYUA-,头哥好好休息，那些发表不正当言论的人嘴巴放干净点，网络不是法外之地，看看今天啥日子,王楚钦止步中国大满贯32强,"
支持"
