id,bid,user_id,用户昵称,微博正文,话题,立场倾向
5085104286994526,OzHWYtlAW,7516679696,九派新闻,10月1日晚，WTT中国大满贯男单次轮爆冷。世界第1王楚钦1∶3不敌世界排名仅列第50的25岁丹麦球手安德斯·林德，止步32强。林德成本届赛事最大黑马，这场比赛前，他与王楚钦仅有过一次交手。去年德班世乒赛，王楚钦在男单14决赛中4比1赢下了比赛。赛后林德表示没想到自己会赢，“王楚钦似乎也很紧张，出现了一些失误，所以我继续坚定执行此前奏效的战术策略。”身高1.83米的林德从小被誉为乒乓神童，曾5次获得丹麦国内单打冠军、5次混双冠军、2次男双冠军，但三年前他遭遇严重车祸，不确定能否正常行走，几乎断送职业生涯。车祸中林德折断两根椎骨，至今他背部还带着钢板，好在经历康复治疗，林德最终回到球台前。“对乒乓球的热爱让我坚持下来，练习太多会但，这不是我比赛的障碍。”@九派新闻,林德遭遇严重车祸至今仍带着钢板,中立
5084814367264982,OzApmutX8,5407877494,火箭吧微博,请问有孙颖莎和王楚钦的球迷吗？？我实在受不了了！！！为啥王楚钦输球了，他的粉丝们追着骂人呢？我觉得王楚钦本人挺好的，输球也正常，为啥一输球有这么多粉丝癫狂了呢…还有说对手球品不行的。。乒乓球连个肢体接触都没有，最多叫唤两声给自己打打气，都这么抽象了么？饭圈真是挺可怕啊…篮球界有正常，乒乓球咋也出现了呢？？人家就一混双组合，整的跟结婚了似的,"王楚钦止步中国大满贯32强,王皓表情","
强烈反对"
5084787183978274,OzzHwgGVI,3967371720,陈沫xk,大头你可是获得WTT冠军最多的人，好好调整，下个赛场继续努力,王楚钦止步中国大满贯32强,中立
5084787184500845,OzzHwiSSh,7572859127,香果茶茶,没关系我们下次赛场见，他们怎么说就怎么说吧，比赛不止一次，加油👏,王楚钦止步中国大满贯32强,"
支持"
5084787175853269,OzzHvoyHz,7457559448,是阿瑶瑶瑶,说楚钦不争气你们最争气把楚钦打下来你们上去打比赛吧省得楚钦赢了骂输了也骂🐶日的自己生活不如意也就能在网上刷刷存在感张嘴闭嘴3232咋?你们活不到32啊都撒尿照照自己行不行vb真是见证了物种多样性春天不是都过了吗？怎么还有一堆春竹“你骂他，他也是世界第一，下次比赛他还是主力”,王楚钦止步中国大满贯32强,"
强烈支持"
5084787172180491,OzzHv99fd,1834289821,河海一枝花,于比赛，他要去直面比赛结果，因为是自己一分一拍打出来的，需要他自己去总结。于网络，不要去辱骂运动员，没有人想输，但比赛总有输赢。也不要说今天输球就是添堵，祖国疼爱每一个积极向上努力拼搏的人。新的周期，它开启的有点低迷，但也因此给了更多的进步空间，最终梦想的加冕会在更大的舞台。如果你热爱他，就多去看他的比赛多去支持他。如果你热爱别人，那就多去看别人的比赛多去给别人加油。不要去诋毁任何人，因为每个人都是一样的珍贵。理解并尊重不同的喜欢，但不能认同偏激的言语、冒犯的行为，因为这真的非常没有礼貌。键盘后的每个人都是真实存在的，我相信人本善良，所以请别丢弃本性。如果你喜欢竞技体育，那就珍惜“现役”的他们。如果你只是限定的路人，那就享受竞技体育输赢的魅力，因为输赢没有应该。王楚钦加油@王楚钦___,王楚钦止步中国大满贯32强,"
支持"
5085910208615139,OA2UQA9bR,5482558341,CrazyNCEE,刚来，谁尽力、谁犯罪、谁的打法太针对、谁又没有人情味？,王楚钦止步中国大满贯32强,中立
5085731967730827,OzYhmwr8L,6192877183,篮球面对面,止步WTT中国大满贯32强，WTT中国大满贯男单第三轮，王楚钦以1-3负于丹麦选手林德，遗憾出局，林德下一轮将迎战高承睿。,王楚钦,中立
5085729775160884,OzYdPlEA4,1887503821,痛恨半月板,我是世界第一，你们是什么配得上评论我吗,王楚钦止步中国大满贯32强,中立
5085704941995922,OzXzM8nei,3344430680,BunnyAugfall__,我紧急来学一下32强话术，感觉快用上了。,王楚钦止步中国大满贯32强,中立
5085701177612824,OzXtHvWru,7817507959,蔡蔡真的不菜,就是没实力，头妈还要洗，拉踩其他人，怎么其他人也国庆输外协还32强吗？只有头妈溺爱，服了,王楚钦止步中国大满贯32强,强烈反对
5085690108840033,OzXbQB5Hb,5826253635,仙女没有昵称呀,好好吃饭好好睡觉，就是不提好好练球，可怕的是这哥还以为是心态问题，从不觉得是自己实力的问题粉丝捧的多高啊，三大赛没一块金牌，还在这沉淀呢,王楚钦止步中国大满贯32强,"
强烈反对"
5085256619131319,OzLUFCjtl,6991609835,大胆狮子爱放松,国乒大爆冷！王楚钦不敌丹麦选手林德，遗憾止步WTT32强10月1日晚8点20，WTT中国大满贯男单16强开赛，王楚钦...O千阅宝,,中立
5085250346549750,OzLKyrtT8,6605401979,网球看这里,10月1日，北京，王楚钦止步男单32强。少年总是充满重新开始的勇气，加油！我们下一个赛场再见。,"WTT中国大满贯,加油王楚钦,北京","
支持"
5085208892146189,OzKFH90jX,6192877183,篮球面对面,王楚钦在中国大满贯赛中止步32强，意外出局。,"wtt,国乒",中立
5085193055240765,OzKg9lZmt,6018436795,闲暇时加气站,皓哥球技卓越，偶像力量传承！王楚钦成皓哥儿子榜样，共赴中国乒乓大满贯之路！乒乓球荣耀，WTT赛场上的国乒辉煌！,"王楚钦,王楚钦止步中国大满贯32强",中立
5085192572109117,OzKfn8QG1,6041830417,天下篮球快报,在中国大满贯比赛中爆出冷门，以1-3不敌丹麦选手林德，再度止步32强。赛前他的状态就不理想。,"王楚钦,wtt",中立
5084813822790977,OzAoubI3L,5325717502,长江国际传播中心,王楚钦中国大满贯止步32强,"WTT,王楚钦",中立
5084813709804353,OzAoiF8yJ,7810160845,祈佑之念,"善良是春日里的和煦微风,善良是炎热夏日的清凉饮品,善良是秋日收获的喜悦,善良是冬日里温暖的阳光。善良是一种纯洁的心地,善良是一种美好的意愿,善良是一种美好的境界。",王楚钦止步中国大满贯32强,中立
5084813621203388,OzAoa533u,7875765469,梨枝叽眠,没关系的，没关系，下次努力就好了，这次可能是个遗憾，下次把遗憾填补,王楚钦止步中国大满贯32强,中立
5084813048679752,OzAneAq00,7645891052,美人就该吃荔枝_,没事哒没事哒，继续加油啊！！！,王楚钦止步中国大满贯32强,"
支持"
5084787167988272,OzzHuxw76,5101328685,旺旺旺旺仔小馒头i,技体育有输有赢没有谁是常胜将军骂运动员替他挡灾,王楚钦止步中国大满贯32强,中立
5085687071899757,OzX6X7Ydf,7410059160,诀别月下凛冬,求求了不要拉前辈32啊，在招笑吗？拉的那些前辈zjkmlcmfzd……嘲他们32的时候能不能看看他们的战绩啊，有问题自己去总结反思，拉前辈是什么鬼？,王楚钦止步中国大满贯32强,"
中立"
5085668204349010,OzWCwifnk,6657266894,墨迹乒乓手,三年前因车祸险些瘫痪，重生的他爆冷击败了世界第一的王楚钦王楚钦止步中国大满贯32强,林德进中国大满贯8强,中立
5085666186888475,OzWzgsU0r,7024463384,山雨非00706,被粉丝追着骂没用废柴，那我只能回敬给你了，毕竟成绩说话,王楚钦止步中国大满贯32强,"
支持"
5085656925602659,OzWkknvvt,3199312252,大脸猫4159,看了奥运会和上次澳门他的比赛，觉得今天这样的成绩，一点也不意外，打球很不稳定，该是比赛大忌吧，纯属于好奇？中国这样乒乓球大国，怎么就一而再再而三的每次都有他？再看看马龙，还有樊正东，这差距可不是一星半点，这样一对比，喜欢马龙和樊正东，他们两个才是正常国人的榜样吧！,王楚钦止步中国大满贯32强,反对
5085181087847765,OzJWQwVyR,7838210160,可爱的小灵猫,2024年10月1日(周二），男单1/16决赛，王楚钦@王楚钦___1比3不敌丹麦选手林德，止步男单32强。@央视新闻@建业-守望中国乒乓球梦之队超话,WTT中国大满贯,中立
5084813006736830,OzAnasgyy,6871944128,渣叔说球,竞技场输赢很正常，不要给运动员那么大的压力,王楚钦止步中国大满贯32强,中立
5084812927041631,OzAn2txQH,7534693745,娱清风,王楚钦超话谁懂啊简直帅疯了！最后那个动作赢了把球拍开，好喜欢王楚欣打球的风格，稳准狠场上有气势，球技一流王楚钦｜wtt中国大满贯,王楚钦止步中国大满贯32强,"
强烈支持"
5084812781553440,OzAmO6w7u,5633149822,娇艳欲滴大芒果,太幽默了……32，卫冕了32！不会完成32强大满贯吧？不久前热搜还是光速进32强没关系，少年从不缺重头再来的勇气，但是王皓的命也是命。anyway，谢谢王楚钦这两个月带来的快乐,王楚钦止步中国大满贯32强,中立
5084812655726256,OzAmBo1EY,5227110273,麦田蓑笠翁,胜败乃兵家常事，理解！,王楚钦止步中国大满贯32强,中立
5084812503418462,OzAmmeliu,7562812831,豆味小涵_,哥还是沉下心好好休息吧,王楚钦止步中国大满贯32强,中立
5084787147018845,OzzHstrVb,7775199676,802bingo,输了确实就是输了归根到底不可否认的其实还是不够强不够稳涨球调心态充分发挥才是重要的vb在幸灾乐祸啥,王楚钦止步中国大满贯32强,中立
5084787145971908,OzzHsp3z6,6847929290,Innocence无邪,我有时候真的会被气笑，32是什么魔咒吗？,王楚钦止步中国大满贯32强,中立
5084787140200912,OzzHs0Qgw,7741472322,紫米粥不稀,没事没事，以后继续加油,王楚钦止步中国大满贯32强,中立
5085634361819351,OzVJW7Din,2799646370,CC-love07,为啥说是爆冷，这不又是32吗？32拿32，名副其实,王楚钦爆冷止步中国大满贯32强,中立
5085561910722715,OzTR5320H,6369807857,流沙抹茶麻薯,场场爆冷国乒制冰机非32强莫属了🥶,王楚钦止步中国大满贯32强,中立
5085551873756805,OzTATfLjD,6090644987,灌篮大风车,王楚钦以1比3负于林德，止步于WTT中国大满贯32强。,王楚钦,中立
5084812177838456,OzAlPwT8I,6609180008,叶刷我滴神_钱包空空版,这次又是怎么了是喜欢32这个数字吗粉丝别搞饭圈那套挽尊了还是少营销多训练吧,王楚钦止步中国大满贯32强,反对
5084812057251189,OzAlDuqmF,7358060569,美貌小佳,可能球拍又换了，不合手吧,王楚钦止步中国大满贯32强,中立
5084812036017990,OzAlBpfym,7902863911,萌龙研究员,不会的，李健所言：“善良的心灵并非漫山遍野，但也如点点繁星照亮黑夜。”这句咏史之词，将善良的力量与光芒娓娓道来。在纷繁复杂的世界中，我们需要坚守善良之道，以小善来滋润人心，以一点点繁星的光辉点亮黑夜的彼岸，让人类的善良之心成为希望与温暖的源泉。,王楚钦止步中国大满贯32强,中立
5084811905470124,OzAlomX1O,7719230468,树上好像有只兔,王楚钦止步中国大满贯32强赛后握手祝贺对手,,中立
5084811886856407,OzAlmsLFd,1570223414,黑林斯曼,其实吧……输个球，挺正常的如今这吵来吵去看着真不知道该说点啥……,王楚钦止步中国大满贯32强,中立
5084787138625649,OzzHrAbVn,6472048439,呆龙耶耶冰,输赢很正常，平常心看待啦，好好休息,王楚钦止步中国大满贯32强,中立
5084787131816836,OzzHr7CDO,7087892756,双星仰望,真服了没必要那么大恶意吧技术是要一步步加强的稳定性也是要慢慢提的有些人真是不用站着说话不腰疼了只想看赢接受不了一点输说实在的你行你上啊,王楚钦止步中国大满贯32强,中立
5084787129193269,OzzHqCzAx,3266214013,俊俏的小羽子,听了林德的赛后采访，他的确针对大头做出了很好的应变，大头心态受到影响，没能及时调整，反而有些急了，，很多机会球没拉上，不过没关系，总结经验，下个赛场见，，,"wtt中国大满贯2024,王楚钦止步中国大满贯32强",中立
5084811812930886,OzAlfcism,5666005614,企鹅体育,发布了头条文章：《又止步32强的世界第一&挑战世界第一不落下风！项目虽不同差距有些大》O又止步32强的世界第一＆挑战世界第一不落下风！项目虽不同差距有些大,"王楚钦止步中国大满贯32强,王楚钦1比3林德,布云朝克特止步中网四强",中立
5084811482631928,OzAkIb2Gs,6035473605,淫栀颂予轩_初三住宿版,有些人就是成功的时候你不夸，失意的时候喜欢反踩几脚。运动员为国争光有啥好喷的,王楚钦止步中国大满贯32强,中立
5084811469785934,OzAkGF3LE,7295816081,关你奻事,检测到王楚钦自动输入32,王楚钦止步中国大满贯32强,中立
5084811465591970,OzAkGnsJ4,5147726162,Dear-追着热巴穿毛裤,我们只是看客，路过他们的荣耀或者低迷小王继续努力💪,王楚钦止步中国大满贯32强,中立
5084787129453097,OzzHqDFbj,7473224537,末日老妈,追明星要追漂亮的，追演员要追演技好得奖的，追体育运动员要追成绩好的，我话说完，谁赞成谁反对,王楚钦止步中国大满贯32强,中立
5084787130500887,OzzHr26iP,5067763867,深海航行向导,真的得好好反省复盘了倒在同类型选手身上两次了，心态，技战术，处理问题的能力，都有很大的问题。我才刚在B站的“乒乓Q奇”上看完“世界排名第一王楚钦”的技术分析，看的热血沸腾，直呼🐮逼，结果今天打的这一场这状态…也差太远了吧千万得缓过来啊,王楚钦止步中国大满贯32强,"
反对"
5084811221800282,OzAki7ykO,1363450462,飞扬发髻,不用看都知道这话题下吵得会有多厉害！,王楚钦止步中国大满贯32强,中立
5084811165171863,OzAkclHr9,7821463174,辰性恋-,咋这么好笑实在不行就回去练吧,王楚钦止步中国大满贯32强,中立
5084811056385171,OzAk1qN4D,1930091693,叽米餐,这位也是稳定发挥哈大好的日子又给国球丢人了还是好好过国庆节吧大家,王楚钦止步中国大满贯32强,中立
5084810979050591,OzAjTBYth,3176105483,苍龙飞天79,🏓️林德赛后接受咪咕独家采访：我这场比赛放慢了节奏，如果打快节奏的比赛，王楚钦是最优秀的选手，今天他犯了一些错误，没有发挥最佳的水平。@咪咕视频全程直播本站比赛，欢迎收看。,"林德回应战胜王楚钦,林德说王楚钦没发挥最佳水平,王楚钦止步中国大满贯32强",中立
5084787122114842,OzzHq8Sam,6385893605,可是我叫什么名字呢,那不然先归还蒙彼利埃的参赛资格吧,王楚钦止步中国大满贯32强,中立
5084787116873893,OzzHpsQdf,7817034952,有事要养朱,哈哈哈哈哈哈哈哈哈哈哈哈哈哈哈哈三十二强真是快哉快哉！,王楚钦止步中国大满贯32强,"
强烈反对"
5084787112677675,OzzHpbeAj,1808189175,瓜瓜九块九,发挥很稳定哇，依然是32强,王楚钦止步中国大满贯32强,中立
5084810840117900,OzAjG0uFC,7555436264,颖匿名玫瑰,你说的对，可是老干妈的酸辣并不能为广东肠粉提鲜，反而黄焖鸡米饭更让我感觉吃得放心；而实际上俄罗斯的优势在于地广人稀，假设元神的成功可以带领中国单机游戏旭日东升，那么我觉得穿西装的话，还是打领带比较得体一些,王楚钦止步中国大满贯32强,中立
5084810813114192,OzAjDd48U,3083675764,体坛星闻社,🏓️林德的手感很热一度占据上风，解说嘉宾闫安表示：@王楚钦___要熬过现在的这个艰难阶段。,"闫安说王楚钦要熬过艰难的阶段,王楚钦止步中国大满贯32强",中立
5084810667884949,OzAjox5eB,6863464858,劣性本,没事男神超话粉丝比林德多,王楚钦止步中国大满贯32强,中立
5084787110847241,OzzHp3ypb,5112219708,独立州的司理事,好好好，没想到还是一部连续剧,王楚钦止步中国大满贯32强,中立
5084810366944053,OzAiUt8sR,5999779018,太岁神殷郊,不太关注体育圈，这个名字我记得上次奥运是不是也止步32强？,王楚钦止步中国大满贯32强,中立
5084810036908855,OzAinsZj9,6453634811,等风来的金鱼姬,要向小胖多学习学习，多练练吧。,王楚钦止步中国大满贯32强,中立
5084809978188412,OzAihymba,6100199096,兔湫萌妹,一声32，一生32。疑似人生数字哈，国庆节大好日子又32了,王楚钦止步中国大满贯32强,中立
5084809923664903,OzAicfnpl,6119482802,心慈手软王胖子,王皓：球都没打起来过！！没事头那就下一个赛场见！,"王皓表情,王楚钦止步中国大满贯32强",中立
5084809875688438,OzAi7nRP0,5733335063,纷纷扰扰雨我无瓜-,没关系我们哥哥杂志销量最高,王楚钦止步中国大满贯32强,"
支持"
5084809861006355,OzAi64dNx,7585304615,文春指定凛冬雪樱,32算正常水平吧也打过64128也不是第一次爆冷了一搜老多次了,"王楚钦止步中国大满贯32强,王楚钦爆冷出局",中立
5084787098522490,OzzHnzL5w,7879684357,麻辣小兔纸u,好好总结经验我们下场比赛见！,王楚钦止步中国大满贯32强,中立
5084787098263754,OzzHnyFMm,1729335573,水之源by,多一位不能多，少一位不能少！名副其实32！不服👊👊,王楚钦止步中国大满贯32强,中立
5084787100878280,OzzHo3GtO,6373739726,吃橙子还是柚子,王楚钦，大胆往前走啊～,王楚钦止步中国大满贯32强,中立
5084809695856820,OzAhPozCQ,2456552000,耶爷嘢业,没有三大赛冠军。奥运没单打冠军。但是宣传是奥运金牌选手。有点像硬把王一博王俊凯往电影电视剧里塞然后蹭奖的感觉,"王楚钦止步中国大满贯32强,王楚钦1比3林德","
强烈反对"
5084809611448221,OzAhH64Kp,7671025814,戏屿珮遇,加油王楚钦下一次更好不至于此,王楚钦止步中国大满贯32强,中立
5084809284027959,OzAhagTR5,6609146446,勇圆柿煎泥,恭喜卫冕32强《剧如本》《乒如演》《快乐乒乓》《健康涨球就好》《打着玩》《松弛感》《练技术》《商业赛认真干嘛》《发球好可爱》《这下洛杉矶不用兼项了》《左手不易》《王老师下届可以完成自己的梦想了》《没关系还是世一》《新发球以后是一种武器》《外协都夸国内都骂》《男足都没怎样奥运冠军天天被骂》,王楚钦止步中国大满贯32强,中立
5084787104022889,OzzHogSxj,1649188893,人生若只如初见HAPPY-EVERYDAY,竞技比赛输赢其实都正常。但作为种子选手，输的有点太太后了。相当于过了一轮。,王楚钦止步中国大满贯32强,中立
5084787088560266,OzzHmzUUO,7269256426,LornaLovegood,别把我笑死了哈哈哈哈哈哈哈哈哈,"王楚钦光速进32强,王楚钦止步中国大满贯32强",中立
5084787083838795,OzzHmg6E3,5401196105,tttyyysstt,也不知道你们说运动员安的什么心这都要骂没有人规定他一定要赢一定要拿冠军吧其他球员输了怎么没动静专逮着他不放,王楚钦止步中国大满贯32强,"
支持"
5084808705737528,OzAgeo4AM,6526198314,无与伦比_13,大哥你真的是世界第一吗？咱也不能老在32强被淘汰啊,王楚钦止步中国大满贯32强,"
反对"
5084808683717604,OzAgcfB7m,1671109627,包容万物恒河水,🔻我实话实说，刚才之前，我都不认识这个林德是谁，听人说世界排名才50？🔻“感到惊讶”是普通人很正常的感觉啊，比赛之前我们不可能盼着中国选手输吧？,王楚钦止步中国大满贯32强,中立
5084787079645298,OzzHlEtbk,7165628947,轩哥的小迷妹一枚,捂住耳朵继续前行，相信大头。加油加油。,王楚钦止步中国大满贯32强,"
支持"
5084787074664755,OzzHljzvZ,2877453915,Traianwang,世界第一的含金量哈哈哈哈哈哈哈哈哈哈哈哈哈哈哈哈哈,王楚钦止步中国大满贯32强,中立
5084787075977815,OzzHlp56n,3691307417,硫酸爱吃辣舞鸡,或许他的实力就只能到32强了,王楚钦止步中国大满贯32强,中立
5084808562086947,OzAg08KUr,6553667483,-千山亭云,这个话题怎么这么多人，第一次见17w人正在讨论的热搜，而且还是体育热搜,王楚钦止步中国大满贯32强,中立
5084808531414838,OzAfX5W3Y,1159610173,环球书屋,我一直有这样一个观点，乒乓球运动员目前在国内承载的关注和讨论应该是除三大球外之最，因此这个项目运动员承受的压力也是最大。巴黎奥运会之后，不到一个月就是澳门冠军赛，不到两个月就是北京大满贯，比赛密度大家都心里有数。这种比赛密度、外界压力、舆论环境之下，运动员状态起伏、发挥失常，大家狂风暴雨去评说不会给中国体育带来多大帮助，倒是会给这个团队和个人都带来更多压力。我觉得吧，二十多岁的年轻人，谁在这个年纪不出错呢。,王楚钦止步中国大满贯32强,中立
5084808528790231,OzAfWASJV,2552207342,剧荒终结,王楚钦又爆冷了。一时之间还以为是时间打错了…,王楚钦止步中国大满贯32强,中立
5084808508867630,OzAfUBcSi,2623241282,摔了一个屁股蹲儿,人不可能同时。。。。啊。。。人真的可能,王楚钦止步中国大满贯32强,中立
5084808378581223,OzAfHA0mP,3523916795,付虹医生,前天我刚看了比赛，，当时感觉大头太帅了，今天有点不能接受这个结果。孙颖莎和王楚钦是我关注的两个乒乓球运动员，两个世界第一。希望莎莎快乐比赛到夺冠。大头就好好休息休息吧，别给自己那么大压力。,"王楚钦止步中国大满贯32强,王楚钦光速进32强",中立
5084787066278344,OzzHkqlhC,6414341483,此ID被匿名,肯定是上次被踩断拍子新拍子现在还没适应过来，都是拍子的错，我们世一怎么可能次次32哈哈哈哈哈哈哈哈哈哈哈哈,王楚钦止步中国大满贯32强,中立
5084787064701948,OzzHkjJbS,7499235953,MOKIN5871,说换人的np没人了np完了,王楚钦止步中国大满贯32强,中立
5084787062610391,OzzHkaX55,2011075080,齐鲁晚报,🏓️林德赛后采访：我这场比赛放慢了节奏，如果打快节奏的比赛，王楚钦是最优秀的选手，今天他犯了一些错误，没有发挥最佳的水平。,"林德回应战胜王楚钦,林德说王楚钦没发挥最佳水平,王楚钦止步中国大满贯32强",中立
5084808287883062,OzAfyx4Ka,5098102480,今天和我聊天了吗,笑死不说别的…粉丝找的理由是对手犯规太多裁判不公正是认真的吗…竞技体育哪有绝对的公平啊…要不然有空去看看我们蹴鞠的裁判…,王楚钦止步中国大满贯32强,"
反对"
5084808185384533,OzAfomALj,6329990943,Hellofisho,已穿越，原来奥运还没打完,王楚钦止步中国大满贯32强,中立
5084808179092237,OzAfnC9iZ,6017734973,·鱼肚不肥·,对面这位是在这是在干嘛啊,王楚钦止步中国大满贯32强,中立
5084808122211001,OzAfi9hbj,7631994641,蛙库蛙库_,我服了，跟32杠上了？是技术问题还是心态问题还是都有问题，自己好好思考思考吧，别沉浸在粉丝的追捧中，脑子放清醒一点,王楚钦止步中国大满贯32强,"
强烈反对"
5084808109887650,OzAfgFuee,6288894822,跳跳DG,这个词条，莫名贴切，毕竟刚刚光速进来的，出去的也很光速，这何尝不是一种利索呢。,王楚钦光速止步中国大满贯32强,中立
5084787062872983,OzzHkc3or,5996295218,你要拉我的手吗,渣浪别可着一个往死里薅了。磕人血的样子好卑鄙竞技比赛起起伏伏有什么奇怪的吗？王楚钦，好好休息，调整状态，重新再来！今天收到的诋毁，明天都会变成动力！加油💪💪💪,王楚钦止步中国大满贯32强,支持
5084787059199270,OzzHjCB9k,6288207285,xslcbdcks,王楚钦是一个很稳定的选手，跟上次重大赛事巴黎奥运会比的话依旧是32强，我们的宝藏男孩希望下次继续保持👍🏻,王楚钦止步中国大满贯32强,中立
5084787058935997,OzzHjBuEZ,7588688734,天界爱吃烧妤,32强……抱歉，刚刚又在想32强了，我不禁又开始想，怎么又32强……抱歉，你的32强呢！真的很对不起，我又在想32强了……,王楚钦止步中国大满贯32强,中立
5084787053694040,OzzHjfuZi,7795347772,仙草明星,成功卫冕32强？咋不向你老婆厘米姐学点好的,王楚钦止步中国大满贯32强,反对
5084787053955855,OzzHjgB67,7865786622,反派呆呆兽,啊啊啊啊啊啊啊王楚钦辛苦了！好好休息下次再继续加油！,王楚钦止步中国大满贯32强,支持
5084787054742707,OzzHjjTNh,7427358243,小凡是個經神患者,那些说王楚钦的，请问你们是很高尚的人吗，什么人生数字，比赛有输有赢，你们就是见不得他好是吧，请认真看比赛好吧，接受输赢的前提下，是在进行一场公平公正的比赛，什么都不看，就看结果，你可真高尚，那这样的话，那你看的每一个人不都是死人，因为人最终的结果不过是化作一抔黄土，md笑死了，刚一结束，热搜蹭蹭的涨，黑粉不断，怎么就他输了一场比赛，你们就得瑟成这样，见不得他好，就找他的黑点，大家可真够闲的，闲的要命，笑死我了，,王楚钦止步中国大满贯32强,"
强烈支持"
